{
  "question": "在加大房地产市场宏观调控的形势下，某市政府对该市房地产开发的管理现状进行检查，发现以下情况，其中哪些做法是需要纠正的？",
  "options": {
    "A": "房地产建设用地的供应，在充分利用现有建设用地的同时，放宽占用农用地和开发未利用地的条件",
    "B": "土地使用权出让，符合土地利用总体规划、城市规划或年度建设用地计划之一即可",
    "C": "预售商品房，要求开发商交清全部土地使用权出让金，取得土地使用权证书，并持有建设工程规划许可证等",
    "D": "采取税收减免等方面的优惠措施，鼓励房地产开发企业开发建设商业办公类住宅，方便市民改作居住用途"
  },
  "answer_idx": "ABD",
  "answer": "房地产建设用地的供应，在充分利用现有建设用地的同时，放宽占用农用地和开发未利用地的条件。土地使用权出让，符合土地利用总体规划、城市规划或年度建设用地计划之一即可。采取税收减免等方面的优惠措施，鼓励房地产开发企业开发建设商业办公类住宅，方便市民改作居住用途",
  "process_id": 108,
  "options_str": "A. 房地产建设用地的供应，在充分利用现有建设用地的同时，放宽占用农用地和开发未利用地的条件\nB. 土地使用权出让，符合土地利用总体规划、城市规划或年度建设用地计划之一即可\nC. 预售商品房，要求开发商交清全部土地使用权出让金，取得土地使用权证书，并持有建设工程规划许可证等\nD. 采取税收减免等方面的优惠措施，鼓励房地产开发企业开发建设商业办公类住宅，方便市民改作居住用途",
  "gpt_filter_query": "<Multiple-choice Question>\n在加大房地产市场宏观调控的形势下，某市政府对该市房地产开发的管理现状进行检查，发现以下情况，其中哪些做法是需要纠正的？\nA. 房地产建设用地的供应，在充分利用现有建设用地的同时，放宽占用农用地和开发未利用地的条件\nB. 土地使用权出让，符合土地利用总体规划、城市规划或年度建设用地计划之一即可\nC. 预售商品房，要求开发商交清全部土地使用权出让金，取得土地使用权证书，并持有建设工程规划许可证等\nD. 采取税收减免等方面的优惠措施，鼓励房地产开发企业开发建设商业办公类住宅，方便市民改作居住用途\nCorrect Answer: 房地产建设用地的供应，在充分利用现有建设用地的同时，放宽占用农用地和开发未利用地的条件。土地使用权出让，符合土地利用总体规划、城市规划或年度建设用地计划之一即可。采取税收减免等方面的优惠措施，鼓励房地产开发企业开发建设商业办公类住宅，方便市民改作居住用途\n</Multiple-choice Question>\n\nYou are an expert in filtering and evaluating multiple-choice questions for advanced reasoning tasks. Your job is to evaluate a given question and determine whether it meets the following criteria: \n1. **Depth of Reasoning:** The question should require deeper reasoning. If the question appears too simple, mark it as \"Too Simple\".\n2. **Unambiguous Correct Answer:** The question must have a unique and unambiguous correct answer. If the question asks for \"incorrect options\" or allows for multiple correct answers, mark it as \"Ambiguous Answer\".\n3. **Open-Ended Reformulation Feasibility:** The question should be suitable for reformatting into an open-ended format. If the question cannot be easily reformulated into an open-ended problem and a clear ground-truth answer, mark it as \"Not Reformulatable\".\n\nFor each question, provide one of the following evaluations:  \n- \"Pass\" (The question meets all the criteria.)  \n- \"Too Simple\"  \n- \"Ambiguous Answer\"  \n- \"Not Reformulatable\" ",
  "gpt_filter_response": "Ambiguous Answer"
}