{
  "question": "甲知道乙计划前往丙家抢劫,为帮助乙取得财物，便暗中先赶到丙家，将丙打昏后离去（丙受轻伤）。乙来到丙家时，发现丙已昏迷，以为是丙疾病发作晕倒，遂从丙家取走价值5万元的财物。关于本案的分析，下列哪些选项是正确的？",
  "options": {
    "A": "若承认片面共同正犯，甲对乙的行为负责，对甲应以抢劫罪论处，对乙以盗窃罪论处",
    "B": "若承认片面共同正犯，根据部分实行全部责任原则，对甲、乙二人均应以抢劫罪论处",
    "C": "若否定片面共同正犯，甲既构成故意伤害罪，又构成盗窃罪，应从一重罪论处",
    "D": "若否定片面共同正犯，乙无须对甲的故意伤害行为负责，对乙应以盗窃罪论处"
  },
  "answer_idx": "ACD",
  "answer": "若承认片面共同正犯，甲对乙的行为负责，对甲应以抢劫罪论处，对乙以盗窃罪论处。若否定片面共同正犯，甲既构成故意伤害罪，又构成盗窃罪，应从一重罪论处。若否定片面共同正犯，乙无须对甲的故意伤害行为负责，对乙应以盗窃罪论处",
  "process_id": 119,
  "options_str": "A. 若承认片面共同正犯，甲对乙的行为负责，对甲应以抢劫罪论处，对乙以盗窃罪论处\nB. 若承认片面共同正犯，根据部分实行全部责任原则，对甲、乙二人均应以抢劫罪论处\nC. 若否定片面共同正犯，甲既构成故意伤害罪，又构成盗窃罪，应从一重罪论处\nD. 若否定片面共同正犯，乙无须对甲的故意伤害行为负责，对乙应以盗窃罪论处",
  "gpt_filter_query": "<Multiple-choice Question>\n甲知道乙计划前往丙家抢劫,为帮助乙取得财物，便暗中先赶到丙家，将丙打昏后离去（丙受轻伤）。乙来到丙家时，发现丙已昏迷，以为是丙疾病发作晕倒，遂从丙家取走价值5万元的财物。关于本案的分析，下列哪些选项是正确的？\nA. 若承认片面共同正犯，甲对乙的行为负责，对甲应以抢劫罪论处，对乙以盗窃罪论处\nB. 若承认片面共同正犯，根据部分实行全部责任原则，对甲、乙二人均应以抢劫罪论处\nC. 若否定片面共同正犯，甲既构成故意伤害罪，又构成盗窃罪，应从一重罪论处\nD. 若否定片面共同正犯，乙无须对甲的故意伤害行为负责，对乙应以盗窃罪论处\nCorrect Answer: 若承认片面共同正犯，甲对乙的行为负责，对甲应以抢劫罪论处，对乙以盗窃罪论处。若否定片面共同正犯，甲既构成故意伤害罪，又构成盗窃罪，应从一重罪论处。若否定片面共同正犯，乙无须对甲的故意伤害行为负责，对乙应以盗窃罪论处\n</Multiple-choice Question>\n\nYou are an expert in filtering and evaluating multiple-choice questions for advanced reasoning tasks. Your job is to evaluate a given question and determine whether it meets the following criteria: \n1. **Depth of Reasoning:** The question should require deeper reasoning. If the question appears too simple, mark it as \"Too Simple\".\n2. **Unambiguous Correct Answer:** The question must have a unique and unambiguous correct answer. If the question asks for \"incorrect options\" or allows for multiple correct answers, mark it as \"Ambiguous Answer\".\n3. **Open-Ended Reformulation Feasibility:** The question should be suitable for reformatting into an open-ended format. If the question cannot be easily reformulated into an open-ended problem and a clear ground-truth answer, mark it as \"Not Reformulatable\".\n\nFor each question, provide one of the following evaluations:  \n- \"Pass\" (The question meets all the criteria.)  \n- \"Too Simple\"  \n- \"Ambiguous Answer\"  \n- \"Not Reformulatable\" ",
  "gpt_filter_response": "Ambiguous Answer"
}