{
  "question": "下列哪些选项中的甲属于犯罪未遂？",
  "options": {
    "A": "甲让行贿人乙以乙的名义办理银行卡，存入50万元，乙将银行卡及密码交给甲。甲用该卡时，忘记密码，不好意思再问乙。后乙得知甲被免职，将该卡挂失取回50万元",
    "B": "甲、乙共谋傍晚杀丙，甲向乙讲解了杀害丙的具体方法。傍晚乙如约到达现场，但甲却未去。乙按照甲的方法杀死丙",
    "C": "乙欲盗窃汽车，让甲将用于盗窃汽车的钥匙放在乙的信箱。甲同意，但错将钥匙放入丙的信箱，后乙用其他方法将车盗走",
    "D": "甲、乙共同杀害丙，以为丙已死，甲随即离开现场。一个小时后，乙在清理现场时发现丙未死，持刀杀死丙"
  },
  "answer_idx": "CD",
  "answer": "乙欲盗窃汽车，让甲将用于盗窃汽车的钥匙放在乙的信箱。甲同意，但错将钥匙放入丙的信箱，后乙用其他方法将车盗走。甲、乙共同杀害丙，以为丙已死，甲随即离开现场。一个小时后，乙在清理现场时发现丙未死，持刀杀死丙",
  "process_id": 12,
  "options_str": "A. 甲让行贿人乙以乙的名义办理银行卡，存入50万元，乙将银行卡及密码交给甲。甲用该卡时，忘记密码，不好意思再问乙。后乙得知甲被免职，将该卡挂失取回50万元\nB. 甲、乙共谋傍晚杀丙，甲向乙讲解了杀害丙的具体方法。傍晚乙如约到达现场，但甲却未去。乙按照甲的方法杀死丙\nC. 乙欲盗窃汽车，让甲将用于盗窃汽车的钥匙放在乙的信箱。甲同意，但错将钥匙放入丙的信箱，后乙用其他方法将车盗走\nD. 甲、乙共同杀害丙，以为丙已死，甲随即离开现场。一个小时后，乙在清理现场时发现丙未死，持刀杀死丙",
  "gpt_filter_query": "<Multiple-choice Question>\n下列哪些选项中的甲属于犯罪未遂？\nA. 甲让行贿人乙以乙的名义办理银行卡，存入50万元，乙将银行卡及密码交给甲。甲用该卡时，忘记密码，不好意思再问乙。后乙得知甲被免职，将该卡挂失取回50万元\nB. 甲、乙共谋傍晚杀丙，甲向乙讲解了杀害丙的具体方法。傍晚乙如约到达现场，但甲却未去。乙按照甲的方法杀死丙\nC. 乙欲盗窃汽车，让甲将用于盗窃汽车的钥匙放在乙的信箱。甲同意，但错将钥匙放入丙的信箱，后乙用其他方法将车盗走\nD. 甲、乙共同杀害丙，以为丙已死，甲随即离开现场。一个小时后，乙在清理现场时发现丙未死，持刀杀死丙\nCorrect Answer: 乙欲盗窃汽车，让甲将用于盗窃汽车的钥匙放在乙的信箱。甲同意，但错将钥匙放入丙的信箱，后乙用其他方法将车盗走。甲、乙共同杀害丙，以为丙已死，甲随即离开现场。一个小时后，乙在清理现场时发现丙未死，持刀杀死丙\n</Multiple-choice Question>\n\nYou are an expert in filtering and evaluating multiple-choice questions for advanced reasoning tasks. Your job is to evaluate a given question and determine whether it meets the following criteria: \n1. **Depth of Reasoning:** The question should require deeper reasoning. If the question appears too simple, mark it as \"Too Simple\".\n2. **Unambiguous Correct Answer:** The question must have a unique and unambiguous correct answer. If the question asks for \"incorrect options\" or allows for multiple correct answers, mark it as \"Ambiguous Answer\".\n3. **Open-Ended Reformulation Feasibility:** The question should be suitable for reformatting into an open-ended format. If the question cannot be easily reformulated into an open-ended problem and a clear ground-truth answer, mark it as \"Not Reformulatable\".\n\nFor each question, provide one of the following evaluations:  \n- \"Pass\" (The question meets all the criteria.)  \n- \"Too Simple\"  \n- \"Ambiguous Answer\"  \n- \"Not Reformulatable\" ",
  "gpt_filter_response": "Ambiguous Answer"
}