{
  "question": "甲涉嫌利用木马程序盗取Q币并转卖他人，公安机关搜查其住处时，发现一个U盘内存储了用于盗取账号密码的木马程序。关于该U盘的处理，下列哪些选项是正确的？",
  "options": {
    "A": "应扣押U盘并制作笔录",
    "B": "检查U盘内的电子数据时，应将U盘拆分过程进行录像",
    "C": "公安机关移送审查起诉时，对U盘内提取的木马程序，应附有该木马程序如何盗取账号密码的说明",
    "D": "如U盘未予封存，且不能补正或作出合理解释的，U盘内提取的木马程序不得作为定案的根据"
  },
  "answer_idx": "ABCD",
  "answer": "应扣押U盘并制作笔录。检查U盘内的电子数据时，应将U盘拆分过程进行录像。公安机关移送审查起诉时，对U盘内提取的木马程序，应附有该木马程序如何盗取账号密码的说明。如U盘未予封存，且不能补正或作出合理解释的，U盘内提取的木马程序不得作为定案的根据",
  "process_id": 120,
  "options_str": "A. 应扣押U盘并制作笔录\nB. 检查U盘内的电子数据时，应将U盘拆分过程进行录像\nC. 公安机关移送审查起诉时，对U盘内提取的木马程序，应附有该木马程序如何盗取账号密码的说明\nD. 如U盘未予封存，且不能补正或作出合理解释的，U盘内提取的木马程序不得作为定案的根据",
  "gpt_filter_query": "<Multiple-choice Question>\n甲涉嫌利用木马程序盗取Q币并转卖他人，公安机关搜查其住处时，发现一个U盘内存储了用于盗取账号密码的木马程序。关于该U盘的处理，下列哪些选项是正确的？\nA. 应扣押U盘并制作笔录\nB. 检查U盘内的电子数据时，应将U盘拆分过程进行录像\nC. 公安机关移送审查起诉时，对U盘内提取的木马程序，应附有该木马程序如何盗取账号密码的说明\nD. 如U盘未予封存，且不能补正或作出合理解释的，U盘内提取的木马程序不得作为定案的根据\nCorrect Answer: 应扣押U盘并制作笔录。检查U盘内的电子数据时，应将U盘拆分过程进行录像。公安机关移送审查起诉时，对U盘内提取的木马程序，应附有该木马程序如何盗取账号密码的说明。如U盘未予封存，且不能补正或作出合理解释的，U盘内提取的木马程序不得作为定案的根据\n</Multiple-choice Question>\n\nYou are an expert in filtering and evaluating multiple-choice questions for advanced reasoning tasks. Your job is to evaluate a given question and determine whether it meets the following criteria: \n1. **Depth of Reasoning:** The question should require deeper reasoning. If the question appears too simple, mark it as \"Too Simple\".\n2. **Unambiguous Correct Answer:** The question must have a unique and unambiguous correct answer. If the question asks for \"incorrect options\" or allows for multiple correct answers, mark it as \"Ambiguous Answer\".\n3. **Open-Ended Reformulation Feasibility:** The question should be suitable for reformatting into an open-ended format. If the question cannot be easily reformulated into an open-ended problem and a clear ground-truth answer, mark it as \"Not Reformulatable\".\n\nFor each question, provide one of the following evaluations:  \n- \"Pass\" (The question meets all the criteria.)  \n- \"Too Simple\"  \n- \"Ambiguous Answer\"  \n- \"Not Reformulatable\" ",
  "gpt_filter_response": "Pass",
  "gpt_reformat_query": "I will provide you with a multiple-choice question, and your task is to rewrite it into an open-ended question, along with a Ground-True Answer. The requirements are:\n\n1. The question must be specific, targeting the point being tested in the original multiple-choice question. Ensure it is open-ended, meaning no options are provided, but there must be a definitive Ground-True Answer.\n2. Based on the correct answer from the original question, provide a concise Ground-True Answer. The answer should allow for precise matching to determine whether the model's response is correct.\n\nHere is the multiple-choice question for you to rewrite:\n<Multiple-choice Question>\n甲涉嫌利用木马程序盗取Q币并转卖他人，公安机关搜查其住处时，发现一个U盘内存储了用于盗取账号密码的木马程序。关于该U盘的处理，下列哪些选项是正确的？\nA. 应扣押U盘并制作笔录\nB. 检查U盘内的电子数据时，应将U盘拆分过程进行录像\nC. 公安机关移送审查起诉时，对U盘内提取的木马程序，应附有该木马程序如何盗取账号密码的说明\nD. 如U盘未予封存，且不能补正或作出合理解释的，U盘内提取的木马程序不得作为定案的根据\nCorrect Answer: 应扣押U盘并制作笔录。检查U盘内的电子数据时，应将U盘拆分过程进行录像。公安机关移送审查起诉时，对U盘内提取的木马程序，应附有该木马程序如何盗取账号密码的说明。如U盘未予封存，且不能补正或作出合理解释的，U盘内提取的木马程序不得作为定案的根据\n</Multiple-choice Question>\n\nPlease output the result in the following JSON format:\n```json\n{\n\"Open-ended Verifiable Question\": \"...\",\n\"Ground-True Answer\": \"...\"\n}\n```",
  "gpt_reformat_response": "{\n\"Open-ended Verifiable Question\": \"在一起涉嫌利用木马程序盗取并转卖Q币的案件中，公安机关在嫌疑人住处查获存有盗号木马程序的U盘。请说明对该U盘及其内电子数据应如何依法规范处理与固定证据，包括是否应扣押及制作笔录、对电子数据检查的影像记录要求、移送审查起诉时对提取的木马程序需附带的说明内容，以及在U盘未予封存且无法补正或作出合理解释时该电子证据能否作为定案依据。\",\n\"Ground-True Answer\": \"应扣押U盘并制作笔录；检查U盘内电子数据时，应对拆分（取证）过程进行录像；移送审查起诉时，对从U盘提取的木马程序应附有其如何盗取账号密码的说明；如U盘未予封存且不能补正或作出合理解释，该U盘内提取的木马程序不得作为定案的根据。\"\n}",
  "Open-ended Verifiable Question": "在一起涉嫌利用木马程序盗取并转卖Q币的案件中，公安机关在嫌疑人住处查获存有盗号木马程序的U盘。请说明对该U盘及其内电子数据应如何依法规范处理与固定证据，包括是否应扣押及制作笔录、对电子数据检查的影像记录要求、移送审查起诉时对提取的木马程序需附带的说明内容，以及在U盘未予封存且无法补正或作出合理解释时该电子证据能否作为定案依据。",
  "Ground-True Answer": "应扣押U盘并制作笔录；检查U盘内电子数据时，应对拆分（取证）过程进行录像；移送审查起诉时，对从U盘提取的木马程序应附有其如何盗取账号密码的说明；如U盘未予封存且不能补正或作出合理解释，该U盘内提取的木马程序不得作为定案的根据。"
}