{
  "question": "（五）某环保联合会对某公司提起环境民事公益诉讼，因在诉讼中需要该公司的相关环保资料，遂向县环保局提出申请公开该公司的排污许可证、排污口数量和位置等有关环境信息。申请书中载明了单位名称、住所地、联系人及电话并加盖了公章、获取信息的方式等。县环保局收到申请后，要求环保联合会提供申请人身份的证明材料。环保联合会提供了社会团体登记证复印件。县环保局以申请公开的内容不明确为由拒绝公开，该环保联合会遂提起行政诉讼。请回答第97〜99题。若法院受理此案，关于此案的审理，下列说法正确的是：",
  "options": {
    "A": "法院审理第一审行政案件，当事人各方同意适用简易程序的，可适用简易程序",
    "B": "县环保局负责人出庭应诉的，可另委托一至两名诉讼代理人",
    "C": "县环保局应当对拒绝的根据及履行法定告知和说明理由义务的情况举证",
    "D": "法院应要求环保联合会对其所申请的信息与其自身生产、生活、科研等需要的相关性进行举证"
  },
  "answer_idx": "ABC",
  "answer": "法院审理第一审行政案件，当事人各方同意适用简易程序的，可适用简易程序。县环保局负责人出庭应诉的，可另委托一至两名诉讼代理人。县环保局应当对拒绝的根据及履行法定告知和说明理由义务的情况举证",
  "process_id": 123,
  "options_str": "A. 法院审理第一审行政案件，当事人各方同意适用简易程序的，可适用简易程序\nB. 县环保局负责人出庭应诉的，可另委托一至两名诉讼代理人\nC. 县环保局应当对拒绝的根据及履行法定告知和说明理由义务的情况举证\nD. 法院应要求环保联合会对其所申请的信息与其自身生产、生活、科研等需要的相关性进行举证",
  "gpt_filter_query": "<Multiple-choice Question>\n（五）某环保联合会对某公司提起环境民事公益诉讼，因在诉讼中需要该公司的相关环保资料，遂向县环保局提出申请公开该公司的排污许可证、排污口数量和位置等有关环境信息。申请书中载明了单位名称、住所地、联系人及电话并加盖了公章、获取信息的方式等。县环保局收到申请后，要求环保联合会提供申请人身份的证明材料。环保联合会提供了社会团体登记证复印件。县环保局以申请公开的内容不明确为由拒绝公开，该环保联合会遂提起行政诉讼。请回答第97〜99题。若法院受理此案，关于此案的审理，下列说法正确的是：\nA. 法院审理第一审行政案件，当事人各方同意适用简易程序的，可适用简易程序\nB. 县环保局负责人出庭应诉的，可另委托一至两名诉讼代理人\nC. 县环保局应当对拒绝的根据及履行法定告知和说明理由义务的情况举证\nD. 法院应要求环保联合会对其所申请的信息与其自身生产、生活、科研等需要的相关性进行举证\nCorrect Answer: 法院审理第一审行政案件，当事人各方同意适用简易程序的，可适用简易程序。县环保局负责人出庭应诉的，可另委托一至两名诉讼代理人。县环保局应当对拒绝的根据及履行法定告知和说明理由义务的情况举证\n</Multiple-choice Question>\n\nYou are an expert in filtering and evaluating multiple-choice questions for advanced reasoning tasks. Your job is to evaluate a given question and determine whether it meets the following criteria: \n1. **Depth of Reasoning:** The question should require deeper reasoning. If the question appears too simple, mark it as \"Too Simple\".\n2. **Unambiguous Correct Answer:** The question must have a unique and unambiguous correct answer. If the question asks for \"incorrect options\" or allows for multiple correct answers, mark it as \"Ambiguous Answer\".\n3. **Open-Ended Reformulation Feasibility:** The question should be suitable for reformatting into an open-ended format. If the question cannot be easily reformulated into an open-ended problem and a clear ground-truth answer, mark it as \"Not Reformulatable\".\n\nFor each question, provide one of the following evaluations:  \n- \"Pass\" (The question meets all the criteria.)  \n- \"Too Simple\"  \n- \"Ambiguous Answer\"  \n- \"Not Reformulatable\" ",
  "gpt_filter_response": "Pass",
  "gpt_reformat_query": "I will provide you with a multiple-choice question, and your task is to rewrite it into an open-ended question, along with a Ground-True Answer. The requirements are:\n\n1. The question must be specific, targeting the point being tested in the original multiple-choice question. Ensure it is open-ended, meaning no options are provided, but there must be a definitive Ground-True Answer.\n2. Based on the correct answer from the original question, provide a concise Ground-True Answer. The answer should allow for precise matching to determine whether the model's response is correct.\n\nHere is the multiple-choice question for you to rewrite:\n<Multiple-choice Question>\n（五）某环保联合会对某公司提起环境民事公益诉讼，因在诉讼中需要该公司的相关环保资料，遂向县环保局提出申请公开该公司的排污许可证、排污口数量和位置等有关环境信息。申请书中载明了单位名称、住所地、联系人及电话并加盖了公章、获取信息的方式等。县环保局收到申请后，要求环保联合会提供申请人身份的证明材料。环保联合会提供了社会团体登记证复印件。县环保局以申请公开的内容不明确为由拒绝公开，该环保联合会遂提起行政诉讼。请回答第97〜99题。若法院受理此案，关于此案的审理，下列说法正确的是：\nA. 法院审理第一审行政案件，当事人各方同意适用简易程序的，可适用简易程序\nB. 县环保局负责人出庭应诉的，可另委托一至两名诉讼代理人\nC. 县环保局应当对拒绝的根据及履行法定告知和说明理由义务的情况举证\nD. 法院应要求环保联合会对其所申请的信息与其自身生产、生活、科研等需要的相关性进行举证\nCorrect Answer: 法院审理第一审行政案件，当事人各方同意适用简易程序的，可适用简易程序。县环保局负责人出庭应诉的，可另委托一至两名诉讼代理人。县环保局应当对拒绝的根据及履行法定告知和说明理由义务的情况举证\n</Multiple-choice Question>\n\nPlease output the result in the following JSON format:\n```json\n{\n\"Open-ended Verifiable Question\": \"...\",\n\"Ground-True Answer\": \"...\"\n}\n```",
  "gpt_reformat_response": "{\n\"Open-ended Verifiable Question\": \"In an administrative lawsuit where an environmental NGO sues a county environmental bureau for refusing to disclose environmental information, what are the correct procedural rules regarding (1) applicability of simplified procedure in first-instance administrative trials, (2) representation when the bureau’s head appears in court, and (3) the bureau’s burden of proof concerning the legal basis for refusal and fulfillment of its statutory duty to inform and explain reasons?\",\n\"Ground-True Answer\": \"1) Simplified procedure may be applied in a first-instance administrative case if all parties consent; 2) If the county environmental bureau’s head appears, they may additionally appoint one to two litigation agents; 3) The bureau bears the burden to prove the legal basis for its refusal and that it fulfilled the statutory duty to inform and explain reasons.\"\n}",
  "Open-ended Verifiable Question": "In an administrative lawsuit where an environmental NGO sues a county environmental bureau for refusing to disclose environmental information, what are the correct procedural rules regarding (1) applicability of simplified procedure in first-instance administrative trials, (2) representation when the bureau’s head appears in court, and (3) the bureau’s burden of proof concerning the legal basis for refusal and fulfillment of its statutory duty to inform and explain reasons?",
  "Ground-True Answer": "1) Simplified procedure may be applied in a first-instance administrative case if all parties consent; 2) If the county environmental bureau’s head appears, they may additionally appoint one to two litigation agents; 3) The bureau bears the burden to prove the legal basis for its refusal and that it fulfilled the statutory duty to inform and explain reasons."
}