{
  "question": "关于“宪法是静态的刑事诉讼法、刑事诉讼法是动态的宪法。\"下列哪些选项是正确的？",
  "options": {
    "A": "有关刑事诉讼的程序性条款，构成各国宪法中关于人权保障条款的核心",
    "B": "刑事诉讼法关于强制措施的适用权限、条件、程序与辩护等规定，都直接体现了宪法关于公民人身、住宅、财产不受非法逮捕、搜查、扣押以及被告人有权获得辩护等规定的精神",
    "C": "刑事诉讼法规范和限制了国家权力，保障了公民享有宪法规定的基本人权和自由",
    "D": "宪法关于人权保障的条款，都要通过刑事诉讼法保证刑法的实施来实现"
  },
  "answer_idx": "ABC",
  "answer": "有关刑事诉讼的程序性条款，构成各国宪法中关于人权保障条款的核心。刑事诉讼法关于强制措施的适用权限、条件、程序与辩护等规定，都直接体现了宪法关于公民人身、住宅、财产不受非法逮捕、搜查、扣押以及被告人有权获得辩护等规定的精神。刑事诉讼法规范和限制了国家权力，保障了公民享有宪法规定的基本人权和自由",
  "process_id": 13,
  "options_str": "A. 有关刑事诉讼的程序性条款，构成各国宪法中关于人权保障条款的核心\nB. 刑事诉讼法关于强制措施的适用权限、条件、程序与辩护等规定，都直接体现了宪法关于公民人身、住宅、财产不受非法逮捕、搜查、扣押以及被告人有权获得辩护等规定的精神\nC. 刑事诉讼法规范和限制了国家权力，保障了公民享有宪法规定的基本人权和自由\nD. 宪法关于人权保障的条款，都要通过刑事诉讼法保证刑法的实施来实现",
  "gpt_filter_query": "<Multiple-choice Question>\n关于“宪法是静态的刑事诉讼法、刑事诉讼法是动态的宪法。\"下列哪些选项是正确的？\nA. 有关刑事诉讼的程序性条款，构成各国宪法中关于人权保障条款的核心\nB. 刑事诉讼法关于强制措施的适用权限、条件、程序与辩护等规定，都直接体现了宪法关于公民人身、住宅、财产不受非法逮捕、搜查、扣押以及被告人有权获得辩护等规定的精神\nC. 刑事诉讼法规范和限制了国家权力，保障了公民享有宪法规定的基本人权和自由\nD. 宪法关于人权保障的条款，都要通过刑事诉讼法保证刑法的实施来实现\nCorrect Answer: 有关刑事诉讼的程序性条款，构成各国宪法中关于人权保障条款的核心。刑事诉讼法关于强制措施的适用权限、条件、程序与辩护等规定，都直接体现了宪法关于公民人身、住宅、财产不受非法逮捕、搜查、扣押以及被告人有权获得辩护等规定的精神。刑事诉讼法规范和限制了国家权力，保障了公民享有宪法规定的基本人权和自由\n</Multiple-choice Question>\n\nYou are an expert in filtering and evaluating multiple-choice questions for advanced reasoning tasks. Your job is to evaluate a given question and determine whether it meets the following criteria: \n1. **Depth of Reasoning:** The question should require deeper reasoning. If the question appears too simple, mark it as \"Too Simple\".\n2. **Unambiguous Correct Answer:** The question must have a unique and unambiguous correct answer. If the question asks for \"incorrect options\" or allows for multiple correct answers, mark it as \"Ambiguous Answer\".\n3. **Open-Ended Reformulation Feasibility:** The question should be suitable for reformatting into an open-ended format. If the question cannot be easily reformulated into an open-ended problem and a clear ground-truth answer, mark it as \"Not Reformulatable\".\n\nFor each question, provide one of the following evaluations:  \n- \"Pass\" (The question meets all the criteria.)  \n- \"Too Simple\"  \n- \"Ambiguous Answer\"  \n- \"Not Reformulatable\" ",
  "gpt_filter_response": "Ambiguous Answer"
}