{
  "question": "甲公司以一地块的建设用地使用权作抵押向乙银行借款3000万元，办理了抵押登记。其后，甲公司在该地块上开发建设住宅楼，由丙公司承建。甲公司在取得预售许可后与丁订立了商品房买卖合同，丁交付了80%的购房款。现住宅楼已竣工验收，但甲公司未能按期偿还乙银行借款，并欠付丙公司工程款1500万元，乙银行和丙公司同时主张权利，法院拍卖了该住宅楼。下列哪些选项是正确的？",
  "options": {
    "A": "乙银行对建设用地使用权拍卖所得价款享有优先受偿权",
    "B": "乙银行对该住宅楼拍卖所得价款享有优先受偿权",
    "C": "丙公司对该住宅楼及其建设用地使用权的优先受偿权优先于乙银行的抵押权",
    "D": "丙公司对该住宅楼及其建设用地使用权的优先受偿权不得对抗丁对其所购商品房的权利"
  },
  "answer_idx": "ACD",
  "answer": "乙银行对建设用地使用权拍卖所得价款享有优先受偿权。丙公司对该住宅楼及其建设用地使用权的优先受偿权优先于乙银行的抵押权。丙公司对该住宅楼及其建设用地使用权的优先受偿权不得对抗丁对其所购商品房的权利",
  "process_id": 130,
  "options_str": "A. 乙银行对建设用地使用权拍卖所得价款享有优先受偿权\nB. 乙银行对该住宅楼拍卖所得价款享有优先受偿权\nC. 丙公司对该住宅楼及其建设用地使用权的优先受偿权优先于乙银行的抵押权\nD. 丙公司对该住宅楼及其建设用地使用权的优先受偿权不得对抗丁对其所购商品房的权利",
  "gpt_filter_query": "<Multiple-choice Question>\n甲公司以一地块的建设用地使用权作抵押向乙银行借款3000万元，办理了抵押登记。其后，甲公司在该地块上开发建设住宅楼，由丙公司承建。甲公司在取得预售许可后与丁订立了商品房买卖合同，丁交付了80%的购房款。现住宅楼已竣工验收，但甲公司未能按期偿还乙银行借款，并欠付丙公司工程款1500万元，乙银行和丙公司同时主张权利，法院拍卖了该住宅楼。下列哪些选项是正确的？\nA. 乙银行对建设用地使用权拍卖所得价款享有优先受偿权\nB. 乙银行对该住宅楼拍卖所得价款享有优先受偿权\nC. 丙公司对该住宅楼及其建设用地使用权的优先受偿权优先于乙银行的抵押权\nD. 丙公司对该住宅楼及其建设用地使用权的优先受偿权不得对抗丁对其所购商品房的权利\nCorrect Answer: 乙银行对建设用地使用权拍卖所得价款享有优先受偿权。丙公司对该住宅楼及其建设用地使用权的优先受偿权优先于乙银行的抵押权。丙公司对该住宅楼及其建设用地使用权的优先受偿权不得对抗丁对其所购商品房的权利\n</Multiple-choice Question>\n\nYou are an expert in filtering and evaluating multiple-choice questions for advanced reasoning tasks. Your job is to evaluate a given question and determine whether it meets the following criteria: \n1. **Depth of Reasoning:** The question should require deeper reasoning. If the question appears too simple, mark it as \"Too Simple\".\n2. **Unambiguous Correct Answer:** The question must have a unique and unambiguous correct answer. If the question asks for \"incorrect options\" or allows for multiple correct answers, mark it as \"Ambiguous Answer\".\n3. **Open-Ended Reformulation Feasibility:** The question should be suitable for reformatting into an open-ended format. If the question cannot be easily reformulated into an open-ended problem and a clear ground-truth answer, mark it as \"Not Reformulatable\".\n\nFor each question, provide one of the following evaluations:  \n- \"Pass\" (The question meets all the criteria.)  \n- \"Too Simple\"  \n- \"Ambiguous Answer\"  \n- \"Not Reformulatable\" ",
  "gpt_filter_response": "Pass",
  "gpt_reformat_query": "I will provide you with a multiple-choice question, and your task is to rewrite it into an open-ended question, along with a Ground-True Answer. The requirements are:\n\n1. The question must be specific, targeting the point being tested in the original multiple-choice question. Ensure it is open-ended, meaning no options are provided, but there must be a definitive Ground-True Answer.\n2. Based on the correct answer from the original question, provide a concise Ground-True Answer. The answer should allow for precise matching to determine whether the model's response is correct.\n\nHere is the multiple-choice question for you to rewrite:\n<Multiple-choice Question>\n甲公司以一地块的建设用地使用权作抵押向乙银行借款3000万元，办理了抵押登记。其后，甲公司在该地块上开发建设住宅楼，由丙公司承建。甲公司在取得预售许可后与丁订立了商品房买卖合同，丁交付了80%的购房款。现住宅楼已竣工验收，但甲公司未能按期偿还乙银行借款，并欠付丙公司工程款1500万元，乙银行和丙公司同时主张权利，法院拍卖了该住宅楼。下列哪些选项是正确的？\nA. 乙银行对建设用地使用权拍卖所得价款享有优先受偿权\nB. 乙银行对该住宅楼拍卖所得价款享有优先受偿权\nC. 丙公司对该住宅楼及其建设用地使用权的优先受偿权优先于乙银行的抵押权\nD. 丙公司对该住宅楼及其建设用地使用权的优先受偿权不得对抗丁对其所购商品房的权利\nCorrect Answer: 乙银行对建设用地使用权拍卖所得价款享有优先受偿权。丙公司对该住宅楼及其建设用地使用权的优先受偿权优先于乙银行的抵押权。丙公司对该住宅楼及其建设用地使用权的优先受偿权不得对抗丁对其所购商品房的权利\n</Multiple-choice Question>\n\nPlease output the result in the following JSON format:\n```json\n{\n\"Open-ended Verifiable Question\": \"...\",\n\"Ground-True Answer\": \"...\"\n}\n```",
  "gpt_reformat_response": "{\n\"Open-ended Verifiable Question\": \"甲公司以一地块建设用地使用权抵押向乙银行借款并办理登记，后在该地块上建成住宅楼，由丙公司承建；甲取得预售许可后将部分商品房出售给丁且丁已支付80%房款。竣工后甲未能清偿乙银行借款并拖欠丙公司工程款，法院对住宅楼进行拍卖。请明确：1) 乙银行就建设用地使用权拍卖价款是否享有优先受偿权；2) 丙公司就该住宅楼及其建设用地使用权的工程价款优先受偿权与乙银行抵押权孰先；3) 丙公司的该优先受偿权能否对抗丁对其已购商品房的权利？请分别给出结论。\",\n\"Ground-True Answer\": \"1) 享有；2) 丙公司的工程价款优先受偿权优先于乙银行的抵押权；3) 不能对抗丁对其所购商品房的权利。\"\n}",
  "Open-ended Verifiable Question": "甲公司以一地块建设用地使用权抵押向乙银行借款并办理登记，后在该地块上建成住宅楼，由丙公司承建；甲取得预售许可后将部分商品房出售给丁且丁已支付80%房款。竣工后甲未能清偿乙银行借款并拖欠丙公司工程款，法院对住宅楼进行拍卖。请明确：1) 乙银行就建设用地使用权拍卖价款是否享有优先受偿权；2) 丙公司就该住宅楼及其建设用地使用权的工程价款优先受偿权与乙银行抵押权孰先；3) 丙公司的该优先受偿权能否对抗丁对其已购商品房的权利？请分别给出结论。",
  "Ground-True Answer": "1) 享有；2) 丙公司的工程价款优先受偿权优先于乙银行的抵押权；3) 不能对抗丁对其所购商品房的权利。"
}