{
  "question": "T列关于法律规则、法律原则和法律条文的说法，错误的是？",
  "options": {
    "A": "法律规则在逻辑上由假定条件、行为模式和法律后果三部分组成，上述任何一个部分，在具体条文的表述中，均可能被省略",
    "B": "法律条文既可以表达法律规则，也可以表达法律原则，还可以表达规则或原则以外的内容，而规范性条文就是直接表达法律规则的条文",
    "C": "在诉讼过程中，与当事人有利害关系的，应当回避，这是一个法律原则，其行为模式为应为模式",
    "D": "法律规则与法律条文的关系为内容与形式的关系。因此，法律规则既可以通过法律条文来表达，也可以通过法律条文以外的形式来表达，典型如判例和习惯"
  },
  "answer_idx": "BC",
  "answer": "法律条文既可以表达法律规则，也可以表达法律原则，还可以表达规则或原则以外的内容，而规范性条文就是直接表达法律规则的条文。在诉讼过程中，与当事人有利害关系的，应当回避，这是一个法律原则，其行为模式为应为模式",
  "process_id": 140,
  "options_str": "A. 法律规则在逻辑上由假定条件、行为模式和法律后果三部分组成，上述任何一个部分，在具体条文的表述中，均可能被省略\nB. 法律条文既可以表达法律规则，也可以表达法律原则，还可以表达规则或原则以外的内容，而规范性条文就是直接表达法律规则的条文\nC. 在诉讼过程中，与当事人有利害关系的，应当回避，这是一个法律原则，其行为模式为应为模式\nD. 法律规则与法律条文的关系为内容与形式的关系。因此，法律规则既可以通过法律条文来表达，也可以通过法律条文以外的形式来表达，典型如判例和习惯",
  "gpt_filter_query": "<Multiple-choice Question>\nT列关于法律规则、法律原则和法律条文的说法，错误的是？\nA. 法律规则在逻辑上由假定条件、行为模式和法律后果三部分组成，上述任何一个部分，在具体条文的表述中，均可能被省略\nB. 法律条文既可以表达法律规则，也可以表达法律原则，还可以表达规则或原则以外的内容，而规范性条文就是直接表达法律规则的条文\nC. 在诉讼过程中，与当事人有利害关系的，应当回避，这是一个法律原则，其行为模式为应为模式\nD. 法律规则与法律条文的关系为内容与形式的关系。因此，法律规则既可以通过法律条文来表达，也可以通过法律条文以外的形式来表达，典型如判例和习惯\nCorrect Answer: 法律条文既可以表达法律规则，也可以表达法律原则，还可以表达规则或原则以外的内容，而规范性条文就是直接表达法律规则的条文。在诉讼过程中，与当事人有利害关系的，应当回避，这是一个法律原则，其行为模式为应为模式\n</Multiple-choice Question>\n\nYou are an expert in filtering and evaluating multiple-choice questions for advanced reasoning tasks. Your job is to evaluate a given question and determine whether it meets the following criteria: \n1. **Depth of Reasoning:** The question should require deeper reasoning. If the question appears too simple, mark it as \"Too Simple\".\n2. **Unambiguous Correct Answer:** The question must have a unique and unambiguous correct answer. If the question asks for \"incorrect options\" or allows for multiple correct answers, mark it as \"Ambiguous Answer\".\n3. **Open-Ended Reformulation Feasibility:** The question should be suitable for reformatting into an open-ended format. If the question cannot be easily reformulated into an open-ended problem and a clear ground-truth answer, mark it as \"Not Reformulatable\".\n\nFor each question, provide one of the following evaluations:  \n- \"Pass\" (The question meets all the criteria.)  \n- \"Too Simple\"  \n- \"Ambiguous Answer\"  \n- \"Not Reformulatable\" ",
  "gpt_filter_response": "Ambiguous Answer"
}