{
  "question": "关于刑法及司法解释的时间效力，下列选项正确的有？",
  "options": {
    "A": "甲在2010年受贿500万,2016年司法解释规定受贿罪“数额特别巨大''的标准为300万元，2017年司法解释规定受贿罪“数额特别巨大''的标准为600万元，甲在2018年被抓获，应适用新的司法解释，不能认定为受贿“数额特别巨大”",
    "B": "2016年司法解释规定了受贿罪的数额标准，乙于2015年—2018年连续受贿多次，乙的所有受贿行为均可以适用该司法解释",
    "C": "1997年《刑法》规定，生产、销售有毒、有害食品罪为具体危险犯，只有造成具体的危险才能定罪。2011年《刑法修正案（八）》将该罪规定为抽象危险犯，只要实施了生产、销售行为，就认为有抽象的危险，应以犯罪论处。丙于2010年实施了生产、销售有毒、有害食品的行为，但并没有造成具体危险状态，于2018年被抓获。甲的行为可以适用《刑法修正案（八）》，应以犯罪论处",
    "D": "2000年最高人民法院出台了针对某一问题的司法解释，该解释不能适用于其生效之前的犯罪行为"
  },
  "answer_idx": "AB",
  "answer": "甲在2010年受贿500万,2016年司法解释规定受贿罪“数额特别巨大''的标准为300万元，2017年司法解释规定受贿罪“数额特别巨大''的标准为600万元，甲在2018年被抓获，应适用新的司法解释，不能认定为受贿“数额特别巨大”。2016年司法解释规定了受贿罪的数额标准，乙于2015年—2018年连续受贿多次，乙的所有受贿行为均可以适用该司法解释",
  "process_id": 141,
  "options_str": "A. 甲在2010年受贿500万,2016年司法解释规定受贿罪“数额特别巨大''的标准为300万元，2017年司法解释规定受贿罪“数额特别巨大''的标准为600万元，甲在2018年被抓获，应适用新的司法解释，不能认定为受贿“数额特别巨大”\nB. 2016年司法解释规定了受贿罪的数额标准，乙于2015年—2018年连续受贿多次，乙的所有受贿行为均可以适用该司法解释\nC. 1997年《刑法》规定，生产、销售有毒、有害食品罪为具体危险犯，只有造成具体的危险才能定罪。2011年《刑法修正案（八）》将该罪规定为抽象危险犯，只要实施了生产、销售行为，就认为有抽象的危险，应以犯罪论处。丙于2010年实施了生产、销售有毒、有害食品的行为，但并没有造成具体危险状态，于2018年被抓获。甲的行为可以适用《刑法修正案（八）》，应以犯罪论处\nD. 2000年最高人民法院出台了针对某一问题的司法解释，该解释不能适用于其生效之前的犯罪行为",
  "gpt_filter_query": "<Multiple-choice Question>\n关于刑法及司法解释的时间效力，下列选项正确的有？\nA. 甲在2010年受贿500万,2016年司法解释规定受贿罪“数额特别巨大''的标准为300万元，2017年司法解释规定受贿罪“数额特别巨大''的标准为600万元，甲在2018年被抓获，应适用新的司法解释，不能认定为受贿“数额特别巨大”\nB. 2016年司法解释规定了受贿罪的数额标准，乙于2015年—2018年连续受贿多次，乙的所有受贿行为均可以适用该司法解释\nC. 1997年《刑法》规定，生产、销售有毒、有害食品罪为具体危险犯，只有造成具体的危险才能定罪。2011年《刑法修正案（八）》将该罪规定为抽象危险犯，只要实施了生产、销售行为，就认为有抽象的危险，应以犯罪论处。丙于2010年实施了生产、销售有毒、有害食品的行为，但并没有造成具体危险状态，于2018年被抓获。甲的行为可以适用《刑法修正案（八）》，应以犯罪论处\nD. 2000年最高人民法院出台了针对某一问题的司法解释，该解释不能适用于其生效之前的犯罪行为\nCorrect Answer: 甲在2010年受贿500万,2016年司法解释规定受贿罪“数额特别巨大''的标准为300万元，2017年司法解释规定受贿罪“数额特别巨大''的标准为600万元，甲在2018年被抓获，应适用新的司法解释，不能认定为受贿“数额特别巨大”。2016年司法解释规定了受贿罪的数额标准，乙于2015年—2018年连续受贿多次，乙的所有受贿行为均可以适用该司法解释\n</Multiple-choice Question>\n\nYou are an expert in filtering and evaluating multiple-choice questions for advanced reasoning tasks. Your job is to evaluate a given question and determine whether it meets the following criteria: \n1. **Depth of Reasoning:** The question should require deeper reasoning. If the question appears too simple, mark it as \"Too Simple\".\n2. **Unambiguous Correct Answer:** The question must have a unique and unambiguous correct answer. If the question asks for \"incorrect options\" or allows for multiple correct answers, mark it as \"Ambiguous Answer\".\n3. **Open-Ended Reformulation Feasibility:** The question should be suitable for reformatting into an open-ended format. If the question cannot be easily reformulated into an open-ended problem and a clear ground-truth answer, mark it as \"Not Reformulatable\".\n\nFor each question, provide one of the following evaluations:  \n- \"Pass\" (The question meets all the criteria.)  \n- \"Too Simple\"  \n- \"Ambiguous Answer\"  \n- \"Not Reformulatable\" ",
  "gpt_filter_response": "Ambiguous Answer"
}