{
  "question": "89.下列与法律解释相关的分析中，正确的是：",
  "options": {
    "A": "李某将其仇人坟墓掘开并将骨头扔掉，其认为白骨不属于尸体，否认其构成侮辱尸体罪。他对白骨的解释属于无权解释、主观目的解释",
    "B": "法官任某在审理案件中认为刑法中“伪造货币罪”中的货币不包括生肖纪念币，该解释为有权解释、文义解释",
    "C": "最高人民法院某副院长在接受媒体来访时表示，《刑法修正案（八）》中的规定的“醉驾入刑\"应结合《刑法》总则当中的“情节显著轻微，危害不大，不认为是犯罪''的规定来理解。因此并非只要醉驾就一定人刑，这属于体系解释方法的运用",
    "D": "李某认为组织他人卖淫罪中“他人”不仅包括女性，而且包括男性。其理由是目前组织男性卖淫的现象很普遍，危害性很大，要发挥法律的社会功能，应包含男性。其对相关条文的解释为客观目的解释"
  },
  "answer_idx": "CD",
  "answer": "最高人民法院某副院长在接受媒体来访时表示，《刑法修正案（八）》中的规定的“醉驾入刑\"应结合《刑法》总则当中的“情节显著轻微，危害不大，不认为是犯罪''的规定来理解。因此并非只要醉驾就一定人刑，这属于体系解释方法的运用。李某认为组织他人卖淫罪中“他人”不仅包括女性，而且包括男性。其理由是目前组织男性卖淫的现象很普遍，危害性很大，要发挥法律的社会功能，应包含男性。其对相关条文的解释为客观目的解释",
  "process_id": 146,
  "options_str": "A. 李某将其仇人坟墓掘开并将骨头扔掉，其认为白骨不属于尸体，否认其构成侮辱尸体罪。他对白骨的解释属于无权解释、主观目的解释\nB. 法官任某在审理案件中认为刑法中“伪造货币罪”中的货币不包括生肖纪念币，该解释为有权解释、文义解释\nC. 最高人民法院某副院长在接受媒体来访时表示，《刑法修正案（八）》中的规定的“醉驾入刑\"应结合《刑法》总则当中的“情节显著轻微，危害不大，不认为是犯罪''的规定来理解。因此并非只要醉驾就一定人刑，这属于体系解释方法的运用\nD. 李某认为组织他人卖淫罪中“他人”不仅包括女性，而且包括男性。其理由是目前组织男性卖淫的现象很普遍，危害性很大，要发挥法律的社会功能，应包含男性。其对相关条文的解释为客观目的解释",
  "gpt_filter_query": "<Multiple-choice Question>\n89.下列与法律解释相关的分析中，正确的是：\nA. 李某将其仇人坟墓掘开并将骨头扔掉，其认为白骨不属于尸体，否认其构成侮辱尸体罪。他对白骨的解释属于无权解释、主观目的解释\nB. 法官任某在审理案件中认为刑法中“伪造货币罪”中的货币不包括生肖纪念币，该解释为有权解释、文义解释\nC. 最高人民法院某副院长在接受媒体来访时表示，《刑法修正案（八）》中的规定的“醉驾入刑\"应结合《刑法》总则当中的“情节显著轻微，危害不大，不认为是犯罪''的规定来理解。因此并非只要醉驾就一定人刑，这属于体系解释方法的运用\nD. 李某认为组织他人卖淫罪中“他人”不仅包括女性，而且包括男性。其理由是目前组织男性卖淫的现象很普遍，危害性很大，要发挥法律的社会功能，应包含男性。其对相关条文的解释为客观目的解释\nCorrect Answer: 最高人民法院某副院长在接受媒体来访时表示，《刑法修正案（八）》中的规定的“醉驾入刑\"应结合《刑法》总则当中的“情节显著轻微，危害不大，不认为是犯罪''的规定来理解。因此并非只要醉驾就一定人刑，这属于体系解释方法的运用。李某认为组织他人卖淫罪中“他人”不仅包括女性，而且包括男性。其理由是目前组织男性卖淫的现象很普遍，危害性很大，要发挥法律的社会功能，应包含男性。其对相关条文的解释为客观目的解释\n</Multiple-choice Question>\n\nYou are an expert in filtering and evaluating multiple-choice questions for advanced reasoning tasks. Your job is to evaluate a given question and determine whether it meets the following criteria: \n1. **Depth of Reasoning:** The question should require deeper reasoning. If the question appears too simple, mark it as \"Too Simple\".\n2. **Unambiguous Correct Answer:** The question must have a unique and unambiguous correct answer. If the question asks for \"incorrect options\" or allows for multiple correct answers, mark it as \"Ambiguous Answer\".\n3. **Open-Ended Reformulation Feasibility:** The question should be suitable for reformatting into an open-ended format. If the question cannot be easily reformulated into an open-ended problem and a clear ground-truth answer, mark it as \"Not Reformulatable\".\n\nFor each question, provide one of the following evaluations:  \n- \"Pass\" (The question meets all the criteria.)  \n- \"Too Simple\"  \n- \"Ambiguous Answer\"  \n- \"Not Reformulatable\" ",
  "gpt_filter_response": "Pass",
  "gpt_reformat_query": "I will provide you with a multiple-choice question, and your task is to rewrite it into an open-ended question, along with a Ground-True Answer. The requirements are:\n\n1. The question must be specific, targeting the point being tested in the original multiple-choice question. Ensure it is open-ended, meaning no options are provided, but there must be a definitive Ground-True Answer.\n2. Based on the correct answer from the original question, provide a concise Ground-True Answer. The answer should allow for precise matching to determine whether the model's response is correct.\n\nHere is the multiple-choice question for you to rewrite:\n<Multiple-choice Question>\n89.下列与法律解释相关的分析中，正确的是：\nA. 李某将其仇人坟墓掘开并将骨头扔掉，其认为白骨不属于尸体，否认其构成侮辱尸体罪。他对白骨的解释属于无权解释、主观目的解释\nB. 法官任某在审理案件中认为刑法中“伪造货币罪”中的货币不包括生肖纪念币，该解释为有权解释、文义解释\nC. 最高人民法院某副院长在接受媒体来访时表示，《刑法修正案（八）》中的规定的“醉驾入刑\"应结合《刑法》总则当中的“情节显著轻微，危害不大，不认为是犯罪''的规定来理解。因此并非只要醉驾就一定人刑，这属于体系解释方法的运用\nD. 李某认为组织他人卖淫罪中“他人”不仅包括女性，而且包括男性。其理由是目前组织男性卖淫的现象很普遍，危害性很大，要发挥法律的社会功能，应包含男性。其对相关条文的解释为客观目的解释\nCorrect Answer: 最高人民法院某副院长在接受媒体来访时表示，《刑法修正案（八）》中的规定的“醉驾入刑\"应结合《刑法》总则当中的“情节显著轻微，危害不大，不认为是犯罪''的规定来理解。因此并非只要醉驾就一定人刑，这属于体系解释方法的运用。李某认为组织他人卖淫罪中“他人”不仅包括女性，而且包括男性。其理由是目前组织男性卖淫的现象很普遍，危害性很大，要发挥法律的社会功能，应包含男性。其对相关条文的解释为客观目的解释\n</Multiple-choice Question>\n\nPlease output the result in the following JSON format:\n```json\n{\n\"Open-ended Verifiable Question\": \"...\",\n\"Ground-True Answer\": \"...\"\n}\n```",
  "gpt_reformat_response": "{\n\"Open-ended Verifiable Question\": \"In the context of legal interpretation methods, identify which two analyses are correct: (1) A statement by a Vice President of the Supreme People’s Court that the criminalization of drunk driving in Amendment VIII should be understood together with the General Provisions’ clause on ‘circumstances that are obviously minor and cause little harm are not crimes,’ illustrating that not all drunk driving necessarily constitutes a crime; (2) An interpretation that the term ‘others’ in the crime of organizing prostitution includes males as well as females because of prevalent and harmful practices, aiming to realize the law’s social purpose. Specify the correct interpretations and name the interpretation methods they exemplify.\",\n\"Ground-True Answer\": \"Both analyses are correct: the first exemplifies systematic (体系) interpretation; the second exemplifies objective teleological (客观目的) interpretation.\"\n}",
  "Open-ended Verifiable Question": "In the context of legal interpretation methods, identify which two analyses are correct: (1) A statement by a Vice President of the Supreme People’s Court that the criminalization of drunk driving in Amendment VIII should be understood together with the General Provisions’ clause on ‘circumstances that are obviously minor and cause little harm are not crimes,’ illustrating that not all drunk driving necessarily constitutes a crime; (2) An interpretation that the term ‘others’ in the crime of organizing prostitution includes males as well as females because of prevalent and harmful practices, aiming to realize the law’s social purpose. Specify the correct interpretations and name the interpretation methods they exemplify.",
  "Ground-True Answer": "Both analyses are correct: the first exemplifies systematic (体系) interpretation; the second exemplifies objective teleological (客观目的) interpretation."
}