{
  "question": "75.2016年，由陈某和周某共同创办了逐月有限公司，其中陈某持有公司67%的股权，并担任董事长、法定代表人。公司章程规定，只要公司可分配利润超过1。万元，即向周某分配10万元，剩余部分向陈某分配。2017年公司业务不佳，税后利润提取公积金后，公司可分配利润仅为11万元。当年股东会会议中，陈某以周某业务能力差、对公司贡献少为由，主张将可分配利润全部分配给自己，不向周某分配。该决议两股东均签字，但周某注明了反对意见。据此，当年全部利润均分配给了陈某。对此，下列说法正确的是？",
  "options": {
    "A": "周某可以主张该决议无效",
    "B": "周某可以主张撤销该决议",
    "C": "周某可以主张公司赔偿其损失",
    "D": "周某可以主张陈某赔偿其损失"
  },
  "answer_idx": "BD",
  "answer": "周某可以主张撤销该决议。周某可以主张陈某赔偿其损失",
  "process_id": 153,
  "options_str": "A. 周某可以主张该决议无效\nB. 周某可以主张撤销该决议\nC. 周某可以主张公司赔偿其损失\nD. 周某可以主张陈某赔偿其损失",
  "gpt_filter_query": "<Multiple-choice Question>\n75.2016年，由陈某和周某共同创办了逐月有限公司，其中陈某持有公司67%的股权，并担任董事长、法定代表人。公司章程规定，只要公司可分配利润超过1。万元，即向周某分配10万元，剩余部分向陈某分配。2017年公司业务不佳，税后利润提取公积金后，公司可分配利润仅为11万元。当年股东会会议中，陈某以周某业务能力差、对公司贡献少为由，主张将可分配利润全部分配给自己，不向周某分配。该决议两股东均签字，但周某注明了反对意见。据此，当年全部利润均分配给了陈某。对此，下列说法正确的是？\nA. 周某可以主张该决议无效\nB. 周某可以主张撤销该决议\nC. 周某可以主张公司赔偿其损失\nD. 周某可以主张陈某赔偿其损失\nCorrect Answer: 周某可以主张撤销该决议。周某可以主张陈某赔偿其损失\n</Multiple-choice Question>\n\nYou are an expert in filtering and evaluating multiple-choice questions for advanced reasoning tasks. Your job is to evaluate a given question and determine whether it meets the following criteria: \n1. **Depth of Reasoning:** The question should require deeper reasoning. If the question appears too simple, mark it as \"Too Simple\".\n2. **Unambiguous Correct Answer:** The question must have a unique and unambiguous correct answer. If the question asks for \"incorrect options\" or allows for multiple correct answers, mark it as \"Ambiguous Answer\".\n3. **Open-Ended Reformulation Feasibility:** The question should be suitable for reformatting into an open-ended format. If the question cannot be easily reformulated into an open-ended problem and a clear ground-truth answer, mark it as \"Not Reformulatable\".\n\nFor each question, provide one of the following evaluations:  \n- \"Pass\" (The question meets all the criteria.)  \n- \"Too Simple\"  \n- \"Ambiguous Answer\"  \n- \"Not Reformulatable\" ",
  "gpt_filter_response": "Pass",
  "gpt_reformat_query": "I will provide you with a multiple-choice question, and your task is to rewrite it into an open-ended question, along with a Ground-True Answer. The requirements are:\n\n1. The question must be specific, targeting the point being tested in the original multiple-choice question. Ensure it is open-ended, meaning no options are provided, but there must be a definitive Ground-True Answer.\n2. Based on the correct answer from the original question, provide a concise Ground-True Answer. The answer should allow for precise matching to determine whether the model's response is correct.\n\nHere is the multiple-choice question for you to rewrite:\n<Multiple-choice Question>\n75.2016年，由陈某和周某共同创办了逐月有限公司，其中陈某持有公司67%的股权，并担任董事长、法定代表人。公司章程规定，只要公司可分配利润超过1。万元，即向周某分配10万元，剩余部分向陈某分配。2017年公司业务不佳，税后利润提取公积金后，公司可分配利润仅为11万元。当年股东会会议中，陈某以周某业务能力差、对公司贡献少为由，主张将可分配利润全部分配给自己，不向周某分配。该决议两股东均签字，但周某注明了反对意见。据此，当年全部利润均分配给了陈某。对此，下列说法正确的是？\nA. 周某可以主张该决议无效\nB. 周某可以主张撤销该决议\nC. 周某可以主张公司赔偿其损失\nD. 周某可以主张陈某赔偿其损失\nCorrect Answer: 周某可以主张撤销该决议。周某可以主张陈某赔偿其损失\n</Multiple-choice Question>\n\nPlease output the result in the following JSON format:\n```json\n{\n\"Open-ended Verifiable Question\": \"...\",\n\"Ground-True Answer\": \"...\"\n}\n```",
  "gpt_reformat_response": "{\n\"Open-ended Verifiable Question\": \"In 2016, Chen and Zhou founded Zhuyue Co., with Chen holding 67% equity and serving as chairman and legal representative. The articles of association stipulate that whenever distributable profits exceed 10,000 yuan, 100,000 yuan shall be distributed to Zhou, and the remainder to Chen. In 2017, after setting aside statutory reserves, the company had 110,000 yuan of distributable profits. At the shareholders’ meeting, Chen, citing Zhou’s poor performance, pushed through a resolution to allocate all distributable profits to himself and none to Zhou; both shareholders signed, but Zhou recorded his objection, and all profits were distributed to Chen. Under PRC Company Law, what remedies may Zhou lawfully claim against the resolution and against the responsible party?\",\n\"Ground-True Answer\": \"Zhou may request revocation of the resolution and claim damages from Chen.\"\n}",
  "Open-ended Verifiable Question": "In 2016, Chen and Zhou founded Zhuyue Co., with Chen holding 67% equity and serving as chairman and legal representative. The articles of association stipulate that whenever distributable profits exceed 10,000 yuan, 100,000 yuan shall be distributed to Zhou, and the remainder to Chen. In 2017, after setting aside statutory reserves, the company had 110,000 yuan of distributable profits. At the shareholders’ meeting, Chen, citing Zhou’s poor performance, pushed through a resolution to allocate all distributable profits to himself and none to Zhou; both shareholders signed, but Zhou recorded his objection, and all profits were distributed to Chen. Under PRC Company Law, what remedies may Zhou lawfully claim against the resolution and against the responsible party?",
  "Ground-True Answer": "Zhou may request revocation of the resolution and claim damages from Chen."
}