{
  "question": "（四）黄某（17周岁，某汽车修理店职工）与吴某（16周岁，高中学生）在餐馆就餐时因琐事与赵某（16周岁，高中学生）发生争吵，并殴打赵某致其轻伤。检察院审查后，综合案件情况，拟对黄某作出附条件不起诉决定，对吴某作出不起诉决定。请回答第94〜96题。关于本案审查起诉的程序，下列选项正确的是：",
  "options": {
    "A": "应当对黄某、吴某的成长经历、犯罪原因和监护教育等情况进行社会调查",
    "B": "在讯问黄某、吴某和询问赵某时，应当分别通知他们的法定代理人到场",
    "C": "应当分别听取黄某、吴某的辩护人的意见",
    "D": "拟对黄某作出附条件不起诉决定，应当听取赵某及其法定代理人与诉讼代理人的意见"
  },
  "answer_idx": "BCD",
  "answer": "在讯问黄某、吴某和询问赵某时，应当分别通知他们的法定代理人到场。应当分别听取黄某、吴某的辩护人的意见。拟对黄某作出附条件不起诉决定，应当听取赵某及其法定代理人与诉讼代理人的意见",
  "process_id": 16,
  "options_str": "A. 应当对黄某、吴某的成长经历、犯罪原因和监护教育等情况进行社会调查\nB. 在讯问黄某、吴某和询问赵某时，应当分别通知他们的法定代理人到场\nC. 应当分别听取黄某、吴某的辩护人的意见\nD. 拟对黄某作出附条件不起诉决定，应当听取赵某及其法定代理人与诉讼代理人的意见",
  "gpt_filter_query": "<Multiple-choice Question>\n（四）黄某（17周岁，某汽车修理店职工）与吴某（16周岁，高中学生）在餐馆就餐时因琐事与赵某（16周岁，高中学生）发生争吵，并殴打赵某致其轻伤。检察院审查后，综合案件情况，拟对黄某作出附条件不起诉决定，对吴某作出不起诉决定。请回答第94〜96题。关于本案审查起诉的程序，下列选项正确的是：\nA. 应当对黄某、吴某的成长经历、犯罪原因和监护教育等情况进行社会调查\nB. 在讯问黄某、吴某和询问赵某时，应当分别通知他们的法定代理人到场\nC. 应当分别听取黄某、吴某的辩护人的意见\nD. 拟对黄某作出附条件不起诉决定，应当听取赵某及其法定代理人与诉讼代理人的意见\nCorrect Answer: 在讯问黄某、吴某和询问赵某时，应当分别通知他们的法定代理人到场。应当分别听取黄某、吴某的辩护人的意见。拟对黄某作出附条件不起诉决定，应当听取赵某及其法定代理人与诉讼代理人的意见\n</Multiple-choice Question>\n\nYou are an expert in filtering and evaluating multiple-choice questions for advanced reasoning tasks. Your job is to evaluate a given question and determine whether it meets the following criteria: \n1. **Depth of Reasoning:** The question should require deeper reasoning. If the question appears too simple, mark it as \"Too Simple\".\n2. **Unambiguous Correct Answer:** The question must have a unique and unambiguous correct answer. If the question asks for \"incorrect options\" or allows for multiple correct answers, mark it as \"Ambiguous Answer\".\n3. **Open-Ended Reformulation Feasibility:** The question should be suitable for reformatting into an open-ended format. If the question cannot be easily reformulated into an open-ended problem and a clear ground-truth answer, mark it as \"Not Reformulatable\".\n\nFor each question, provide one of the following evaluations:  \n- \"Pass\" (The question meets all the criteria.)  \n- \"Too Simple\"  \n- \"Ambiguous Answer\"  \n- \"Not Reformulatable\" ",
  "gpt_filter_response": "Pass",
  "gpt_reformat_query": "I will provide you with a multiple-choice question, and your task is to rewrite it into an open-ended question, along with a Ground-True Answer. The requirements are:\n\n1. The question must be specific, targeting the point being tested in the original multiple-choice question. Ensure it is open-ended, meaning no options are provided, but there must be a definitive Ground-True Answer.\n2. Based on the correct answer from the original question, provide a concise Ground-True Answer. The answer should allow for precise matching to determine whether the model's response is correct.\n\nHere is the multiple-choice question for you to rewrite:\n<Multiple-choice Question>\n（四）黄某（17周岁，某汽车修理店职工）与吴某（16周岁，高中学生）在餐馆就餐时因琐事与赵某（16周岁，高中学生）发生争吵，并殴打赵某致其轻伤。检察院审查后，综合案件情况，拟对黄某作出附条件不起诉决定，对吴某作出不起诉决定。请回答第94〜96题。关于本案审查起诉的程序，下列选项正确的是：\nA. 应当对黄某、吴某的成长经历、犯罪原因和监护教育等情况进行社会调查\nB. 在讯问黄某、吴某和询问赵某时，应当分别通知他们的法定代理人到场\nC. 应当分别听取黄某、吴某的辩护人的意见\nD. 拟对黄某作出附条件不起诉决定，应当听取赵某及其法定代理人与诉讼代理人的意见\nCorrect Answer: 在讯问黄某、吴某和询问赵某时，应当分别通知他们的法定代理人到场。应当分别听取黄某、吴某的辩护人的意见。拟对黄某作出附条件不起诉决定，应当听取赵某及其法定代理人与诉讼代理人的意见\n</Multiple-choice Question>\n\nPlease output the result in the following JSON format:\n```json\n{\n\"Open-ended Verifiable Question\": \"...\",\n\"Ground-True Answer\": \"...\"\n}\n```",
  "gpt_reformat_response": "{\n\"Open-ended Verifiable Question\": \"在黄某（17岁）与吴某（16岁）殴打赵某（16岁）致轻伤一案中，检察院拟对黄某作出附条件不起诉、对吴某作出不起诉决定。请说明本案在审查起诉阶段应当履行的法定程序要点：是否需要在讯问黄某、吴某及询问赵某时通知其法定代理人到场；是否应分别听取黄某、吴某的辩护人意见；以及在拟对黄某作出附条件不起诉决定时，是否应听取赵某及其法定代理人与诉讼代理人的意见。\",\n\"Ground-True Answer\": \"应当在讯问黄某、吴某和询问赵某时分别通知其法定代理人到场；应当分别听取黄某、吴某的辩护人意见；拟对黄某作出附条件不起诉决定，应当听取赵某及其法定代理人与诉讼代理人的意见。\"\n}",
  "Open-ended Verifiable Question": "在黄某（17岁）与吴某（16岁）殴打赵某（16岁）致轻伤一案中，检察院拟对黄某作出附条件不起诉、对吴某作出不起诉决定。请说明本案在审查起诉阶段应当履行的法定程序要点：是否需要在讯问黄某、吴某及询问赵某时通知其法定代理人到场；是否应分别听取黄某、吴某的辩护人意见；以及在拟对黄某作出附条件不起诉决定时，是否应听取赵某及其法定代理人与诉讼代理人的意见。",
  "Ground-True Answer": "应当在讯问黄某、吴某和询问赵某时分别通知其法定代理人到场；应当分别听取黄某、吴某的辩护人意见；拟对黄某作出附条件不起诉决定，应当听取赵某及其法定代理人与诉讼代理人的意见。"
}