{
  "question": "东海公司诉南海公司设备租赁合同纠纷一案，东海公司请求南海公司返还租赁设备并支付租赁费30万元，经甲省乙市A区人民法院审理，判决南海公司应返还设备给东海公司，但对30万元租赁费未处理。判决做出后，双方未提起上诉，判决发生法律效力。后东海公司以原审判决遗漏诉讼请求及适用法律错误为由申请再审，法院驳回了东海公司的再审申请。关于本案再审程序，下列哪些说法是不正确的？",
  "options": {
    "A": "东海公司可以原审判决遗漏诉讼请求为由申请再审",
    "B": "东海公司未对一审判决遗漏诉讼请求提起上诉，因此不得对本案申请再审",
    "C": "法院决定再审的，应当裁定中止原判决的执行",
    "D": "法院启动再审程序后，如南海公司也提出再审请求，法院不予审理"
  },
  "answer_idx": "ABD",
  "answer": "东海公司可以原审判决遗漏诉讼请求为由申请再审。东海公司未对一审判决遗漏诉讼请求提起上诉，因此不得对本案申请再审。法院启动再审程序后，如南海公司也提出再审请求，法院不予审理",
  "process_id": 175,
  "options_str": "A. 东海公司可以原审判决遗漏诉讼请求为由申请再审\nB. 东海公司未对一审判决遗漏诉讼请求提起上诉，因此不得对本案申请再审\nC. 法院决定再审的，应当裁定中止原判决的执行\nD. 法院启动再审程序后，如南海公司也提出再审请求，法院不予审理",
  "gpt_filter_query": "<Multiple-choice Question>\n东海公司诉南海公司设备租赁合同纠纷一案，东海公司请求南海公司返还租赁设备并支付租赁费30万元，经甲省乙市A区人民法院审理，判决南海公司应返还设备给东海公司，但对30万元租赁费未处理。判决做出后，双方未提起上诉，判决发生法律效力。后东海公司以原审判决遗漏诉讼请求及适用法律错误为由申请再审，法院驳回了东海公司的再审申请。关于本案再审程序，下列哪些说法是不正确的？\nA. 东海公司可以原审判决遗漏诉讼请求为由申请再审\nB. 东海公司未对一审判决遗漏诉讼请求提起上诉，因此不得对本案申请再审\nC. 法院决定再审的，应当裁定中止原判决的执行\nD. 法院启动再审程序后，如南海公司也提出再审请求，法院不予审理\nCorrect Answer: 东海公司可以原审判决遗漏诉讼请求为由申请再审。东海公司未对一审判决遗漏诉讼请求提起上诉，因此不得对本案申请再审。法院启动再审程序后，如南海公司也提出再审请求，法院不予审理\n</Multiple-choice Question>\n\nYou are an expert in filtering and evaluating multiple-choice questions for advanced reasoning tasks. Your job is to evaluate a given question and determine whether it meets the following criteria: \n1. **Depth of Reasoning:** The question should require deeper reasoning. If the question appears too simple, mark it as \"Too Simple\".\n2. **Unambiguous Correct Answer:** The question must have a unique and unambiguous correct answer. If the question asks for \"incorrect options\" or allows for multiple correct answers, mark it as \"Ambiguous Answer\".\n3. **Open-Ended Reformulation Feasibility:** The question should be suitable for reformatting into an open-ended format. If the question cannot be easily reformulated into an open-ended problem and a clear ground-truth answer, mark it as \"Not Reformulatable\".\n\nFor each question, provide one of the following evaluations:  \n- \"Pass\" (The question meets all the criteria.)  \n- \"Too Simple\"  \n- \"Ambiguous Answer\"  \n- \"Not Reformulatable\" ",
  "gpt_filter_response": "Ambiguous Answer"
}