{
  "question": "甲伙同乙窜至某地铁路干线上，用携带的扳手、压力钳等工具将线路上正在使用中的42块60kg型鱼尾板拆下盗走，共计价值人民币4914元。随后二人拨打A公司工作人员丙的手机，让丙第二天来“收货”。第二日，丙来得到甲、乙二人住处，以4400元人民币的价格将42块鱼尾板收购。甲将赃款中的2000元分给乙，其余赃款被其挥霍。事后查明，该铁路干线因鱼尾板被拆盗，造成停车延时损失人民币70,000元。关于本案，下列说法正确的是？",
  "options": {
    "A": "甲、乙的行为构成盗窃罪，金额为4400元",
    "B": "甲、乙的行为构成破坏交通设施罪",
    "C": "丙的行为构成掩饰、隐瞒犯罪所得罪",
    "D": "丙与甲、乙构成共同犯罪"
  },
  "answer_idx": "BC",
  "answer": "甲、乙的行为构成破坏交通设施罪。丙的行为构成掩饰、隐瞒犯罪所得罪",
  "process_id": 180,
  "options_str": "A. 甲、乙的行为构成盗窃罪，金额为4400元\nB. 甲、乙的行为构成破坏交通设施罪\nC. 丙的行为构成掩饰、隐瞒犯罪所得罪\nD. 丙与甲、乙构成共同犯罪",
  "gpt_filter_query": "<Multiple-choice Question>\n甲伙同乙窜至某地铁路干线上，用携带的扳手、压力钳等工具将线路上正在使用中的42块60kg型鱼尾板拆下盗走，共计价值人民币4914元。随后二人拨打A公司工作人员丙的手机，让丙第二天来“收货”。第二日，丙来得到甲、乙二人住处，以4400元人民币的价格将42块鱼尾板收购。甲将赃款中的2000元分给乙，其余赃款被其挥霍。事后查明，该铁路干线因鱼尾板被拆盗，造成停车延时损失人民币70,000元。关于本案，下列说法正确的是？\nA. 甲、乙的行为构成盗窃罪，金额为4400元\nB. 甲、乙的行为构成破坏交通设施罪\nC. 丙的行为构成掩饰、隐瞒犯罪所得罪\nD. 丙与甲、乙构成共同犯罪\nCorrect Answer: 甲、乙的行为构成破坏交通设施罪。丙的行为构成掩饰、隐瞒犯罪所得罪\n</Multiple-choice Question>\n\nYou are an expert in filtering and evaluating multiple-choice questions for advanced reasoning tasks. Your job is to evaluate a given question and determine whether it meets the following criteria: \n1. **Depth of Reasoning:** The question should require deeper reasoning. If the question appears too simple, mark it as \"Too Simple\".\n2. **Unambiguous Correct Answer:** The question must have a unique and unambiguous correct answer. If the question asks for \"incorrect options\" or allows for multiple correct answers, mark it as \"Ambiguous Answer\".\n3. **Open-Ended Reformulation Feasibility:** The question should be suitable for reformatting into an open-ended format. If the question cannot be easily reformulated into an open-ended problem and a clear ground-truth answer, mark it as \"Not Reformulatable\".\n\nFor each question, provide one of the following evaluations:  \n- \"Pass\" (The question meets all the criteria.)  \n- \"Too Simple\"  \n- \"Ambiguous Answer\"  \n- \"Not Reformulatable\" ",
  "gpt_filter_response": "Pass",
  "gpt_reformat_query": "I will provide you with a multiple-choice question, and your task is to rewrite it into an open-ended question, along with a Ground-True Answer. The requirements are:\n\n1. The question must be specific, targeting the point being tested in the original multiple-choice question. Ensure it is open-ended, meaning no options are provided, but there must be a definitive Ground-True Answer.\n2. Based on the correct answer from the original question, provide a concise Ground-True Answer. The answer should allow for precise matching to determine whether the model's response is correct.\n\nHere is the multiple-choice question for you to rewrite:\n<Multiple-choice Question>\n甲伙同乙窜至某地铁路干线上，用携带的扳手、压力钳等工具将线路上正在使用中的42块60kg型鱼尾板拆下盗走，共计价值人民币4914元。随后二人拨打A公司工作人员丙的手机，让丙第二天来“收货”。第二日，丙来得到甲、乙二人住处，以4400元人民币的价格将42块鱼尾板收购。甲将赃款中的2000元分给乙，其余赃款被其挥霍。事后查明，该铁路干线因鱼尾板被拆盗，造成停车延时损失人民币70,000元。关于本案，下列说法正确的是？\nA. 甲、乙的行为构成盗窃罪，金额为4400元\nB. 甲、乙的行为构成破坏交通设施罪\nC. 丙的行为构成掩饰、隐瞒犯罪所得罪\nD. 丙与甲、乙构成共同犯罪\nCorrect Answer: 甲、乙的行为构成破坏交通设施罪。丙的行为构成掩饰、隐瞒犯罪所得罪\n</Multiple-choice Question>\n\nPlease output the result in the following JSON format:\n```json\n{\n\"Open-ended Verifiable Question\": \"...\",\n\"Ground-True Answer\": \"...\"\n}\n```",
  "gpt_reformat_response": "{\n\"Open-ended Verifiable Question\": \"在甲、乙二人夜间携带工具拆卸并盗走铁路干线上正在使用的42块鱼尾板（价值4914元），致使该铁路干线发生停车延时损失7万元；次日丙明知是赃物仍以4400元收购的情况下，分别应当如何定性甲、乙及丙的行为？请明确给出各自成立的具体罪名。\",\n\"Ground-True Answer\": \"甲、乙构成破坏交通设施罪；丙构成掩饰、隐瞒犯罪所得罪。\"\n}",
  "Open-ended Verifiable Question": "在甲、乙二人夜间携带工具拆卸并盗走铁路干线上正在使用的42块鱼尾板（价值4914元），致使该铁路干线发生停车延时损失7万元；次日丙明知是赃物仍以4400元收购的情况下，分别应当如何定性甲、乙及丙的行为？请明确给出各自成立的具体罪名。",
  "Ground-True Answer": "甲、乙构成破坏交通设施罪；丙构成掩饰、隐瞒犯罪所得罪。"
}