{
  "question": "金发、牧田、杜青三人出资设立苍黄古月文化有限责任公司，后公司因经营不善倒闭，下列与清算有关的法律责任，下列选项错误的是？",
  "options": {
    "A": "如未在法定期限内成立清算组开始清算，导致公司财产贬值，债权人林庚有权主张金发、牧田、杜青对公司债务承担全部赔偿责任",
    "B": "如该公司未经清算即办理注销登记，导致公司无法进行清算，债权人宝华有权主张金发、牧田、杜青对公司债务承担清偿责任",
    "C": "如公司解散时金发尚有10万元出资未缴纳，应作为清算财产",
    "D": "如公司财产不足以清偿债务，债权人冯志有权主张金发、牧田、杜青在未缴出资范围内对公司债务承担连带清偿责任"
  },
  "answer_idx": "A",
  "answer": "如未在法定期限内成立清算组开始清算，导致公司财产贬值，债权人林庚有权主张金发、牧田、杜青对公司债务承担全部赔偿责任",
  "process_id": 183,
  "options_str": "A. 如未在法定期限内成立清算组开始清算，导致公司财产贬值，债权人林庚有权主张金发、牧田、杜青对公司债务承担全部赔偿责任\nB. 如该公司未经清算即办理注销登记，导致公司无法进行清算，债权人宝华有权主张金发、牧田、杜青对公司债务承担清偿责任\nC. 如公司解散时金发尚有10万元出资未缴纳，应作为清算财产\nD. 如公司财产不足以清偿债务，债权人冯志有权主张金发、牧田、杜青在未缴出资范围内对公司债务承担连带清偿责任",
  "gpt_filter_query": "<Multiple-choice Question>\n金发、牧田、杜青三人出资设立苍黄古月文化有限责任公司，后公司因经营不善倒闭，下列与清算有关的法律责任，下列选项错误的是？\nA. 如未在法定期限内成立清算组开始清算，导致公司财产贬值，债权人林庚有权主张金发、牧田、杜青对公司债务承担全部赔偿责任\nB. 如该公司未经清算即办理注销登记，导致公司无法进行清算，债权人宝华有权主张金发、牧田、杜青对公司债务承担清偿责任\nC. 如公司解散时金发尚有10万元出资未缴纳，应作为清算财产\nD. 如公司财产不足以清偿债务，债权人冯志有权主张金发、牧田、杜青在未缴出资范围内对公司债务承担连带清偿责任\nCorrect Answer: 如未在法定期限内成立清算组开始清算，导致公司财产贬值，债权人林庚有权主张金发、牧田、杜青对公司债务承担全部赔偿责任\n</Multiple-choice Question>\n\nYou are an expert in filtering and evaluating multiple-choice questions for advanced reasoning tasks. Your job is to evaluate a given question and determine whether it meets the following criteria: \n1. **Depth of Reasoning:** The question should require deeper reasoning. If the question appears too simple, mark it as \"Too Simple\".\n2. **Unambiguous Correct Answer:** The question must have a unique and unambiguous correct answer. If the question asks for \"incorrect options\" or allows for multiple correct answers, mark it as \"Ambiguous Answer\".\n3. **Open-Ended Reformulation Feasibility:** The question should be suitable for reformatting into an open-ended format. If the question cannot be easily reformulated into an open-ended problem and a clear ground-truth answer, mark it as \"Not Reformulatable\".\n\nFor each question, provide one of the following evaluations:  \n- \"Pass\" (The question meets all the criteria.)  \n- \"Too Simple\"  \n- \"Ambiguous Answer\"  \n- \"Not Reformulatable\" ",
  "gpt_filter_response": "Ambiguous Answer"
}