{
  "question": "中国特色社会主义制度是党和人民在长期实践探索中形成的科学制度体系，我国国家治理一切工作和活动都依照中国特色社会主义制度展开，我国国家治理体系和治理能力是中国特色社会主义制度及其执行能力的集中体现。下列选项不正确的是？",
  "options": {
    "A": "坚持和完善中国特色社会主义制度、推进国家治理体系和治理能力现代化，是关系党和国家事业兴旺发达、国家长治久安、人民幸福安康的重大问题",
    "B": "支持和保证人大及其常委会依法行使职权，健全人大对\"一府两院\"监督制度",
    "C": "中国特色社会主义制度和国家治理体系是以马克思主义为指导、植根中国大地、具有深厚中华文化根基",
    "D": "党的十八届三中全会首次提岀\"推进国家治理体系和治理能力现代化\"这个重大命题"
  },
  "answer_idx": "B",
  "answer": "支持和保证人大及其常委会依法行使职权，健全人大对\"一府两院\"监督制度",
  "process_id": 194,
  "options_str": "A. 坚持和完善中国特色社会主义制度、推进国家治理体系和治理能力现代化，是关系党和国家事业兴旺发达、国家长治久安、人民幸福安康的重大问题\nB. 支持和保证人大及其常委会依法行使职权，健全人大对\"一府两院\"监督制度\nC. 中国特色社会主义制度和国家治理体系是以马克思主义为指导、植根中国大地、具有深厚中华文化根基\nD. 党的十八届三中全会首次提岀\"推进国家治理体系和治理能力现代化\"这个重大命题",
  "gpt_filter_query": "<Multiple-choice Question>\n中国特色社会主义制度是党和人民在长期实践探索中形成的科学制度体系，我国国家治理一切工作和活动都依照中国特色社会主义制度展开，我国国家治理体系和治理能力是中国特色社会主义制度及其执行能力的集中体现。下列选项不正确的是？\nA. 坚持和完善中国特色社会主义制度、推进国家治理体系和治理能力现代化，是关系党和国家事业兴旺发达、国家长治久安、人民幸福安康的重大问题\nB. 支持和保证人大及其常委会依法行使职权，健全人大对\"一府两院\"监督制度\nC. 中国特色社会主义制度和国家治理体系是以马克思主义为指导、植根中国大地、具有深厚中华文化根基\nD. 党的十八届三中全会首次提岀\"推进国家治理体系和治理能力现代化\"这个重大命题\nCorrect Answer: 支持和保证人大及其常委会依法行使职权，健全人大对\"一府两院\"监督制度\n</Multiple-choice Question>\n\nYou are an expert in filtering and evaluating multiple-choice questions for advanced reasoning tasks. Your job is to evaluate a given question and determine whether it meets the following criteria: \n1. **Depth of Reasoning:** The question should require deeper reasoning. If the question appears too simple, mark it as \"Too Simple\".\n2. **Unambiguous Correct Answer:** The question must have a unique and unambiguous correct answer. If the question asks for \"incorrect options\" or allows for multiple correct answers, mark it as \"Ambiguous Answer\".\n3. **Open-Ended Reformulation Feasibility:** The question should be suitable for reformatting into an open-ended format. If the question cannot be easily reformulated into an open-ended problem and a clear ground-truth answer, mark it as \"Not Reformulatable\".\n\nFor each question, provide one of the following evaluations:  \n- \"Pass\" (The question meets all the criteria.)  \n- \"Too Simple\"  \n- \"Ambiguous Answer\"  \n- \"Not Reformulatable\" ",
  "gpt_filter_response": "Ambiguous Answer"
}