{
  "question": "根据香港、澳门特别行政区基本法的规定，下列选项不正确的是？",
  "options": {
    "A": "香港特别行政区终审法院和高等法院的首席法官，应由在外国无居留权的香港特别行政区永久性居民中的中国公民担任",
    "B": "香港特别行政区的法官，根据当地法官和法律界及其他方面知名人士组成的独立委员会推荐，由行政长官征得立法会同意后任命，并报全国人民代表大会常务委员会备案",
    "C": "澳门特别行政区检察长由澳门特别行政区永久性居民中的中国公民担任，由行政长官提名，报中央人民政府任命",
    "D": "澳门特别行政区设立行政法院。行政法院是管辖行政诉讼和税务诉讼的法院。不服行政法院裁决者，可向中级人民法院上诉"
  },
  "answer_idx": "B",
  "answer": "香港特别行政区的法官，根据当地法官和法律界及其他方面知名人士组成的独立委员会推荐，由行政长官征得立法会同意后任命，并报全国人民代表大会常务委员会备案",
  "process_id": 196,
  "options_str": "A. 香港特别行政区终审法院和高等法院的首席法官，应由在外国无居留权的香港特别行政区永久性居民中的中国公民担任\nB. 香港特别行政区的法官，根据当地法官和法律界及其他方面知名人士组成的独立委员会推荐，由行政长官征得立法会同意后任命，并报全国人民代表大会常务委员会备案\nC. 澳门特别行政区检察长由澳门特别行政区永久性居民中的中国公民担任，由行政长官提名，报中央人民政府任命\nD. 澳门特别行政区设立行政法院。行政法院是管辖行政诉讼和税务诉讼的法院。不服行政法院裁决者，可向中级人民法院上诉",
  "gpt_filter_query": "<Multiple-choice Question>\n根据香港、澳门特别行政区基本法的规定，下列选项不正确的是？\nA. 香港特别行政区终审法院和高等法院的首席法官，应由在外国无居留权的香港特别行政区永久性居民中的中国公民担任\nB. 香港特别行政区的法官，根据当地法官和法律界及其他方面知名人士组成的独立委员会推荐，由行政长官征得立法会同意后任命，并报全国人民代表大会常务委员会备案\nC. 澳门特别行政区检察长由澳门特别行政区永久性居民中的中国公民担任，由行政长官提名，报中央人民政府任命\nD. 澳门特别行政区设立行政法院。行政法院是管辖行政诉讼和税务诉讼的法院。不服行政法院裁决者，可向中级人民法院上诉\nCorrect Answer: 香港特别行政区的法官，根据当地法官和法律界及其他方面知名人士组成的独立委员会推荐，由行政长官征得立法会同意后任命，并报全国人民代表大会常务委员会备案\n</Multiple-choice Question>\n\nYou are an expert in filtering and evaluating multiple-choice questions for advanced reasoning tasks. Your job is to evaluate a given question and determine whether it meets the following criteria: \n1. **Depth of Reasoning:** The question should require deeper reasoning. If the question appears too simple, mark it as \"Too Simple\".\n2. **Unambiguous Correct Answer:** The question must have a unique and unambiguous correct answer. If the question asks for \"incorrect options\" or allows for multiple correct answers, mark it as \"Ambiguous Answer\".\n3. **Open-Ended Reformulation Feasibility:** The question should be suitable for reformatting into an open-ended format. If the question cannot be easily reformulated into an open-ended problem and a clear ground-truth answer, mark it as \"Not Reformulatable\".\n\nFor each question, provide one of the following evaluations:  \n- \"Pass\" (The question meets all the criteria.)  \n- \"Too Simple\"  \n- \"Ambiguous Answer\"  \n- \"Not Reformulatable\" ",
  "gpt_filter_response": "Ambiguous Answer"
}