{
  "question": "甲国派遣甲国公民李某出任甲国驻乙国总领馆馆长。2019年1月，甲国驻乙国总领事馆发生重大火灾，乙国消防人员在没有征得李某同意的情况下进入现场进行抢救。2019年2月，李某涉嫌重大刑事案件被乙国警察机关釆取强制措施。2019年3月，李某获释后在乙国旅游途中目睹了一起车祸事故，乙国警察要求李某提供证言。2019年4月，甲国将李某召回并推荐其为下一任联合国秘书长的候选人员。关于本案，下列选项正确的是？",
  "options": {
    "A": "乙国消防人员的做法符合国际法的规定",
    "B": "乙国警察机关对其采取强制措施的行为不符合国际法的规定",
    "C": "李某有义务对其目睹的车祸事故提供证言",
    "D": "如李某获得了安理会9个以上理事国的支持，且在大会获得过半数通过，即使常任理事国投反对票，其仍旧可以当选为联合国秘书长"
  },
  "answer_idx": "C",
  "answer": "李某有义务对其目睹的车祸事故提供证言",
  "process_id": 202,
  "options_str": "A. 乙国消防人员的做法符合国际法的规定\nB. 乙国警察机关对其采取强制措施的行为不符合国际法的规定\nC. 李某有义务对其目睹的车祸事故提供证言\nD. 如李某获得了安理会9个以上理事国的支持，且在大会获得过半数通过，即使常任理事国投反对票，其仍旧可以当选为联合国秘书长",
  "gpt_filter_query": "<Multiple-choice Question>\n甲国派遣甲国公民李某出任甲国驻乙国总领馆馆长。2019年1月，甲国驻乙国总领事馆发生重大火灾，乙国消防人员在没有征得李某同意的情况下进入现场进行抢救。2019年2月，李某涉嫌重大刑事案件被乙国警察机关釆取强制措施。2019年3月，李某获释后在乙国旅游途中目睹了一起车祸事故，乙国警察要求李某提供证言。2019年4月，甲国将李某召回并推荐其为下一任联合国秘书长的候选人员。关于本案，下列选项正确的是？\nA. 乙国消防人员的做法符合国际法的规定\nB. 乙国警察机关对其采取强制措施的行为不符合国际法的规定\nC. 李某有义务对其目睹的车祸事故提供证言\nD. 如李某获得了安理会9个以上理事国的支持，且在大会获得过半数通过，即使常任理事国投反对票，其仍旧可以当选为联合国秘书长\nCorrect Answer: 李某有义务对其目睹的车祸事故提供证言\n</Multiple-choice Question>\n\nYou are an expert in filtering and evaluating multiple-choice questions for advanced reasoning tasks. Your job is to evaluate a given question and determine whether it meets the following criteria: \n1. **Depth of Reasoning:** The question should require deeper reasoning. If the question appears too simple, mark it as \"Too Simple\".\n2. **Unambiguous Correct Answer:** The question must have a unique and unambiguous correct answer. If the question asks for \"incorrect options\" or allows for multiple correct answers, mark it as \"Ambiguous Answer\".\n3. **Open-Ended Reformulation Feasibility:** The question should be suitable for reformatting into an open-ended format. If the question cannot be easily reformulated into an open-ended problem and a clear ground-truth answer, mark it as \"Not Reformulatable\".\n\nFor each question, provide one of the following evaluations:  \n- \"Pass\" (The question meets all the criteria.)  \n- \"Too Simple\"  \n- \"Ambiguous Answer\"  \n- \"Not Reformulatable\" ",
  "gpt_filter_response": "Pass",
  "gpt_reformat_query": "I will provide you with a multiple-choice question, and your task is to rewrite it into an open-ended question, along with a Ground-True Answer. The requirements are:\n\n1. The question must be specific, targeting the point being tested in the original multiple-choice question. Ensure it is open-ended, meaning no options are provided, but there must be a definitive Ground-True Answer.\n2. Based on the correct answer from the original question, provide a concise Ground-True Answer. The answer should allow for precise matching to determine whether the model's response is correct.\n\nHere is the multiple-choice question for you to rewrite:\n<Multiple-choice Question>\n甲国派遣甲国公民李某出任甲国驻乙国总领馆馆长。2019年1月，甲国驻乙国总领事馆发生重大火灾，乙国消防人员在没有征得李某同意的情况下进入现场进行抢救。2019年2月，李某涉嫌重大刑事案件被乙国警察机关釆取强制措施。2019年3月，李某获释后在乙国旅游途中目睹了一起车祸事故，乙国警察要求李某提供证言。2019年4月，甲国将李某召回并推荐其为下一任联合国秘书长的候选人员。关于本案，下列选项正确的是？\nA. 乙国消防人员的做法符合国际法的规定\nB. 乙国警察机关对其采取强制措施的行为不符合国际法的规定\nC. 李某有义务对其目睹的车祸事故提供证言\nD. 如李某获得了安理会9个以上理事国的支持，且在大会获得过半数通过，即使常任理事国投反对票，其仍旧可以当选为联合国秘书长\nCorrect Answer: 李某有义务对其目睹的车祸事故提供证言\n</Multiple-choice Question>\n\nPlease output the result in the following JSON format:\n```json\n{\n\"Open-ended Verifiable Question\": \"...\",\n\"Ground-True Answer\": \"...\"\n}\n```",
  "gpt_reformat_response": "{\n\"Open-ended Verifiable Question\": \"在以下情境中，李某为甲国派驻乙国的总领事馆馆长。2019年3月，李某获释后在乙国旅游途中目睹了一起车祸事故，乙国警察要求他提供证言。根据《维也纳领事关系公约》及相关国际法规则，李某是否负有提供证言的法律义务？请给出明确结论。\",\n\"Ground-True Answer\": \"李某有义务提供证言。\"\n}",
  "Open-ended Verifiable Question": "在以下情境中，李某为甲国派驻乙国的总领事馆馆长。2019年3月，李某获释后在乙国旅游途中目睹了一起车祸事故，乙国警察要求他提供证言。根据《维也纳领事关系公约》及相关国际法规则，李某是否负有提供证言的法律义务？请给出明确结论。",
  "Ground-True Answer": "李某有义务提供证言。"
}