{
  "question": "关于不作为，下列说法错误的是？",
  "options": {
    "A": "A廖某未婚先孕，凌晨在工厂宿舍产下男婴后，将婴儿遗弃在洗澡间并清洗了地板上的血，后回宿舍睡觉，翌日下午，男婴被发现时已死亡。廖某成立不作为犯罪",
    "B": "曹某系丁某的妻子，某日曹某与邻居王某发生口角后用菜刀追砍王某，丁某能阻止却未阻止，王某被曹某砍死。丁某成立不作为犯罪",
    "C": "张某在防卫何某时造成何某重伤（仍在防卫限度内），张某坐在路边看着何某流血过多死亡。张某成立不作为犯罪",
    "D": "谢某与女儿同时被黄某绑架，绑架期间黄某将谢某女儿强奸。谢某成立不作为犯罪"
  },
  "answer_idx": "BCD",
  "answer": "曹某系丁某的妻子，某日曹某与邻居王某发生口角后用菜刀追砍王某，丁某能阻止却未阻止，王某被曹某砍死。丁某成立不作为犯罪。张某在防卫何某时造成何某重伤（仍在防卫限度内），张某坐在路边看着何某流血过多死亡。张某成立不作为犯罪。谢某与女儿同时被黄某绑架，绑架期间黄某将谢某女儿强奸。谢某成立不作为犯罪",
  "process_id": 206,
  "options_str": "A. A廖某未婚先孕，凌晨在工厂宿舍产下男婴后，将婴儿遗弃在洗澡间并清洗了地板上的血，后回宿舍睡觉，翌日下午，男婴被发现时已死亡。廖某成立不作为犯罪\nB. 曹某系丁某的妻子，某日曹某与邻居王某发生口角后用菜刀追砍王某，丁某能阻止却未阻止，王某被曹某砍死。丁某成立不作为犯罪\nC. 张某在防卫何某时造成何某重伤（仍在防卫限度内），张某坐在路边看着何某流血过多死亡。张某成立不作为犯罪\nD. 谢某与女儿同时被黄某绑架，绑架期间黄某将谢某女儿强奸。谢某成立不作为犯罪",
  "gpt_filter_query": "<Multiple-choice Question>\n关于不作为，下列说法错误的是？\nA. A廖某未婚先孕，凌晨在工厂宿舍产下男婴后，将婴儿遗弃在洗澡间并清洗了地板上的血，后回宿舍睡觉，翌日下午，男婴被发现时已死亡。廖某成立不作为犯罪\nB. 曹某系丁某的妻子，某日曹某与邻居王某发生口角后用菜刀追砍王某，丁某能阻止却未阻止，王某被曹某砍死。丁某成立不作为犯罪\nC. 张某在防卫何某时造成何某重伤（仍在防卫限度内），张某坐在路边看着何某流血过多死亡。张某成立不作为犯罪\nD. 谢某与女儿同时被黄某绑架，绑架期间黄某将谢某女儿强奸。谢某成立不作为犯罪\nCorrect Answer: 曹某系丁某的妻子，某日曹某与邻居王某发生口角后用菜刀追砍王某，丁某能阻止却未阻止，王某被曹某砍死。丁某成立不作为犯罪。张某在防卫何某时造成何某重伤（仍在防卫限度内），张某坐在路边看着何某流血过多死亡。张某成立不作为犯罪。谢某与女儿同时被黄某绑架，绑架期间黄某将谢某女儿强奸。谢某成立不作为犯罪\n</Multiple-choice Question>\n\nYou are an expert in filtering and evaluating multiple-choice questions for advanced reasoning tasks. Your job is to evaluate a given question and determine whether it meets the following criteria: \n1. **Depth of Reasoning:** The question should require deeper reasoning. If the question appears too simple, mark it as \"Too Simple\".\n2. **Unambiguous Correct Answer:** The question must have a unique and unambiguous correct answer. If the question asks for \"incorrect options\" or allows for multiple correct answers, mark it as \"Ambiguous Answer\".\n3. **Open-Ended Reformulation Feasibility:** The question should be suitable for reformatting into an open-ended format. If the question cannot be easily reformulated into an open-ended problem and a clear ground-truth answer, mark it as \"Not Reformulatable\".\n\nFor each question, provide one of the following evaluations:  \n- \"Pass\" (The question meets all the criteria.)  \n- \"Too Simple\"  \n- \"Ambiguous Answer\"  \n- \"Not Reformulatable\" ",
  "gpt_filter_response": "Ambiguous Answer"
}