{
  "question": "下列选项错误的是？",
  "options": {
    "A": "甲在预备阶段具有抢劫的故意，为抢劫准备了工具、制造了条件，但进入现场后，发现财物的所有人不在场，于是实施了盗窃行为。对甲应以抢劫罪（预备〉和盗窃罪（既遂）并罚",
    "B": "乙见他人携带装有现金的提包，遂起抢夺之念，在抢夺过程中遭到反抗，继而使用暴力，将他人打倒后抢走提包，乙的行为构成事后抢劫，成立抢劫罪",
    "C": "丙本欲杀死他人，在杀害过程中认为杀对方“脏了自己的手”，让对方受点伤即可，没有致人死亡即停止侵害行为。丙成立故意伤害罪（既遂）",
    "D": "丁先对被害人实施伤害行为，导致其昏迷。此时，丁发现被害人戴有首饰，见财起意将首饰转移为自己占有。丁成立故意伤害罪和盗窃罪并罚"
  },
  "answer_idx": "ABC",
  "answer": "甲在预备阶段具有抢劫的故意，为抢劫准备了工具、制造了条件，但进入现场后，发现财物的所有人不在场，于是实施了盗窃行为。对甲应以抢劫罪（预备〉和盗窃罪（既遂）并罚。乙见他人携带装有现金的提包，遂起抢夺之念，在抢夺过程中遭到反抗，继而使用暴力，将他人打倒后抢走提包，乙的行为构成事后抢劫，成立抢劫罪。丙本欲杀死他人，在杀害过程中认为杀对方“脏了自己的手”，让对方受点伤即可，没有致人死亡即停止侵害行为。丙成立故意伤害罪（既遂）",
  "process_id": 209,
  "options_str": "A. 甲在预备阶段具有抢劫的故意，为抢劫准备了工具、制造了条件，但进入现场后，发现财物的所有人不在场，于是实施了盗窃行为。对甲应以抢劫罪（预备〉和盗窃罪（既遂）并罚\nB. 乙见他人携带装有现金的提包，遂起抢夺之念，在抢夺过程中遭到反抗，继而使用暴力，将他人打倒后抢走提包，乙的行为构成事后抢劫，成立抢劫罪\nC. 丙本欲杀死他人，在杀害过程中认为杀对方“脏了自己的手”，让对方受点伤即可，没有致人死亡即停止侵害行为。丙成立故意伤害罪（既遂）\nD. 丁先对被害人实施伤害行为，导致其昏迷。此时，丁发现被害人戴有首饰，见财起意将首饰转移为自己占有。丁成立故意伤害罪和盗窃罪并罚",
  "gpt_filter_query": "<Multiple-choice Question>\n下列选项错误的是？\nA. 甲在预备阶段具有抢劫的故意，为抢劫准备了工具、制造了条件，但进入现场后，发现财物的所有人不在场，于是实施了盗窃行为。对甲应以抢劫罪（预备〉和盗窃罪（既遂）并罚\nB. 乙见他人携带装有现金的提包，遂起抢夺之念，在抢夺过程中遭到反抗，继而使用暴力，将他人打倒后抢走提包，乙的行为构成事后抢劫，成立抢劫罪\nC. 丙本欲杀死他人，在杀害过程中认为杀对方“脏了自己的手”，让对方受点伤即可，没有致人死亡即停止侵害行为。丙成立故意伤害罪（既遂）\nD. 丁先对被害人实施伤害行为，导致其昏迷。此时，丁发现被害人戴有首饰，见财起意将首饰转移为自己占有。丁成立故意伤害罪和盗窃罪并罚\nCorrect Answer: 甲在预备阶段具有抢劫的故意，为抢劫准备了工具、制造了条件，但进入现场后，发现财物的所有人不在场，于是实施了盗窃行为。对甲应以抢劫罪（预备〉和盗窃罪（既遂）并罚。乙见他人携带装有现金的提包，遂起抢夺之念，在抢夺过程中遭到反抗，继而使用暴力，将他人打倒后抢走提包，乙的行为构成事后抢劫，成立抢劫罪。丙本欲杀死他人，在杀害过程中认为杀对方“脏了自己的手”，让对方受点伤即可，没有致人死亡即停止侵害行为。丙成立故意伤害罪（既遂）\n</Multiple-choice Question>\n\nYou are an expert in filtering and evaluating multiple-choice questions for advanced reasoning tasks. Your job is to evaluate a given question and determine whether it meets the following criteria: \n1. **Depth of Reasoning:** The question should require deeper reasoning. If the question appears too simple, mark it as \"Too Simple\".\n2. **Unambiguous Correct Answer:** The question must have a unique and unambiguous correct answer. If the question asks for \"incorrect options\" or allows for multiple correct answers, mark it as \"Ambiguous Answer\".\n3. **Open-Ended Reformulation Feasibility:** The question should be suitable for reformatting into an open-ended format. If the question cannot be easily reformulated into an open-ended problem and a clear ground-truth answer, mark it as \"Not Reformulatable\".\n\nFor each question, provide one of the following evaluations:  \n- \"Pass\" (The question meets all the criteria.)  \n- \"Too Simple\"  \n- \"Ambiguous Answer\"  \n- \"Not Reformulatable\" ",
  "gpt_filter_response": "Ambiguous Answer"
}