{
  "question": "甲吸毒后夜间行车，违规将行人丁撞倒后，丁昏倒在路中央，甲驾车逃窜。一分钟后，超速驾驶的乙发现丁时已来不及刹车，轧到了丁，随后另一超速行驶的丙又从丁身上轧过，但事后不能查明是甲、乙、丙哪辆车造成丁死亡。关于本案，下列说法正确的是？",
  "options": {
    "A": "如果查明乙、丙从丁身上轧过时，丁已经死亡,则甲构成交通肇事罪，乙、丙不构成交通肇事罪",
    "B": "如果查明乙从丁身上轧过时造成丁死亡，则甲构成交通肇事罪中“因逃逸致人死亡”的情形，乙构成交通肇事罪,丙不构成交通肇事罪",
    "C": "根据司法解释，由于毒驾至少造成一人重伤，才构成交通肇事罪的基本犯，而构成基本犯是成立“因逃逸致人死亡”这一加重情形的前提，由于无法查清甲将丁撞倒时是否造成了重伤，因此，甲不构成“因逃逸致人死亡”的情形",
    "D": "虽然无法查明是甲、乙、丙哪辆车直接造成丁死亡,但是至少甲的行为与丁死亡存在因果关系，甲构成交通肇事罪"
  },
  "answer_idx": "ABD",
  "answer": "如果查明乙、丙从丁身上轧过时，丁已经死亡,则甲构成交通肇事罪，乙、丙不构成交通肇事罪。如果查明乙从丁身上轧过时造成丁死亡，则甲构成交通肇事罪中“因逃逸致人死亡”的情形，乙构成交通肇事罪,丙不构成交通肇事罪。虽然无法查明是甲、乙、丙哪辆车直接造成丁死亡,但是至少甲的行为与丁死亡存在因果关系，甲构成交通肇事罪",
  "process_id": 210,
  "options_str": "A. 如果查明乙、丙从丁身上轧过时，丁已经死亡,则甲构成交通肇事罪，乙、丙不构成交通肇事罪\nB. 如果查明乙从丁身上轧过时造成丁死亡，则甲构成交通肇事罪中“因逃逸致人死亡”的情形，乙构成交通肇事罪,丙不构成交通肇事罪\nC. 根据司法解释，由于毒驾至少造成一人重伤，才构成交通肇事罪的基本犯，而构成基本犯是成立“因逃逸致人死亡”这一加重情形的前提，由于无法查清甲将丁撞倒时是否造成了重伤，因此，甲不构成“因逃逸致人死亡”的情形\nD. 虽然无法查明是甲、乙、丙哪辆车直接造成丁死亡,但是至少甲的行为与丁死亡存在因果关系，甲构成交通肇事罪",
  "gpt_filter_query": "<Multiple-choice Question>\n甲吸毒后夜间行车，违规将行人丁撞倒后，丁昏倒在路中央，甲驾车逃窜。一分钟后，超速驾驶的乙发现丁时已来不及刹车，轧到了丁，随后另一超速行驶的丙又从丁身上轧过，但事后不能查明是甲、乙、丙哪辆车造成丁死亡。关于本案，下列说法正确的是？\nA. 如果查明乙、丙从丁身上轧过时，丁已经死亡,则甲构成交通肇事罪，乙、丙不构成交通肇事罪\nB. 如果查明乙从丁身上轧过时造成丁死亡，则甲构成交通肇事罪中“因逃逸致人死亡”的情形，乙构成交通肇事罪,丙不构成交通肇事罪\nC. 根据司法解释，由于毒驾至少造成一人重伤，才构成交通肇事罪的基本犯，而构成基本犯是成立“因逃逸致人死亡”这一加重情形的前提，由于无法查清甲将丁撞倒时是否造成了重伤，因此，甲不构成“因逃逸致人死亡”的情形\nD. 虽然无法查明是甲、乙、丙哪辆车直接造成丁死亡,但是至少甲的行为与丁死亡存在因果关系，甲构成交通肇事罪\nCorrect Answer: 如果查明乙、丙从丁身上轧过时，丁已经死亡,则甲构成交通肇事罪，乙、丙不构成交通肇事罪。如果查明乙从丁身上轧过时造成丁死亡，则甲构成交通肇事罪中“因逃逸致人死亡”的情形，乙构成交通肇事罪,丙不构成交通肇事罪。虽然无法查明是甲、乙、丙哪辆车直接造成丁死亡,但是至少甲的行为与丁死亡存在因果关系，甲构成交通肇事罪\n</Multiple-choice Question>\n\nYou are an expert in filtering and evaluating multiple-choice questions for advanced reasoning tasks. Your job is to evaluate a given question and determine whether it meets the following criteria: \n1. **Depth of Reasoning:** The question should require deeper reasoning. If the question appears too simple, mark it as \"Too Simple\".\n2. **Unambiguous Correct Answer:** The question must have a unique and unambiguous correct answer. If the question asks for \"incorrect options\" or allows for multiple correct answers, mark it as \"Ambiguous Answer\".\n3. **Open-Ended Reformulation Feasibility:** The question should be suitable for reformatting into an open-ended format. If the question cannot be easily reformulated into an open-ended problem and a clear ground-truth answer, mark it as \"Not Reformulatable\".\n\nFor each question, provide one of the following evaluations:  \n- \"Pass\" (The question meets all the criteria.)  \n- \"Too Simple\"  \n- \"Ambiguous Answer\"  \n- \"Not Reformulatable\" ",
  "gpt_filter_response": "Pass",
  "gpt_reformat_query": "I will provide you with a multiple-choice question, and your task is to rewrite it into an open-ended question, along with a Ground-True Answer. The requirements are:\n\n1. The question must be specific, targeting the point being tested in the original multiple-choice question. Ensure it is open-ended, meaning no options are provided, but there must be a definitive Ground-True Answer.\n2. Based on the correct answer from the original question, provide a concise Ground-True Answer. The answer should allow for precise matching to determine whether the model's response is correct.\n\nHere is the multiple-choice question for you to rewrite:\n<Multiple-choice Question>\n甲吸毒后夜间行车，违规将行人丁撞倒后，丁昏倒在路中央，甲驾车逃窜。一分钟后，超速驾驶的乙发现丁时已来不及刹车，轧到了丁，随后另一超速行驶的丙又从丁身上轧过，但事后不能查明是甲、乙、丙哪辆车造成丁死亡。关于本案，下列说法正确的是？\nA. 如果查明乙、丙从丁身上轧过时，丁已经死亡,则甲构成交通肇事罪，乙、丙不构成交通肇事罪\nB. 如果查明乙从丁身上轧过时造成丁死亡，则甲构成交通肇事罪中“因逃逸致人死亡”的情形，乙构成交通肇事罪,丙不构成交通肇事罪\nC. 根据司法解释，由于毒驾至少造成一人重伤，才构成交通肇事罪的基本犯，而构成基本犯是成立“因逃逸致人死亡”这一加重情形的前提，由于无法查清甲将丁撞倒时是否造成了重伤，因此，甲不构成“因逃逸致人死亡”的情形\nD. 虽然无法查明是甲、乙、丙哪辆车直接造成丁死亡,但是至少甲的行为与丁死亡存在因果关系，甲构成交通肇事罪\nCorrect Answer: 如果查明乙、丙从丁身上轧过时，丁已经死亡,则甲构成交通肇事罪，乙、丙不构成交通肇事罪。如果查明乙从丁身上轧过时造成丁死亡，则甲构成交通肇事罪中“因逃逸致人死亡”的情形，乙构成交通肇事罪,丙不构成交通肇事罪。虽然无法查明是甲、乙、丙哪辆车直接造成丁死亡,但是至少甲的行为与丁死亡存在因果关系，甲构成交通肇事罪\n</Multiple-choice Question>\n\nPlease output the result in the following JSON format:\n```json\n{\n\"Open-ended Verifiable Question\": \"...\",\n\"Ground-True Answer\": \"...\"\n}\n```",
  "gpt_reformat_response": "{\n  \"Open-ended Verifiable Question\": \"在以下情形中分别如何定性甲、乙、丙的刑事责任：甲吸毒后夜间驾车违章撞倒行人丁致其昏倒于路中央并驾车逃逸；一分钟后，超速行驶的乙因来不及刹车又轧到丁，随后另一超速行驶的丙亦从丁身上轧过。现有三种可查明或不可查明的结果情形：1) 若能查明乙、丙轧过时丁已死亡；2) 若能查明系乙轧过时造成丁死亡；3) 虽不能查明系甲、乙或丙哪辆车直接造成丁死亡，但能确认甲先前的肇事逃逸与丁的死亡存在因果关系。请分别说明三种情形下甲、乙、丙是否构成交通肇事罪，以及甲是否成立‘因逃逸致人死亡’的加重情形。\",\n  \"Ground-True Answer\": \"1) 若乙、丙轧过时丁已死亡：甲构成交通肇事罪，乙、丙不构成交通肇事罪。2) 若乙轧过时造成丁死亡：甲构成交通肇事罪中‘因逃逸致人死亡’，乙构成交通肇事罪，丙不构成交通肇事罪。3) 虽无法查明由甲、乙或丙哪车直接致死，但至少甲的行为与丁死亡存在因果关系：甲构成交通肇事罪。\"\n}",
  "Open-ended Verifiable Question": "在以下情形中分别如何定性甲、乙、丙的刑事责任：甲吸毒后夜间驾车违章撞倒行人丁致其昏倒于路中央并驾车逃逸；一分钟后，超速行驶的乙因来不及刹车又轧到丁，随后另一超速行驶的丙亦从丁身上轧过。现有三种可查明或不可查明的结果情形：1) 若能查明乙、丙轧过时丁已死亡；2) 若能查明系乙轧过时造成丁死亡；3) 虽不能查明系甲、乙或丙哪辆车直接造成丁死亡，但能确认甲先前的肇事逃逸与丁的死亡存在因果关系。请分别说明三种情形下甲、乙、丙是否构成交通肇事罪，以及甲是否成立‘因逃逸致人死亡’的加重情形。",
  "Ground-True Answer": "1) 若乙、丙轧过时丁已死亡：甲构成交通肇事罪，乙、丙不构成交通肇事罪。2) 若乙轧过时造成丁死亡：甲构成交通肇事罪中‘因逃逸致人死亡’，乙构成交通肇事罪，丙不构成交通肇事罪。3) 虽无法查明由甲、乙或丙哪车直接致死，但至少甲的行为与丁死亡存在因果关系：甲构成交通肇事罪。"
}