{
  "question": "甲绑架人质乙后，要求人质的妻子丙火速交付30万元赎金,否则就撕票。妻子丙经常被丈夫乙打骂，觉得是除掉丈夫的好机会，便以无钱为由，拒付赎金，也未报警。绑架犯甲恼羞成怒，杀害人质乙。关于本案,下列说法正确的是？",
  "options": {
    "A": "即使认定妻子丙与绑架犯甲构成共同犯罪，也只能认定妻子丙与绑架犯甲构成故意杀人罪的共同犯罪",
    "B": "只有承认片面共犯理论，才能认定妻子丙与绑架犯甲构成共同犯罪",
    "C": "如不能认定妻子丙与绑架犯甲构成共同犯罪，就必须认定妻子丙构成故意杀人罪的间接正犯，否则将无法追究其刑事责任",
    "D": "绑架罪属于继续犯，如认定妻子丙与绑架犯甲构成共同犯罪，就应按绑架罪“杀害被绑架人”追究妻子丙的刑事责任"
  },
  "answer_idx": "ABD",
  "answer": "即使认定妻子丙与绑架犯甲构成共同犯罪，也只能认定妻子丙与绑架犯甲构成故意杀人罪的共同犯罪。只有承认片面共犯理论，才能认定妻子丙与绑架犯甲构成共同犯罪。绑架罪属于继续犯，如认定妻子丙与绑架犯甲构成共同犯罪，就应按绑架罪“杀害被绑架人”追究妻子丙的刑事责任",
  "process_id": 211,
  "options_str": "A. 即使认定妻子丙与绑架犯甲构成共同犯罪，也只能认定妻子丙与绑架犯甲构成故意杀人罪的共同犯罪\nB. 只有承认片面共犯理论，才能认定妻子丙与绑架犯甲构成共同犯罪\nC. 如不能认定妻子丙与绑架犯甲构成共同犯罪，就必须认定妻子丙构成故意杀人罪的间接正犯，否则将无法追究其刑事责任\nD. 绑架罪属于继续犯，如认定妻子丙与绑架犯甲构成共同犯罪，就应按绑架罪“杀害被绑架人”追究妻子丙的刑事责任",
  "gpt_filter_query": "<Multiple-choice Question>\n甲绑架人质乙后，要求人质的妻子丙火速交付30万元赎金,否则就撕票。妻子丙经常被丈夫乙打骂，觉得是除掉丈夫的好机会，便以无钱为由，拒付赎金，也未报警。绑架犯甲恼羞成怒，杀害人质乙。关于本案,下列说法正确的是？\nA. 即使认定妻子丙与绑架犯甲构成共同犯罪，也只能认定妻子丙与绑架犯甲构成故意杀人罪的共同犯罪\nB. 只有承认片面共犯理论，才能认定妻子丙与绑架犯甲构成共同犯罪\nC. 如不能认定妻子丙与绑架犯甲构成共同犯罪，就必须认定妻子丙构成故意杀人罪的间接正犯，否则将无法追究其刑事责任\nD. 绑架罪属于继续犯，如认定妻子丙与绑架犯甲构成共同犯罪，就应按绑架罪“杀害被绑架人”追究妻子丙的刑事责任\nCorrect Answer: 即使认定妻子丙与绑架犯甲构成共同犯罪，也只能认定妻子丙与绑架犯甲构成故意杀人罪的共同犯罪。只有承认片面共犯理论，才能认定妻子丙与绑架犯甲构成共同犯罪。绑架罪属于继续犯，如认定妻子丙与绑架犯甲构成共同犯罪，就应按绑架罪“杀害被绑架人”追究妻子丙的刑事责任\n</Multiple-choice Question>\n\nYou are an expert in filtering and evaluating multiple-choice questions for advanced reasoning tasks. Your job is to evaluate a given question and determine whether it meets the following criteria: \n1. **Depth of Reasoning:** The question should require deeper reasoning. If the question appears too simple, mark it as \"Too Simple\".\n2. **Unambiguous Correct Answer:** The question must have a unique and unambiguous correct answer. If the question asks for \"incorrect options\" or allows for multiple correct answers, mark it as \"Ambiguous Answer\".\n3. **Open-Ended Reformulation Feasibility:** The question should be suitable for reformatting into an open-ended format. If the question cannot be easily reformulated into an open-ended problem and a clear ground-truth answer, mark it as \"Not Reformulatable\".\n\nFor each question, provide one of the following evaluations:  \n- \"Pass\" (The question meets all the criteria.)  \n- \"Too Simple\"  \n- \"Ambiguous Answer\"  \n- \"Not Reformulatable\" ",
  "gpt_filter_response": "Ambiguous Answer"
}