{
  "question": "张某和李某共同受贿一案，被T市监察委立案调查，张某被留置，李某未被留置，在调查结束后，移送T市检察院。下列关于该案程序的表述，说法正确的是？",
  "options": {
    "A": "T市检察院应当在受理案件后，对张某决定并执行拘留",
    "B": "除无法通知的以外，T市检察院应当在公安机关执行拘留后24小时以内，通知张某的家属",
    "C": "T市检察院受理该案后，在审查起诉过程中，根据案件情况，可以依法决定是否对李某釆取逮捕、取保候审或者监视居住措施",
    "D": "丁市检察院应当自收到移送起诉的案卷材料之日起3日以内告知张某和李某有权委托辩护人"
  },
  "answer_idx": "BC",
  "answer": "除无法通知的以外，T市检察院应当在公安机关执行拘留后24小时以内，通知张某的家属。T市检察院受理该案后，在审查起诉过程中，根据案件情况，可以依法决定是否对李某釆取逮捕、取保候审或者监视居住措施",
  "process_id": 212,
  "options_str": "A. T市检察院应当在受理案件后，对张某决定并执行拘留\nB. 除无法通知的以外，T市检察院应当在公安机关执行拘留后24小时以内，通知张某的家属\nC. T市检察院受理该案后，在审查起诉过程中，根据案件情况，可以依法决定是否对李某釆取逮捕、取保候审或者监视居住措施\nD. 丁市检察院应当自收到移送起诉的案卷材料之日起3日以内告知张某和李某有权委托辩护人",
  "gpt_filter_query": "<Multiple-choice Question>\n张某和李某共同受贿一案，被T市监察委立案调查，张某被留置，李某未被留置，在调查结束后，移送T市检察院。下列关于该案程序的表述，说法正确的是？\nA. T市检察院应当在受理案件后，对张某决定并执行拘留\nB. 除无法通知的以外，T市检察院应当在公安机关执行拘留后24小时以内，通知张某的家属\nC. T市检察院受理该案后，在审查起诉过程中，根据案件情况，可以依法决定是否对李某釆取逮捕、取保候审或者监视居住措施\nD. 丁市检察院应当自收到移送起诉的案卷材料之日起3日以内告知张某和李某有权委托辩护人\nCorrect Answer: 除无法通知的以外，T市检察院应当在公安机关执行拘留后24小时以内，通知张某的家属。T市检察院受理该案后，在审查起诉过程中，根据案件情况，可以依法决定是否对李某釆取逮捕、取保候审或者监视居住措施\n</Multiple-choice Question>\n\nYou are an expert in filtering and evaluating multiple-choice questions for advanced reasoning tasks. Your job is to evaluate a given question and determine whether it meets the following criteria: \n1. **Depth of Reasoning:** The question should require deeper reasoning. If the question appears too simple, mark it as \"Too Simple\".\n2. **Unambiguous Correct Answer:** The question must have a unique and unambiguous correct answer. If the question asks for \"incorrect options\" or allows for multiple correct answers, mark it as \"Ambiguous Answer\".\n3. **Open-Ended Reformulation Feasibility:** The question should be suitable for reformatting into an open-ended format. If the question cannot be easily reformulated into an open-ended problem and a clear ground-truth answer, mark it as \"Not Reformulatable\".\n\nFor each question, provide one of the following evaluations:  \n- \"Pass\" (The question meets all the criteria.)  \n- \"Too Simple\"  \n- \"Ambiguous Answer\"  \n- \"Not Reformulatable\" ",
  "gpt_filter_response": "Pass",
  "gpt_reformat_query": "I will provide you with a multiple-choice question, and your task is to rewrite it into an open-ended question, along with a Ground-True Answer. The requirements are:\n\n1. The question must be specific, targeting the point being tested in the original multiple-choice question. Ensure it is open-ended, meaning no options are provided, but there must be a definitive Ground-True Answer.\n2. Based on the correct answer from the original question, provide a concise Ground-True Answer. The answer should allow for precise matching to determine whether the model's response is correct.\n\nHere is the multiple-choice question for you to rewrite:\n<Multiple-choice Question>\n张某和李某共同受贿一案，被T市监察委立案调查，张某被留置，李某未被留置，在调查结束后，移送T市检察院。下列关于该案程序的表述，说法正确的是？\nA. T市检察院应当在受理案件后，对张某决定并执行拘留\nB. 除无法通知的以外，T市检察院应当在公安机关执行拘留后24小时以内，通知张某的家属\nC. T市检察院受理该案后，在审查起诉过程中，根据案件情况，可以依法决定是否对李某釆取逮捕、取保候审或者监视居住措施\nD. 丁市检察院应当自收到移送起诉的案卷材料之日起3日以内告知张某和李某有权委托辩护人\nCorrect Answer: 除无法通知的以外，T市检察院应当在公安机关执行拘留后24小时以内，通知张某的家属。T市检察院受理该案后，在审查起诉过程中，根据案件情况，可以依法决定是否对李某釆取逮捕、取保候审或者监视居住措施\n</Multiple-choice Question>\n\nPlease output the result in the following JSON format:\n```json\n{\n\"Open-ended Verifiable Question\": \"...\",\n\"Ground-True Answer\": \"...\"\n}\n```",
  "gpt_reformat_response": "{\n\"Open-ended Verifiable Question\": \"在张某、李某共同受贿案中，案件由T市监察委调查后移送T市检察院，张某曾被留置、李某未被留置。请说明：T市检察院在公安机关对张某执行拘留后对家属通知的义务是什么？同时，T市检察院在受理案件进入审查起诉阶段时，能否依法对未被留置的李某决定是否采取逮捕、取保候审或监视居住等强制措施？\",\n\"Ground-True Answer\": \"除无法通知的以外，T市检察院应当在公安机关执行拘留后24小时以内通知张某的家属；并且T市检察院在审查起诉过程中可依法根据案件情况决定是否对李某采取逮捕、取保候审或监视居住措施。\"\n}",
  "Open-ended Verifiable Question": "在张某、李某共同受贿案中，案件由T市监察委调查后移送T市检察院，张某曾被留置、李某未被留置。请说明：T市检察院在公安机关对张某执行拘留后对家属通知的义务是什么？同时，T市检察院在受理案件进入审查起诉阶段时，能否依法对未被留置的李某决定是否采取逮捕、取保候审或监视居住等强制措施？",
  "Ground-True Answer": "除无法通知的以外，T市检察院应当在公安机关执行拘留后24小时以内通知张某的家属；并且T市检察院在审查起诉过程中可依法根据案件情况决定是否对李某采取逮捕、取保候审或监视居住措施。"
}