{
  "question": "94.2012年5月26日，某市公安局以涉嫌合同诈骗将刘某刑事拘留。5月29日，该局决定延长刘某的拘留期限至6月25日。6月12日，某市公安局对刘某釆取取保候审措施。2013年10月25日，某市检察院对刘某作出解除取保候审决定书，同日，市公安局对刘某作出撤销案件决定书。2015年10月22日，刘某提出国家赔偿申请。下列说法正确的是？",
  "options": {
    "A": "市公安局和市检察院为共同赔偿义务机关",
    "B": "刘某提出国家赔偿申请已经超过法定时效",
    "C": "如市公安局以刘某情节轻微不构成犯罪为由撤销案件，可不承担赔偿责任",
    "D": "如市公安局实施拘留行为违法，刘某可以请求恢复名誉"
  },
  "answer_idx": "CD",
  "answer": "如市公安局以刘某情节轻微不构成犯罪为由撤销案件，可不承担赔偿责任。如市公安局实施拘留行为违法，刘某可以请求恢复名誉",
  "process_id": 215,
  "options_str": "A. 市公安局和市检察院为共同赔偿义务机关\nB. 刘某提出国家赔偿申请已经超过法定时效\nC. 如市公安局以刘某情节轻微不构成犯罪为由撤销案件，可不承担赔偿责任\nD. 如市公安局实施拘留行为违法，刘某可以请求恢复名誉",
  "gpt_filter_query": "<Multiple-choice Question>\n94.2012年5月26日，某市公安局以涉嫌合同诈骗将刘某刑事拘留。5月29日，该局决定延长刘某的拘留期限至6月25日。6月12日，某市公安局对刘某釆取取保候审措施。2013年10月25日，某市检察院对刘某作出解除取保候审决定书，同日，市公安局对刘某作出撤销案件决定书。2015年10月22日，刘某提出国家赔偿申请。下列说法正确的是？\nA. 市公安局和市检察院为共同赔偿义务机关\nB. 刘某提出国家赔偿申请已经超过法定时效\nC. 如市公安局以刘某情节轻微不构成犯罪为由撤销案件，可不承担赔偿责任\nD. 如市公安局实施拘留行为违法，刘某可以请求恢复名誉\nCorrect Answer: 如市公安局以刘某情节轻微不构成犯罪为由撤销案件，可不承担赔偿责任。如市公安局实施拘留行为违法，刘某可以请求恢复名誉\n</Multiple-choice Question>\n\nYou are an expert in filtering and evaluating multiple-choice questions for advanced reasoning tasks. Your job is to evaluate a given question and determine whether it meets the following criteria: \n1. **Depth of Reasoning:** The question should require deeper reasoning. If the question appears too simple, mark it as \"Too Simple\".\n2. **Unambiguous Correct Answer:** The question must have a unique and unambiguous correct answer. If the question asks for \"incorrect options\" or allows for multiple correct answers, mark it as \"Ambiguous Answer\".\n3. **Open-Ended Reformulation Feasibility:** The question should be suitable for reformatting into an open-ended format. If the question cannot be easily reformulated into an open-ended problem and a clear ground-truth answer, mark it as \"Not Reformulatable\".\n\nFor each question, provide one of the following evaluations:  \n- \"Pass\" (The question meets all the criteria.)  \n- \"Too Simple\"  \n- \"Ambiguous Answer\"  \n- \"Not Reformulatable\" ",
  "gpt_filter_response": "Pass",
  "gpt_reformat_query": "I will provide you with a multiple-choice question, and your task is to rewrite it into an open-ended question, along with a Ground-True Answer. The requirements are:\n\n1. The question must be specific, targeting the point being tested in the original multiple-choice question. Ensure it is open-ended, meaning no options are provided, but there must be a definitive Ground-True Answer.\n2. Based on the correct answer from the original question, provide a concise Ground-True Answer. The answer should allow for precise matching to determine whether the model's response is correct.\n\nHere is the multiple-choice question for you to rewrite:\n<Multiple-choice Question>\n94.2012年5月26日，某市公安局以涉嫌合同诈骗将刘某刑事拘留。5月29日，该局决定延长刘某的拘留期限至6月25日。6月12日，某市公安局对刘某釆取取保候审措施。2013年10月25日，某市检察院对刘某作出解除取保候审决定书，同日，市公安局对刘某作出撤销案件决定书。2015年10月22日，刘某提出国家赔偿申请。下列说法正确的是？\nA. 市公安局和市检察院为共同赔偿义务机关\nB. 刘某提出国家赔偿申请已经超过法定时效\nC. 如市公安局以刘某情节轻微不构成犯罪为由撤销案件，可不承担赔偿责任\nD. 如市公安局实施拘留行为违法，刘某可以请求恢复名誉\nCorrect Answer: 如市公安局以刘某情节轻微不构成犯罪为由撤销案件，可不承担赔偿责任。如市公安局实施拘留行为违法，刘某可以请求恢复名誉\n</Multiple-choice Question>\n\nPlease output the result in the following JSON format:\n```json\n{\n\"Open-ended Verifiable Question\": \"...\",\n\"Ground-True Answer\": \"...\"\n}\n```",
  "gpt_reformat_response": "{\n\"Open-ended Verifiable Question\": \"In a case where a public security bureau criminally detained Liu on May 26, 2012, extended the detention on May 29 to June 25, adopted bail pending trial on June 12, later the procuratorate lifted the bail on October 25, 2013, and the public security bureau on the same day decided to revoke the case, and Liu then filed a state compensation application on October 22, 2015: Among the following determinations, which are correct under China’s state compensation law? (1) If the public security bureau revoked the case on the ground that Liu’s conduct was minor and did not constitute a crime, it need not bear state compensation liability; (2) If the detention by the public security bureau was unlawful, Liu may request restoration of reputation. Provide the conclusions for (1) and (2).\",\n\"Ground-True Answer\": \"(1) Correct; (2) Correct.\"\n}",
  "Open-ended Verifiable Question": "In a case where a public security bureau criminally detained Liu on May 26, 2012, extended the detention on May 29 to June 25, adopted bail pending trial on June 12, later the procuratorate lifted the bail on October 25, 2013, and the public security bureau on the same day decided to revoke the case, and Liu then filed a state compensation application on October 22, 2015: Among the following determinations, which are correct under China’s state compensation law? (1) If the public security bureau revoked the case on the ground that Liu’s conduct was minor and did not constitute a crime, it need not bear state compensation liability; (2) If the detention by the public security bureau was unlawful, Liu may request restoration of reputation. Provide the conclusions for (1) and (2).",
  "Ground-True Answer": "(1) Correct; (2) Correct."
}