{
  "question": "下列关于民事法律关系的说法正确的是？",
  "options": {
    "A": "甲承租了乙的门面房经营酒吧,月租金30万元，由于新冠肺炎疫情根据政府的要求从2020年2月3日至5月20日不能营业，损失惨重，甲有权要求解除租赁合同法律关系",
    "B": "已故评书艺术家单某的声音极具特色和吸引力，甲高度模仿单某的声音在某市无线广播电台给乙公司的产品做广告，收入颇丰，甲的模仿行为没有侵犯单某的肖像权",
    "C": "甲、乙参加单位的足球比赛，甲踢飞的足球打在接球的乙的鼻子上，造成乙鼻梁骨骨折，花去700元医疗费，应当由甲承担侵权责任",
    "D": "民事责任是民事法律关系的内容之一"
  },
  "answer_idx": "A",
  "answer": "甲承租了乙的门面房经营酒吧,月租金30万元，由于新冠肺炎疫情根据政府的要求从2020年2月3日至5月20日不能营业，损失惨重，甲有权要求解除租赁合同法律关系",
  "process_id": 217,
  "options_str": "A. 甲承租了乙的门面房经营酒吧,月租金30万元，由于新冠肺炎疫情根据政府的要求从2020年2月3日至5月20日不能营业，损失惨重，甲有权要求解除租赁合同法律关系\nB. 已故评书艺术家单某的声音极具特色和吸引力，甲高度模仿单某的声音在某市无线广播电台给乙公司的产品做广告，收入颇丰，甲的模仿行为没有侵犯单某的肖像权\nC. 甲、乙参加单位的足球比赛，甲踢飞的足球打在接球的乙的鼻子上，造成乙鼻梁骨骨折，花去700元医疗费，应当由甲承担侵权责任\nD. 民事责任是民事法律关系的内容之一",
  "gpt_filter_query": "<Multiple-choice Question>\n下列关于民事法律关系的说法正确的是？\nA. 甲承租了乙的门面房经营酒吧,月租金30万元，由于新冠肺炎疫情根据政府的要求从2020年2月3日至5月20日不能营业，损失惨重，甲有权要求解除租赁合同法律关系\nB. 已故评书艺术家单某的声音极具特色和吸引力，甲高度模仿单某的声音在某市无线广播电台给乙公司的产品做广告，收入颇丰，甲的模仿行为没有侵犯单某的肖像权\nC. 甲、乙参加单位的足球比赛，甲踢飞的足球打在接球的乙的鼻子上，造成乙鼻梁骨骨折，花去700元医疗费，应当由甲承担侵权责任\nD. 民事责任是民事法律关系的内容之一\nCorrect Answer: 甲承租了乙的门面房经营酒吧,月租金30万元，由于新冠肺炎疫情根据政府的要求从2020年2月3日至5月20日不能营业，损失惨重，甲有权要求解除租赁合同法律关系\n</Multiple-choice Question>\n\nYou are an expert in filtering and evaluating multiple-choice questions for advanced reasoning tasks. Your job is to evaluate a given question and determine whether it meets the following criteria: \n1. **Depth of Reasoning:** The question should require deeper reasoning. If the question appears too simple, mark it as \"Too Simple\".\n2. **Unambiguous Correct Answer:** The question must have a unique and unambiguous correct answer. If the question asks for \"incorrect options\" or allows for multiple correct answers, mark it as \"Ambiguous Answer\".\n3. **Open-Ended Reformulation Feasibility:** The question should be suitable for reformatting into an open-ended format. If the question cannot be easily reformulated into an open-ended problem and a clear ground-truth answer, mark it as \"Not Reformulatable\".\n\nFor each question, provide one of the following evaluations:  \n- \"Pass\" (The question meets all the criteria.)  \n- \"Too Simple\"  \n- \"Ambiguous Answer\"  \n- \"Not Reformulatable\" ",
  "gpt_filter_response": "Ambiguous Answer"
}