{
  "question": "关于产品责任，下列选项正确的是？",
  "options": {
    "A": "甲专门生产胶囊，乙从丙药店购买胶囊类药物，导致肝功能衰竭死亡。经查，是由于乙体内铭含量超标造成的，而甲3年前确已知晓胶囊存在安全隐患，但为节约成本依然使用铭含量超标的原料进行生产。乙的近亲属可向甲或丙主张惩罚性赔偿",
    "B": "甲厂自行设计一款新型打气筒，正式销售前小偷乙潜入仓库盗窃其他财物，顺手带走一个打气筒，在使用过程中由于充气口爆裂造成乙受伤。因为产品尚未进入流通领域，甲厂可免责",
    "C": "甲从某超市购买一盒罐头，吃后中毒。经查该罐头为乙厂生产，丙运输过程中未按合同采取冷藏措施，导致罐头发生变质。甲可请求丙承担赔偿责任",
    "D": "上述C情形下，甲只能请求超市承担赔偿责任"
  },
  "answer_idx": "B",
  "answer": "甲厂自行设计一款新型打气筒，正式销售前小偷乙潜入仓库盗窃其他财物，顺手带走一个打气筒，在使用过程中由于充气口爆裂造成乙受伤。因为产品尚未进入流通领域，甲厂可免责",
  "process_id": 220,
  "options_str": "A. 甲专门生产胶囊，乙从丙药店购买胶囊类药物，导致肝功能衰竭死亡。经查，是由于乙体内铭含量超标造成的，而甲3年前确已知晓胶囊存在安全隐患，但为节约成本依然使用铭含量超标的原料进行生产。乙的近亲属可向甲或丙主张惩罚性赔偿\nB. 甲厂自行设计一款新型打气筒，正式销售前小偷乙潜入仓库盗窃其他财物，顺手带走一个打气筒，在使用过程中由于充气口爆裂造成乙受伤。因为产品尚未进入流通领域，甲厂可免责\nC. 甲从某超市购买一盒罐头，吃后中毒。经查该罐头为乙厂生产，丙运输过程中未按合同采取冷藏措施，导致罐头发生变质。甲可请求丙承担赔偿责任\nD. 上述C情形下，甲只能请求超市承担赔偿责任",
  "gpt_filter_query": "<Multiple-choice Question>\n关于产品责任，下列选项正确的是？\nA. 甲专门生产胶囊，乙从丙药店购买胶囊类药物，导致肝功能衰竭死亡。经查，是由于乙体内铭含量超标造成的，而甲3年前确已知晓胶囊存在安全隐患，但为节约成本依然使用铭含量超标的原料进行生产。乙的近亲属可向甲或丙主张惩罚性赔偿\nB. 甲厂自行设计一款新型打气筒，正式销售前小偷乙潜入仓库盗窃其他财物，顺手带走一个打气筒，在使用过程中由于充气口爆裂造成乙受伤。因为产品尚未进入流通领域，甲厂可免责\nC. 甲从某超市购买一盒罐头，吃后中毒。经查该罐头为乙厂生产，丙运输过程中未按合同采取冷藏措施，导致罐头发生变质。甲可请求丙承担赔偿责任\nD. 上述C情形下，甲只能请求超市承担赔偿责任\nCorrect Answer: 甲厂自行设计一款新型打气筒，正式销售前小偷乙潜入仓库盗窃其他财物，顺手带走一个打气筒，在使用过程中由于充气口爆裂造成乙受伤。因为产品尚未进入流通领域，甲厂可免责\n</Multiple-choice Question>\n\nYou are an expert in filtering and evaluating multiple-choice questions for advanced reasoning tasks. Your job is to evaluate a given question and determine whether it meets the following criteria: \n1. **Depth of Reasoning:** The question should require deeper reasoning. If the question appears too simple, mark it as \"Too Simple\".\n2. **Unambiguous Correct Answer:** The question must have a unique and unambiguous correct answer. If the question asks for \"incorrect options\" or allows for multiple correct answers, mark it as \"Ambiguous Answer\".\n3. **Open-Ended Reformulation Feasibility:** The question should be suitable for reformatting into an open-ended format. If the question cannot be easily reformulated into an open-ended problem and a clear ground-truth answer, mark it as \"Not Reformulatable\".\n\nFor each question, provide one of the following evaluations:  \n- \"Pass\" (The question meets all the criteria.)  \n- \"Too Simple\"  \n- \"Ambiguous Answer\"  \n- \"Not Reformulatable\" ",
  "gpt_filter_response": "Pass",
  "gpt_reformat_query": "I will provide you with a multiple-choice question, and your task is to rewrite it into an open-ended question, along with a Ground-True Answer. The requirements are:\n\n1. The question must be specific, targeting the point being tested in the original multiple-choice question. Ensure it is open-ended, meaning no options are provided, but there must be a definitive Ground-True Answer.\n2. Based on the correct answer from the original question, provide a concise Ground-True Answer. The answer should allow for precise matching to determine whether the model's response is correct.\n\nHere is the multiple-choice question for you to rewrite:\n<Multiple-choice Question>\n关于产品责任，下列选项正确的是？\nA. 甲专门生产胶囊，乙从丙药店购买胶囊类药物，导致肝功能衰竭死亡。经查，是由于乙体内铭含量超标造成的，而甲3年前确已知晓胶囊存在安全隐患，但为节约成本依然使用铭含量超标的原料进行生产。乙的近亲属可向甲或丙主张惩罚性赔偿\nB. 甲厂自行设计一款新型打气筒，正式销售前小偷乙潜入仓库盗窃其他财物，顺手带走一个打气筒，在使用过程中由于充气口爆裂造成乙受伤。因为产品尚未进入流通领域，甲厂可免责\nC. 甲从某超市购买一盒罐头，吃后中毒。经查该罐头为乙厂生产，丙运输过程中未按合同采取冷藏措施，导致罐头发生变质。甲可请求丙承担赔偿责任\nD. 上述C情形下，甲只能请求超市承担赔偿责任\nCorrect Answer: 甲厂自行设计一款新型打气筒，正式销售前小偷乙潜入仓库盗窃其他财物，顺手带走一个打气筒，在使用过程中由于充气口爆裂造成乙受伤。因为产品尚未进入流通领域，甲厂可免责\n</Multiple-choice Question>\n\nPlease output the result in the following JSON format:\n```json\n{\n\"Open-ended Verifiable Question\": \"...\",\n\"Ground-True Answer\": \"...\"\n}\n```",
  "gpt_reformat_response": "{\n\"Open-ended Verifiable Question\": \"在产品责任法情形中，甲厂自行设计的新型打气筒尚未正式销售，小偷乙潜入仓库盗窃其他财物并顺手带走一个打气筒，在使用过程中因充气口爆裂受伤。由于该产品尚未进入流通领域，甲厂是否可以免除产品责任？请给出明确结论。\",\n\"Ground-True Answer\": \"可以免责，因产品未进入流通领域。\"\n}",
  "Open-ended Verifiable Question": "在产品责任法情形中，甲厂自行设计的新型打气筒尚未正式销售，小偷乙潜入仓库盗窃其他财物并顺手带走一个打气筒，在使用过程中因充气口爆裂受伤。由于该产品尚未进入流通领域，甲厂是否可以免除产品责任？请给出明确结论。",
  "Ground-True Answer": "可以免责，因产品未进入流通领域。"
}