{
  "question": "48.2019年1月1日，甲、乙双方签署了房屋抵押合同，甲用房屋抵押担保借款200万元，合同约定甲应于1年内将原有抵押解除后，双方再办理房屋抵押登记手续。为防止甲将房屋再次抵押给他人,甲、乙于2019年5月9日自行到公证部门办理了抵押合同公证手续，双方约定此公证有预告登记的法律效果。之后,2019年6月12日，甲将该房屋再次抵押给不知情的丙，用于借款100万元的担保，双方办理了抵押登记手续。请问以下说法中正确的是？",
  "options": {
    "A": "房屋抵押合同不可以办理预告登记，因此预告登记无效",
    "B": "丙取得该房屋抵押权但不属于善意取得",
    "C": "甲应对乙承担侵害抵押权的法律责任",
    "D": "乙可以起诉甲，根据双方签订的抵押合同办理抵押登记，办理抵押登记后乙的抵押权优先于丙的抵押权"
  },
  "answer_idx": "B",
  "answer": "丙取得该房屋抵押权但不属于善意取得",
  "process_id": 221,
  "options_str": "A. 房屋抵押合同不可以办理预告登记，因此预告登记无效\nB. 丙取得该房屋抵押权但不属于善意取得\nC. 甲应对乙承担侵害抵押权的法律责任\nD. 乙可以起诉甲，根据双方签订的抵押合同办理抵押登记，办理抵押登记后乙的抵押权优先于丙的抵押权",
  "gpt_filter_query": "<Multiple-choice Question>\n48.2019年1月1日，甲、乙双方签署了房屋抵押合同，甲用房屋抵押担保借款200万元，合同约定甲应于1年内将原有抵押解除后，双方再办理房屋抵押登记手续。为防止甲将房屋再次抵押给他人,甲、乙于2019年5月9日自行到公证部门办理了抵押合同公证手续，双方约定此公证有预告登记的法律效果。之后,2019年6月12日，甲将该房屋再次抵押给不知情的丙，用于借款100万元的担保，双方办理了抵押登记手续。请问以下说法中正确的是？\nA. 房屋抵押合同不可以办理预告登记，因此预告登记无效\nB. 丙取得该房屋抵押权但不属于善意取得\nC. 甲应对乙承担侵害抵押权的法律责任\nD. 乙可以起诉甲，根据双方签订的抵押合同办理抵押登记，办理抵押登记后乙的抵押权优先于丙的抵押权\nCorrect Answer: 丙取得该房屋抵押权但不属于善意取得\n</Multiple-choice Question>\n\nYou are an expert in filtering and evaluating multiple-choice questions for advanced reasoning tasks. Your job is to evaluate a given question and determine whether it meets the following criteria: \n1. **Depth of Reasoning:** The question should require deeper reasoning. If the question appears too simple, mark it as \"Too Simple\".\n2. **Unambiguous Correct Answer:** The question must have a unique and unambiguous correct answer. If the question asks for \"incorrect options\" or allows for multiple correct answers, mark it as \"Ambiguous Answer\".\n3. **Open-Ended Reformulation Feasibility:** The question should be suitable for reformatting into an open-ended format. If the question cannot be easily reformulated into an open-ended problem and a clear ground-truth answer, mark it as \"Not Reformulatable\".\n\nFor each question, provide one of the following evaluations:  \n- \"Pass\" (The question meets all the criteria.)  \n- \"Too Simple\"  \n- \"Ambiguous Answer\"  \n- \"Not Reformulatable\" ",
  "gpt_filter_response": "Pass",
  "gpt_reformat_query": "I will provide you with a multiple-choice question, and your task is to rewrite it into an open-ended question, along with a Ground-True Answer. The requirements are:\n\n1. The question must be specific, targeting the point being tested in the original multiple-choice question. Ensure it is open-ended, meaning no options are provided, but there must be a definitive Ground-True Answer.\n2. Based on the correct answer from the original question, provide a concise Ground-True Answer. The answer should allow for precise matching to determine whether the model's response is correct.\n\nHere is the multiple-choice question for you to rewrite:\n<Multiple-choice Question>\n48.2019年1月1日，甲、乙双方签署了房屋抵押合同，甲用房屋抵押担保借款200万元，合同约定甲应于1年内将原有抵押解除后，双方再办理房屋抵押登记手续。为防止甲将房屋再次抵押给他人,甲、乙于2019年5月9日自行到公证部门办理了抵押合同公证手续，双方约定此公证有预告登记的法律效果。之后,2019年6月12日，甲将该房屋再次抵押给不知情的丙，用于借款100万元的担保，双方办理了抵押登记手续。请问以下说法中正确的是？\nA. 房屋抵押合同不可以办理预告登记，因此预告登记无效\nB. 丙取得该房屋抵押权但不属于善意取得\nC. 甲应对乙承担侵害抵押权的法律责任\nD. 乙可以起诉甲，根据双方签订的抵押合同办理抵押登记，办理抵押登记后乙的抵押权优先于丙的抵押权\nCorrect Answer: 丙取得该房屋抵押权但不属于善意取得\n</Multiple-choice Question>\n\nPlease output the result in the following JSON format:\n```json\n{\n\"Open-ended Verifiable Question\": \"...\",\n\"Ground-True Answer\": \"...\"\n}\n```",
  "gpt_reformat_response": "{\n\"Open-ended Verifiable Question\": \"在以下情形下应如何认定丙对房屋抵押权的取得性质：甲、乙于2019年1月1日签订房屋抵押合同，约定待甲于一年内解除原抵押后再办理抵押登记；为防止重复抵押，甲、乙于2019年5月9日自行至公证部门对抵押合同办理公证并约定该公证具有预告登记法律效果；2019年6月12日，甲又将该房屋抵押给不知情的丙并与丙办理了抵押登记。请判断丙取得的抵押权是否构成善意取得，并给出结论。\",\n\"Ground-True Answer\": \"丙取得该房屋抵押权，但不属于善意取得。\"\n}",
  "Open-ended Verifiable Question": "在以下情形下应如何认定丙对房屋抵押权的取得性质：甲、乙于2019年1月1日签订房屋抵押合同，约定待甲于一年内解除原抵押后再办理抵押登记；为防止重复抵押，甲、乙于2019年5月9日自行至公证部门对抵押合同办理公证并约定该公证具有预告登记法律效果；2019年6月12日，甲又将该房屋抵押给不知情的丙并与丙办理了抵押登记。请判断丙取得的抵押权是否构成善意取得，并给出结论。",
  "Ground-True Answer": "丙取得该房屋抵押权，但不属于善意取得。"
}