{
  "question": "2018年欢乐公司吸收合并叮当公司，达到国务院规定的经营者集中申报标准。但并未申报，上述合并实施后，欢乐公司在网络音乐市场所占份额达到70%,并通过与上游唱片公司签订独家版权协议进一步巩固了其市场地位。对此，下列说法正确的是？",
  "options": {
    "A": "题述合并应在实施前，向国务院反垄断执法机构申报",
    "B": "国务院反垄断执法机构对经营者集中进行审查后，作出不予禁止的决定，并可以附加限制性条件，以减少集中对竞争产生的不利影响",
    "C": "欢乐公司行为违反了《反垄断法》，反垄断执法机构可处以50万元以下罚款",
    "D": "欢乐公司行为违反了《反垄断法》，反垄断执法机构可责令欢乐公司解除独家"
  },
  "answer_idx": "ABCD",
  "answer": "题述合并应在实施前，向国务院反垄断执法机构申报。国务院反垄断执法机构对经营者集中进行审查后，作出不予禁止的决定，并可以附加限制性条件，以减少集中对竞争产生的不利影响。欢乐公司行为违反了《反垄断法》，反垄断执法机构可处以50万元以下罚款。欢乐公司行为违反了《反垄断法》，反垄断执法机构可责令欢乐公司解除独家",
  "process_id": 222,
  "options_str": "A. 题述合并应在实施前，向国务院反垄断执法机构申报\nB. 国务院反垄断执法机构对经营者集中进行审查后，作出不予禁止的决定，并可以附加限制性条件，以减少集中对竞争产生的不利影响\nC. 欢乐公司行为违反了《反垄断法》，反垄断执法机构可处以50万元以下罚款\nD. 欢乐公司行为违反了《反垄断法》，反垄断执法机构可责令欢乐公司解除独家",
  "gpt_filter_query": "<Multiple-choice Question>\n2018年欢乐公司吸收合并叮当公司，达到国务院规定的经营者集中申报标准。但并未申报，上述合并实施后，欢乐公司在网络音乐市场所占份额达到70%,并通过与上游唱片公司签订独家版权协议进一步巩固了其市场地位。对此，下列说法正确的是？\nA. 题述合并应在实施前，向国务院反垄断执法机构申报\nB. 国务院反垄断执法机构对经营者集中进行审查后，作出不予禁止的决定，并可以附加限制性条件，以减少集中对竞争产生的不利影响\nC. 欢乐公司行为违反了《反垄断法》，反垄断执法机构可处以50万元以下罚款\nD. 欢乐公司行为违反了《反垄断法》，反垄断执法机构可责令欢乐公司解除独家\nCorrect Answer: 题述合并应在实施前，向国务院反垄断执法机构申报。国务院反垄断执法机构对经营者集中进行审查后，作出不予禁止的决定，并可以附加限制性条件，以减少集中对竞争产生的不利影响。欢乐公司行为违反了《反垄断法》，反垄断执法机构可处以50万元以下罚款。欢乐公司行为违反了《反垄断法》，反垄断执法机构可责令欢乐公司解除独家\n</Multiple-choice Question>\n\nYou are an expert in filtering and evaluating multiple-choice questions for advanced reasoning tasks. Your job is to evaluate a given question and determine whether it meets the following criteria: \n1. **Depth of Reasoning:** The question should require deeper reasoning. If the question appears too simple, mark it as \"Too Simple\".\n2. **Unambiguous Correct Answer:** The question must have a unique and unambiguous correct answer. If the question asks for \"incorrect options\" or allows for multiple correct answers, mark it as \"Ambiguous Answer\".\n3. **Open-Ended Reformulation Feasibility:** The question should be suitable for reformatting into an open-ended format. If the question cannot be easily reformulated into an open-ended problem and a clear ground-truth answer, mark it as \"Not Reformulatable\".\n\nFor each question, provide one of the following evaluations:  \n- \"Pass\" (The question meets all the criteria.)  \n- \"Too Simple\"  \n- \"Ambiguous Answer\"  \n- \"Not Reformulatable\" ",
  "gpt_filter_response": "Ambiguous Answer"
}