{
  "question": "下列哪些行为属于盗窃？",
  "options": {
    "A": "世界杯期间，甲将李某为了观看足球比赛而买的电视机（价值1万元）窃取以便自己观看，世界杯结束以后归还的",
    "B": "李某欠乙1万元，李某为了还款，将自己10万元的储蓄卡交给乙（李某没有现金），让乙自己取1万元，乙在自动取款机上取走10万元据为己有的",
    "C": "丙为了自用，盗接他人通信线路、复制他人电信码号或者明知是盗接、复制的电信设备、设施而使用的",
    "D": "房主张某将房屋租给丁居住，约定丁不得转移、使用其衣柜里的财物，但丁却将衣柜里的财物全部卖与他人的"
  },
  "answer_idx": "ABCD",
  "answer": "世界杯期间，甲将李某为了观看足球比赛而买的电视机（价值1万元）窃取以便自己观看，世界杯结束以后归还的。李某欠乙1万元，李某为了还款，将自己10万元的储蓄卡交给乙（李某没有现金），让乙自己取1万元，乙在自动取款机上取走10万元据为己有的。丙为了自用，盗接他人通信线路、复制他人电信码号或者明知是盗接、复制的电信设备、设施而使用的。房主张某将房屋租给丁居住，约定丁不得转移、使用其衣柜里的财物，但丁却将衣柜里的财物全部卖与他人的",
  "process_id": 232,
  "options_str": "A. 世界杯期间，甲将李某为了观看足球比赛而买的电视机（价值1万元）窃取以便自己观看，世界杯结束以后归还的\nB. 李某欠乙1万元，李某为了还款，将自己10万元的储蓄卡交给乙（李某没有现金），让乙自己取1万元，乙在自动取款机上取走10万元据为己有的\nC. 丙为了自用，盗接他人通信线路、复制他人电信码号或者明知是盗接、复制的电信设备、设施而使用的\nD. 房主张某将房屋租给丁居住，约定丁不得转移、使用其衣柜里的财物，但丁却将衣柜里的财物全部卖与他人的",
  "gpt_filter_query": "<Multiple-choice Question>\n下列哪些行为属于盗窃？\nA. 世界杯期间，甲将李某为了观看足球比赛而买的电视机（价值1万元）窃取以便自己观看，世界杯结束以后归还的\nB. 李某欠乙1万元，李某为了还款，将自己10万元的储蓄卡交给乙（李某没有现金），让乙自己取1万元，乙在自动取款机上取走10万元据为己有的\nC. 丙为了自用，盗接他人通信线路、复制他人电信码号或者明知是盗接、复制的电信设备、设施而使用的\nD. 房主张某将房屋租给丁居住，约定丁不得转移、使用其衣柜里的财物，但丁却将衣柜里的财物全部卖与他人的\nCorrect Answer: 世界杯期间，甲将李某为了观看足球比赛而买的电视机（价值1万元）窃取以便自己观看，世界杯结束以后归还的。李某欠乙1万元，李某为了还款，将自己10万元的储蓄卡交给乙（李某没有现金），让乙自己取1万元，乙在自动取款机上取走10万元据为己有的。丙为了自用，盗接他人通信线路、复制他人电信码号或者明知是盗接、复制的电信设备、设施而使用的。房主张某将房屋租给丁居住，约定丁不得转移、使用其衣柜里的财物，但丁却将衣柜里的财物全部卖与他人的\n</Multiple-choice Question>\n\nYou are an expert in filtering and evaluating multiple-choice questions for advanced reasoning tasks. Your job is to evaluate a given question and determine whether it meets the following criteria: \n1. **Depth of Reasoning:** The question should require deeper reasoning. If the question appears too simple, mark it as \"Too Simple\".\n2. **Unambiguous Correct Answer:** The question must have a unique and unambiguous correct answer. If the question asks for \"incorrect options\" or allows for multiple correct answers, mark it as \"Ambiguous Answer\".\n3. **Open-Ended Reformulation Feasibility:** The question should be suitable for reformatting into an open-ended format. If the question cannot be easily reformulated into an open-ended problem and a clear ground-truth answer, mark it as \"Not Reformulatable\".\n\nFor each question, provide one of the following evaluations:  \n- \"Pass\" (The question meets all the criteria.)  \n- \"Too Simple\"  \n- \"Ambiguous Answer\"  \n- \"Not Reformulatable\" ",
  "gpt_filter_response": "Ambiguous Answer"
}