{
  "question": "关于财产犯罪和人身犯罪，下列说法正确的有？",
  "options": {
    "A": "甲盗窃丙的财物，被发现后逃跑，丙追赶。甲逃跑途中遇见乙，告知乙真相，请乙帮助自己殴打丙、拦住丙。乙便对丙实施暴力，将丙打倒，致丙轻伤。甲乙构成抢劫罪的共同犯罪",
    "B": "甲欲入户抢劫丙家，进入丙家，用迷药将丙迷晕，甲欲将丙家的保险柜抬走，无奈由于太重而搬不动。甲便电话告知乙，请其来帮忙，乙答应，来到丙家，与甲共同搬走保险柜。甲乙构成抢劫罪的共同犯罪",
    "C": "乙在水果摊位购买水果后，不付钱便离开。摊主甲追上前讨要水果钱，抓住乙的肩膀不让走，乙在挣脱中摔倒在地，导致重伤。甲构成过失致人重伤罪",
    "D": "甲是无业游民，购买了一批假药，打算免费赠送老年人，骗取信任，以此诈骗其钱财。然而，存储假药的仓库发生火灾，假药全部被毁。甲构成诈骗罪的犯罪预备和提供假药罪的犯罪预备"
  },
  "answer_idx": "AB",
  "answer": "甲盗窃丙的财物，被发现后逃跑，丙追赶。甲逃跑途中遇见乙，告知乙真相，请乙帮助自己殴打丙、拦住丙。乙便对丙实施暴力，将丙打倒，致丙轻伤。甲乙构成抢劫罪的共同犯罪。甲欲入户抢劫丙家，进入丙家，用迷药将丙迷晕，甲欲将丙家的保险柜抬走，无奈由于太重而搬不动。甲便电话告知乙，请其来帮忙，乙答应，来到丙家，与甲共同搬走保险柜。甲乙构成抢劫罪的共同犯罪",
  "process_id": 235,
  "options_str": "A. 甲盗窃丙的财物，被发现后逃跑，丙追赶。甲逃跑途中遇见乙，告知乙真相，请乙帮助自己殴打丙、拦住丙。乙便对丙实施暴力，将丙打倒，致丙轻伤。甲乙构成抢劫罪的共同犯罪\nB. 甲欲入户抢劫丙家，进入丙家，用迷药将丙迷晕，甲欲将丙家的保险柜抬走，无奈由于太重而搬不动。甲便电话告知乙，请其来帮忙，乙答应，来到丙家，与甲共同搬走保险柜。甲乙构成抢劫罪的共同犯罪\nC. 乙在水果摊位购买水果后，不付钱便离开。摊主甲追上前讨要水果钱，抓住乙的肩膀不让走，乙在挣脱中摔倒在地，导致重伤。甲构成过失致人重伤罪\nD. 甲是无业游民，购买了一批假药，打算免费赠送老年人，骗取信任，以此诈骗其钱财。然而，存储假药的仓库发生火灾，假药全部被毁。甲构成诈骗罪的犯罪预备和提供假药罪的犯罪预备",
  "gpt_filter_query": "<Multiple-choice Question>\n关于财产犯罪和人身犯罪，下列说法正确的有？\nA. 甲盗窃丙的财物，被发现后逃跑，丙追赶。甲逃跑途中遇见乙，告知乙真相，请乙帮助自己殴打丙、拦住丙。乙便对丙实施暴力，将丙打倒，致丙轻伤。甲乙构成抢劫罪的共同犯罪\nB. 甲欲入户抢劫丙家，进入丙家，用迷药将丙迷晕，甲欲将丙家的保险柜抬走，无奈由于太重而搬不动。甲便电话告知乙，请其来帮忙，乙答应，来到丙家，与甲共同搬走保险柜。甲乙构成抢劫罪的共同犯罪\nC. 乙在水果摊位购买水果后，不付钱便离开。摊主甲追上前讨要水果钱，抓住乙的肩膀不让走，乙在挣脱中摔倒在地，导致重伤。甲构成过失致人重伤罪\nD. 甲是无业游民，购买了一批假药，打算免费赠送老年人，骗取信任，以此诈骗其钱财。然而，存储假药的仓库发生火灾，假药全部被毁。甲构成诈骗罪的犯罪预备和提供假药罪的犯罪预备\nCorrect Answer: 甲盗窃丙的财物，被发现后逃跑，丙追赶。甲逃跑途中遇见乙，告知乙真相，请乙帮助自己殴打丙、拦住丙。乙便对丙实施暴力，将丙打倒，致丙轻伤。甲乙构成抢劫罪的共同犯罪。甲欲入户抢劫丙家，进入丙家，用迷药将丙迷晕，甲欲将丙家的保险柜抬走，无奈由于太重而搬不动。甲便电话告知乙，请其来帮忙，乙答应，来到丙家，与甲共同搬走保险柜。甲乙构成抢劫罪的共同犯罪\n</Multiple-choice Question>\n\nYou are an expert in filtering and evaluating multiple-choice questions for advanced reasoning tasks. Your job is to evaluate a given question and determine whether it meets the following criteria: \n1. **Depth of Reasoning:** The question should require deeper reasoning. If the question appears too simple, mark it as \"Too Simple\".\n2. **Unambiguous Correct Answer:** The question must have a unique and unambiguous correct answer. If the question asks for \"incorrect options\" or allows for multiple correct answers, mark it as \"Ambiguous Answer\".\n3. **Open-Ended Reformulation Feasibility:** The question should be suitable for reformatting into an open-ended format. If the question cannot be easily reformulated into an open-ended problem and a clear ground-truth answer, mark it as \"Not Reformulatable\".\n\nFor each question, provide one of the following evaluations:  \n- \"Pass\" (The question meets all the criteria.)  \n- \"Too Simple\"  \n- \"Ambiguous Answer\"  \n- \"Not Reformulatable\" ",
  "gpt_filter_response": "Ambiguous Answer"
}