{
  "question": "甲公司是《保护工业产权巴黎公约》成员国A国的企业，于2012年8月1日向A国在牛奶产品上申请注册“白雪\"商标被受理后，又于2013年5月30日向我国商标局申请注册“白雪\"商标，核定使用在牛奶、糕点和食品容器这三类商品上。下列哪些说法是错误的？",
  "options": {
    "A": "甲公司应委托依法设立的商标代理机构代理申请商标注册",
    "B": "甲公司必须提出三份注册申请，分别在三类商品上申请注册同一商标",
    "C": "甲公司可依法享有优先权",
    "D": "如商标局在异议程序中认定“白雪”商标为驰名商标，甲公司可在其牛奶包装上使用“驰名商标\"字样"
  },
  "answer_idx": "BCD",
  "answer": "甲公司必须提出三份注册申请，分别在三类商品上申请注册同一商标。甲公司可依法享有优先权。如商标局在异议程序中认定“白雪”商标为驰名商标，甲公司可在其牛奶包装上使用“驰名商标\"字样",
  "process_id": 27,
  "options_str": "A. 甲公司应委托依法设立的商标代理机构代理申请商标注册\nB. 甲公司必须提出三份注册申请，分别在三类商品上申请注册同一商标\nC. 甲公司可依法享有优先权\nD. 如商标局在异议程序中认定“白雪”商标为驰名商标，甲公司可在其牛奶包装上使用“驰名商标\"字样",
  "gpt_filter_query": "<Multiple-choice Question>\n甲公司是《保护工业产权巴黎公约》成员国A国的企业，于2012年8月1日向A国在牛奶产品上申请注册“白雪\"商标被受理后，又于2013年5月30日向我国商标局申请注册“白雪\"商标，核定使用在牛奶、糕点和食品容器这三类商品上。下列哪些说法是错误的？\nA. 甲公司应委托依法设立的商标代理机构代理申请商标注册\nB. 甲公司必须提出三份注册申请，分别在三类商品上申请注册同一商标\nC. 甲公司可依法享有优先权\nD. 如商标局在异议程序中认定“白雪”商标为驰名商标，甲公司可在其牛奶包装上使用“驰名商标\"字样\nCorrect Answer: 甲公司必须提出三份注册申请，分别在三类商品上申请注册同一商标。甲公司可依法享有优先权。如商标局在异议程序中认定“白雪”商标为驰名商标，甲公司可在其牛奶包装上使用“驰名商标\"字样\n</Multiple-choice Question>\n\nYou are an expert in filtering and evaluating multiple-choice questions for advanced reasoning tasks. Your job is to evaluate a given question and determine whether it meets the following criteria: \n1. **Depth of Reasoning:** The question should require deeper reasoning. If the question appears too simple, mark it as \"Too Simple\".\n2. **Unambiguous Correct Answer:** The question must have a unique and unambiguous correct answer. If the question asks for \"incorrect options\" or allows for multiple correct answers, mark it as \"Ambiguous Answer\".\n3. **Open-Ended Reformulation Feasibility:** The question should be suitable for reformatting into an open-ended format. If the question cannot be easily reformulated into an open-ended problem and a clear ground-truth answer, mark it as \"Not Reformulatable\".\n\nFor each question, provide one of the following evaluations:  \n- \"Pass\" (The question meets all the criteria.)  \n- \"Too Simple\"  \n- \"Ambiguous Answer\"  \n- \"Not Reformulatable\" ",
  "gpt_filter_response": "Ambiguous Answer"
}