{
  "question": "当事人可对某些诉讼事项进行约定，法院应尊重合法有效的约定。关于当事人的约定及其效力，下列哪些表述是错误的？",
  "options": {
    "A": "当事人约定“合同是否履行无法证明时，应以甲方主张的事实为准\"，法院应根据该约定分配证明责任",
    "B": "当事人在诉讼和解中约定“原告撤诉后不得以相同的事由再次提起诉讼”，法院根据该约定不能再受理原告的起诉",
    "C": "当事人约定“如果起诉，只能适用普通程序。\"法院根据该约定不能适用简易程序审理",
    "D": "当事人约定“双方必须亲自参加开庭审理，不得无故缺席。\"如果被告委托了代理人参加开庭，自己不参加开庭，法院应根据该约定在对被告两次传唤后对其拘传"
  },
  "answer_idx": "ABCD",
  "answer": "当事人约定“合同是否履行无法证明时，应以甲方主张的事实为准\"，法院应根据该约定分配证明责任。当事人在诉讼和解中约定“原告撤诉后不得以相同的事由再次提起诉讼”，法院根据该约定不能再受理原告的起诉。当事人约定“如果起诉，只能适用普通程序。\"法院根据该约定不能适用简易程序审理。当事人约定“双方必须亲自参加开庭审理，不得无故缺席。\"如果被告委托了代理人参加开庭，自己不参加开庭，法院应根据该约定在对被告两次传唤后对其拘传",
  "process_id": 29,
  "options_str": "A. 当事人约定“合同是否履行无法证明时，应以甲方主张的事实为准\"，法院应根据该约定分配证明责任\nB. 当事人在诉讼和解中约定“原告撤诉后不得以相同的事由再次提起诉讼”，法院根据该约定不能再受理原告的起诉\nC. 当事人约定“如果起诉，只能适用普通程序。\"法院根据该约定不能适用简易程序审理\nD. 当事人约定“双方必须亲自参加开庭审理，不得无故缺席。\"如果被告委托了代理人参加开庭，自己不参加开庭，法院应根据该约定在对被告两次传唤后对其拘传",
  "gpt_filter_query": "<Multiple-choice Question>\n当事人可对某些诉讼事项进行约定，法院应尊重合法有效的约定。关于当事人的约定及其效力，下列哪些表述是错误的？\nA. 当事人约定“合同是否履行无法证明时，应以甲方主张的事实为准\"，法院应根据该约定分配证明责任\nB. 当事人在诉讼和解中约定“原告撤诉后不得以相同的事由再次提起诉讼”，法院根据该约定不能再受理原告的起诉\nC. 当事人约定“如果起诉，只能适用普通程序。\"法院根据该约定不能适用简易程序审理\nD. 当事人约定“双方必须亲自参加开庭审理，不得无故缺席。\"如果被告委托了代理人参加开庭，自己不参加开庭，法院应根据该约定在对被告两次传唤后对其拘传\nCorrect Answer: 当事人约定“合同是否履行无法证明时，应以甲方主张的事实为准\"，法院应根据该约定分配证明责任。当事人在诉讼和解中约定“原告撤诉后不得以相同的事由再次提起诉讼”，法院根据该约定不能再受理原告的起诉。当事人约定“如果起诉，只能适用普通程序。\"法院根据该约定不能适用简易程序审理。当事人约定“双方必须亲自参加开庭审理，不得无故缺席。\"如果被告委托了代理人参加开庭，自己不参加开庭，法院应根据该约定在对被告两次传唤后对其拘传\n</Multiple-choice Question>\n\nYou are an expert in filtering and evaluating multiple-choice questions for advanced reasoning tasks. Your job is to evaluate a given question and determine whether it meets the following criteria: \n1. **Depth of Reasoning:** The question should require deeper reasoning. If the question appears too simple, mark it as \"Too Simple\".\n2. **Unambiguous Correct Answer:** The question must have a unique and unambiguous correct answer. If the question asks for \"incorrect options\" or allows for multiple correct answers, mark it as \"Ambiguous Answer\".\n3. **Open-Ended Reformulation Feasibility:** The question should be suitable for reformatting into an open-ended format. If the question cannot be easily reformulated into an open-ended problem and a clear ground-truth answer, mark it as \"Not Reformulatable\".\n\nFor each question, provide one of the following evaluations:  \n- \"Pass\" (The question meets all the criteria.)  \n- \"Too Simple\"  \n- \"Ambiguous Answer\"  \n- \"Not Reformulatable\" ",
  "gpt_filter_response": "Ambiguous Answer"
}