{
  "question": "审判组织是我国法院行使审判权的组织形式。关于审判组织，下列说法错误的是：",
  "options": {
    "A": "独任庭只能适用简易程序审理民事案件，但并不排斥普通程序某些规则的运用",
    "B": "独任法官发现案件疑难复杂，可以转为普通程序审理，但不得提交审委会讨论",
    "C": "再审程序属于纠错程序，为确保办案质量，应当由审判员组成合议庭进行审理",
    "D": "不能以审委会名义发布裁判文书，但审委会意见对合议庭具有重要的参考作用"
  },
  "answer_idx": "ABCD",
  "answer": "独任庭只能适用简易程序审理民事案件，但并不排斥普通程序某些规则的运用。独任法官发现案件疑难复杂，可以转为普通程序审理，但不得提交审委会讨论。再审程序属于纠错程序，为确保办案质量，应当由审判员组成合议庭进行审理。不能以审委会名义发布裁判文书，但审委会意见对合议庭具有重要的参考作用",
  "process_id": 43,
  "options_str": "A. 独任庭只能适用简易程序审理民事案件，但并不排斥普通程序某些规则的运用\nB. 独任法官发现案件疑难复杂，可以转为普通程序审理，但不得提交审委会讨论\nC. 再审程序属于纠错程序，为确保办案质量，应当由审判员组成合议庭进行审理\nD. 不能以审委会名义发布裁判文书，但审委会意见对合议庭具有重要的参考作用",
  "gpt_filter_query": "<Multiple-choice Question>\n审判组织是我国法院行使审判权的组织形式。关于审判组织，下列说法错误的是：\nA. 独任庭只能适用简易程序审理民事案件，但并不排斥普通程序某些规则的运用\nB. 独任法官发现案件疑难复杂，可以转为普通程序审理，但不得提交审委会讨论\nC. 再审程序属于纠错程序，为确保办案质量，应当由审判员组成合议庭进行审理\nD. 不能以审委会名义发布裁判文书，但审委会意见对合议庭具有重要的参考作用\nCorrect Answer: 独任庭只能适用简易程序审理民事案件，但并不排斥普通程序某些规则的运用。独任法官发现案件疑难复杂，可以转为普通程序审理，但不得提交审委会讨论。再审程序属于纠错程序，为确保办案质量，应当由审判员组成合议庭进行审理。不能以审委会名义发布裁判文书，但审委会意见对合议庭具有重要的参考作用\n</Multiple-choice Question>\n\nYou are an expert in filtering and evaluating multiple-choice questions for advanced reasoning tasks. Your job is to evaluate a given question and determine whether it meets the following criteria: \n1. **Depth of Reasoning:** The question should require deeper reasoning. If the question appears too simple, mark it as \"Too Simple\".\n2. **Unambiguous Correct Answer:** The question must have a unique and unambiguous correct answer. If the question asks for \"incorrect options\" or allows for multiple correct answers, mark it as \"Ambiguous Answer\".\n3. **Open-Ended Reformulation Feasibility:** The question should be suitable for reformatting into an open-ended format. If the question cannot be easily reformulated into an open-ended problem and a clear ground-truth answer, mark it as \"Not Reformulatable\".\n\nFor each question, provide one of the following evaluations:  \n- \"Pass\" (The question meets all the criteria.)  \n- \"Too Simple\"  \n- \"Ambiguous Answer\"  \n- \"Not Reformulatable\" ",
  "gpt_filter_response": "Ambiguous Answer"
}