{
  "question": "关于不作为犯罪，下列哪些选项是正确的？",
  "options": {
    "A": "儿童在公共游泳池溺水时，其父甲、救生员乙均故意不救助。甲、乙均成立不作为犯罪",
    "B": "在离婚诉讼期间，丈夫误认为自己无义务救助落水的妻子，致妻子溺水身亡的，成立过失的不作为犯罪",
    "C": "甲在火灾之际，能救出母亲，但为救出女友而未救出母亲。如无排除犯罪的事由，甲构成不作为犯罪",
    "D": "甲向乙的咖啡投毒，看到乙喝了几口后将咖啡递给丙，因担心罪行败露，甲未阻止丙喝咖啡，导致乙、丙均死亡。甲对乙是作为犯罪，对丙是不作为犯罪"
  },
  "answer_idx": "ACD",
  "answer": "儿童在公共游泳池溺水时，其父甲、救生员乙均故意不救助。甲、乙均成立不作为犯罪。甲在火灾之际，能救出母亲，但为救出女友而未救出母亲。如无排除犯罪的事由，甲构成不作为犯罪。甲向乙的咖啡投毒，看到乙喝了几口后将咖啡递给丙，因担心罪行败露，甲未阻止丙喝咖啡，导致乙、丙均死亡。甲对乙是作为犯罪，对丙是不作为犯罪",
  "process_id": 46,
  "options_str": "A. 儿童在公共游泳池溺水时，其父甲、救生员乙均故意不救助。甲、乙均成立不作为犯罪\nB. 在离婚诉讼期间，丈夫误认为自己无义务救助落水的妻子，致妻子溺水身亡的，成立过失的不作为犯罪\nC. 甲在火灾之际，能救出母亲，但为救出女友而未救出母亲。如无排除犯罪的事由，甲构成不作为犯罪\nD. 甲向乙的咖啡投毒，看到乙喝了几口后将咖啡递给丙，因担心罪行败露，甲未阻止丙喝咖啡，导致乙、丙均死亡。甲对乙是作为犯罪，对丙是不作为犯罪",
  "gpt_filter_query": "<Multiple-choice Question>\n关于不作为犯罪，下列哪些选项是正确的？\nA. 儿童在公共游泳池溺水时，其父甲、救生员乙均故意不救助。甲、乙均成立不作为犯罪\nB. 在离婚诉讼期间，丈夫误认为自己无义务救助落水的妻子，致妻子溺水身亡的，成立过失的不作为犯罪\nC. 甲在火灾之际，能救出母亲，但为救出女友而未救出母亲。如无排除犯罪的事由，甲构成不作为犯罪\nD. 甲向乙的咖啡投毒，看到乙喝了几口后将咖啡递给丙，因担心罪行败露，甲未阻止丙喝咖啡，导致乙、丙均死亡。甲对乙是作为犯罪，对丙是不作为犯罪\nCorrect Answer: 儿童在公共游泳池溺水时，其父甲、救生员乙均故意不救助。甲、乙均成立不作为犯罪。甲在火灾之际，能救出母亲，但为救出女友而未救出母亲。如无排除犯罪的事由，甲构成不作为犯罪。甲向乙的咖啡投毒，看到乙喝了几口后将咖啡递给丙，因担心罪行败露，甲未阻止丙喝咖啡，导致乙、丙均死亡。甲对乙是作为犯罪，对丙是不作为犯罪\n</Multiple-choice Question>\n\nYou are an expert in filtering and evaluating multiple-choice questions for advanced reasoning tasks. Your job is to evaluate a given question and determine whether it meets the following criteria: \n1. **Depth of Reasoning:** The question should require deeper reasoning. If the question appears too simple, mark it as \"Too Simple\".\n2. **Unambiguous Correct Answer:** The question must have a unique and unambiguous correct answer. If the question asks for \"incorrect options\" or allows for multiple correct answers, mark it as \"Ambiguous Answer\".\n3. **Open-Ended Reformulation Feasibility:** The question should be suitable for reformatting into an open-ended format. If the question cannot be easily reformulated into an open-ended problem and a clear ground-truth answer, mark it as \"Not Reformulatable\".\n\nFor each question, provide one of the following evaluations:  \n- \"Pass\" (The question meets all the criteria.)  \n- \"Too Simple\"  \n- \"Ambiguous Answer\"  \n- \"Not Reformulatable\" ",
  "gpt_filter_response": "Ambiguous Answer"
}