{
  "question": "甲在公园游玩时遇见仇人胡某，顿生杀死胡某的念头，便欺骗随行的朋友乙、丙说：\"我们追逐胡某.让他出洋相。‘'三人捡起木棒追逐胡某，致公园秩序严重混乱。将胡某追到公园后门偏僻处后，乙、丙因故离开。随后甲追上胡某，用木棒重击其头部，致其死亡。关于本案，下列哪些选项是正确的？",
  "options": {
    "A": "甲触犯故意杀人罪与寻衅滋事罪",
    "B": "乙、丙的追逐行为是否构成寻衅滋事罪，与该行为能否产生救助胡某的义务是不同的问题",
    "C": "乙、丙的追逐行为使胡某处于孤立无援的境地，但无法预见甲会杀害胡某，不成立过失致人死亡罪",
    "D": "乙、丙属寻衅滋事致人死亡，应从重处罚"
  },
  "answer_idx": "ABC",
  "answer": "甲触犯故意杀人罪与寻衅滋事罪。乙、丙的追逐行为是否构成寻衅滋事罪，与该行为能否产生救助胡某的义务是不同的问题。乙、丙的追逐行为使胡某处于孤立无援的境地，但无法预见甲会杀害胡某，不成立过失致人死亡罪",
  "process_id": 47,
  "options_str": "A. 甲触犯故意杀人罪与寻衅滋事罪\nB. 乙、丙的追逐行为是否构成寻衅滋事罪，与该行为能否产生救助胡某的义务是不同的问题\nC. 乙、丙的追逐行为使胡某处于孤立无援的境地，但无法预见甲会杀害胡某，不成立过失致人死亡罪\nD. 乙、丙属寻衅滋事致人死亡，应从重处罚",
  "gpt_filter_query": "<Multiple-choice Question>\n甲在公园游玩时遇见仇人胡某，顿生杀死胡某的念头，便欺骗随行的朋友乙、丙说：\"我们追逐胡某.让他出洋相。‘'三人捡起木棒追逐胡某，致公园秩序严重混乱。将胡某追到公园后门偏僻处后，乙、丙因故离开。随后甲追上胡某，用木棒重击其头部，致其死亡。关于本案，下列哪些选项是正确的？\nA. 甲触犯故意杀人罪与寻衅滋事罪\nB. 乙、丙的追逐行为是否构成寻衅滋事罪，与该行为能否产生救助胡某的义务是不同的问题\nC. 乙、丙的追逐行为使胡某处于孤立无援的境地，但无法预见甲会杀害胡某，不成立过失致人死亡罪\nD. 乙、丙属寻衅滋事致人死亡，应从重处罚\nCorrect Answer: 甲触犯故意杀人罪与寻衅滋事罪。乙、丙的追逐行为是否构成寻衅滋事罪，与该行为能否产生救助胡某的义务是不同的问题。乙、丙的追逐行为使胡某处于孤立无援的境地，但无法预见甲会杀害胡某，不成立过失致人死亡罪\n</Multiple-choice Question>\n\nYou are an expert in filtering and evaluating multiple-choice questions for advanced reasoning tasks. Your job is to evaluate a given question and determine whether it meets the following criteria: \n1. **Depth of Reasoning:** The question should require deeper reasoning. If the question appears too simple, mark it as \"Too Simple\".\n2. **Unambiguous Correct Answer:** The question must have a unique and unambiguous correct answer. If the question asks for \"incorrect options\" or allows for multiple correct answers, mark it as \"Ambiguous Answer\".\n3. **Open-Ended Reformulation Feasibility:** The question should be suitable for reformatting into an open-ended format. If the question cannot be easily reformulated into an open-ended problem and a clear ground-truth answer, mark it as \"Not Reformulatable\".\n\nFor each question, provide one of the following evaluations:  \n- \"Pass\" (The question meets all the criteria.)  \n- \"Too Simple\"  \n- \"Ambiguous Answer\"  \n- \"Not Reformulatable\" ",
  "gpt_filter_response": "Pass",
  "gpt_reformat_query": "I will provide you with a multiple-choice question, and your task is to rewrite it into an open-ended question, along with a Ground-True Answer. The requirements are:\n\n1. The question must be specific, targeting the point being tested in the original multiple-choice question. Ensure it is open-ended, meaning no options are provided, but there must be a definitive Ground-True Answer.\n2. Based on the correct answer from the original question, provide a concise Ground-True Answer. The answer should allow for precise matching to determine whether the model's response is correct.\n\nHere is the multiple-choice question for you to rewrite:\n<Multiple-choice Question>\n甲在公园游玩时遇见仇人胡某，顿生杀死胡某的念头，便欺骗随行的朋友乙、丙说：\"我们追逐胡某.让他出洋相。‘'三人捡起木棒追逐胡某，致公园秩序严重混乱。将胡某追到公园后门偏僻处后，乙、丙因故离开。随后甲追上胡某，用木棒重击其头部，致其死亡。关于本案，下列哪些选项是正确的？\nA. 甲触犯故意杀人罪与寻衅滋事罪\nB. 乙、丙的追逐行为是否构成寻衅滋事罪，与该行为能否产生救助胡某的义务是不同的问题\nC. 乙、丙的追逐行为使胡某处于孤立无援的境地，但无法预见甲会杀害胡某，不成立过失致人死亡罪\nD. 乙、丙属寻衅滋事致人死亡，应从重处罚\nCorrect Answer: 甲触犯故意杀人罪与寻衅滋事罪。乙、丙的追逐行为是否构成寻衅滋事罪，与该行为能否产生救助胡某的义务是不同的问题。乙、丙的追逐行为使胡某处于孤立无援的境地，但无法预见甲会杀害胡某，不成立过失致人死亡罪\n</Multiple-choice Question>\n\nPlease output the result in the following JSON format:\n```json\n{\n\"Open-ended Verifiable Question\": \"...\",\n\"Ground-True Answer\": \"...\"\n}\n```",
  "gpt_reformat_response": "{\n\"Open-ended Verifiable Question\": \"在甲、乙、丙三人以捡木棒追逐胡某致公园秩序严重混乱，后乙、丙离开，甲追上胡某并以木棒重击头部致其死亡的情形下，请分别判断：甲应当成立何罪名；乙、丙的追逐行为与其是否因此负有救助胡某的义务是否属于同一法律问题；乙、丙是否因无法预见甲会杀人而不成立过失致人死亡罪；并据此给出你的结论。\",\n\"Ground-True Answer\": \"甲构成故意杀人罪与寻衅滋事罪；乙、丙的追逐行为是否构成寻衅滋事罪与该行为能否产生救助胡某的义务是不同的问题；乙、丙虽使胡某处于孤立无援，但无法预见甲会杀害胡某，不成立过失致人死亡罪。\"\n}",
  "Open-ended Verifiable Question": "在甲、乙、丙三人以捡木棒追逐胡某致公园秩序严重混乱，后乙、丙离开，甲追上胡某并以木棒重击头部致其死亡的情形下，请分别判断：甲应当成立何罪名；乙、丙的追逐行为与其是否因此负有救助胡某的义务是否属于同一法律问题；乙、丙是否因无法预见甲会杀人而不成立过失致人死亡罪；并据此给出你的结论。",
  "Ground-True Answer": "甲构成故意杀人罪与寻衅滋事罪；乙、丙的追逐行为是否构成寻衅滋事罪与该行为能否产生救助胡某的义务是不同的问题；乙、丙虽使胡某处于孤立无援，但无法预见甲会杀害胡某，不成立过失致人死亡罪。"
}