{
  "question": "(―)甲送给国有收费站站长吴某3万元，与其约定：甲在高速公路另开出口帮货车司机逃费，吴某想办法让人对此不予查处，所得由二人分成。后甲组织数十人，锯断高速公路一侧隔离栏、填平隔离沟(恢复原状需3万元)，形成一条出口。路过的很多货车司机知道经过收费站要收300元，而给甲100元即可绕过收费站继续前行。甲以此方式共得款30万元，但骗吴某仅得20万元，并按此数额分成。请回答第86〜88题。关于甲非法获利的定性，下列分析正确的是：",
  "options": {
    "A": "擅自经营收费站收费业务，数额巨大，构成非法经营罪",
    "B": "即使收钱时冒充国有收费站工作人员，也不构成招摇撞骗罪",
    "C": "未使收费站工作人员基于认识错误免收司机过路费，不构成诈骗罪",
    "D": "骗吴某仅得20万元的行为，构成隐瞒犯罪所得罪"
  },
  "answer_idx": "BC",
  "answer": "即使收钱时冒充国有收费站工作人员，也不构成招摇撞骗罪。未使收费站工作人员基于认识错误免收司机过路费，不构成诈骗罪",
  "process_id": 51,
  "options_str": "A. 擅自经营收费站收费业务，数额巨大，构成非法经营罪\nB. 即使收钱时冒充国有收费站工作人员，也不构成招摇撞骗罪\nC. 未使收费站工作人员基于认识错误免收司机过路费，不构成诈骗罪\nD. 骗吴某仅得20万元的行为，构成隐瞒犯罪所得罪",
  "gpt_filter_query": "<Multiple-choice Question>\n(―)甲送给国有收费站站长吴某3万元，与其约定：甲在高速公路另开出口帮货车司机逃费，吴某想办法让人对此不予查处，所得由二人分成。后甲组织数十人，锯断高速公路一侧隔离栏、填平隔离沟(恢复原状需3万元)，形成一条出口。路过的很多货车司机知道经过收费站要收300元，而给甲100元即可绕过收费站继续前行。甲以此方式共得款30万元，但骗吴某仅得20万元，并按此数额分成。请回答第86〜88题。关于甲非法获利的定性，下列分析正确的是：\nA. 擅自经营收费站收费业务，数额巨大，构成非法经营罪\nB. 即使收钱时冒充国有收费站工作人员，也不构成招摇撞骗罪\nC. 未使收费站工作人员基于认识错误免收司机过路费，不构成诈骗罪\nD. 骗吴某仅得20万元的行为，构成隐瞒犯罪所得罪\nCorrect Answer: 即使收钱时冒充国有收费站工作人员，也不构成招摇撞骗罪。未使收费站工作人员基于认识错误免收司机过路费，不构成诈骗罪\n</Multiple-choice Question>\n\nYou are an expert in filtering and evaluating multiple-choice questions for advanced reasoning tasks. Your job is to evaluate a given question and determine whether it meets the following criteria: \n1. **Depth of Reasoning:** The question should require deeper reasoning. If the question appears too simple, mark it as \"Too Simple\".\n2. **Unambiguous Correct Answer:** The question must have a unique and unambiguous correct answer. If the question asks for \"incorrect options\" or allows for multiple correct answers, mark it as \"Ambiguous Answer\".\n3. **Open-Ended Reformulation Feasibility:** The question should be suitable for reformatting into an open-ended format. If the question cannot be easily reformulated into an open-ended problem and a clear ground-truth answer, mark it as \"Not Reformulatable\".\n\nFor each question, provide one of the following evaluations:  \n- \"Pass\" (The question meets all the criteria.)  \n- \"Too Simple\"  \n- \"Ambiguous Answer\"  \n- \"Not Reformulatable\" ",
  "gpt_filter_response": "Pass",
  "gpt_reformat_query": "I will provide you with a multiple-choice question, and your task is to rewrite it into an open-ended question, along with a Ground-True Answer. The requirements are:\n\n1. The question must be specific, targeting the point being tested in the original multiple-choice question. Ensure it is open-ended, meaning no options are provided, but there must be a definitive Ground-True Answer.\n2. Based on the correct answer from the original question, provide a concise Ground-True Answer. The answer should allow for precise matching to determine whether the model's response is correct.\n\nHere is the multiple-choice question for you to rewrite:\n<Multiple-choice Question>\n(―)甲送给国有收费站站长吴某3万元，与其约定：甲在高速公路另开出口帮货车司机逃费，吴某想办法让人对此不予查处，所得由二人分成。后甲组织数十人，锯断高速公路一侧隔离栏、填平隔离沟(恢复原状需3万元)，形成一条出口。路过的很多货车司机知道经过收费站要收300元，而给甲100元即可绕过收费站继续前行。甲以此方式共得款30万元，但骗吴某仅得20万元，并按此数额分成。请回答第86〜88题。关于甲非法获利的定性，下列分析正确的是：\nA. 擅自经营收费站收费业务，数额巨大，构成非法经营罪\nB. 即使收钱时冒充国有收费站工作人员，也不构成招摇撞骗罪\nC. 未使收费站工作人员基于认识错误免收司机过路费，不构成诈骗罪\nD. 骗吴某仅得20万元的行为，构成隐瞒犯罪所得罪\nCorrect Answer: 即使收钱时冒充国有收费站工作人员，也不构成招摇撞骗罪。未使收费站工作人员基于认识错误免收司机过路费，不构成诈骗罪\n</Multiple-choice Question>\n\nPlease output the result in the following JSON format:\n```json\n{\n\"Open-ended Verifiable Question\": \"...\",\n\"Ground-True Answer\": \"...\"\n}\n```",
  "gpt_reformat_response": "{\n\"Open-ended Verifiable Question\": \"在甲与吴某合谋开设逃费出口并向过往司机收取费用的案件中，请判断并说明：甲的非法获利行为在招摇撞骗罪与诈骗罪两项罪名上应如何定性，是否构成上述任一罪名？\",\n\"Ground-True Answer\": \"不构成招摇撞骗罪，也不构成诈骗罪。\"\n}",
  "Open-ended Verifiable Question": "在甲与吴某合谋开设逃费出口并向过往司机收取费用的案件中，请判断并说明：甲的非法获利行为在招摇撞骗罪与诈骗罪两项罪名上应如何定性，是否构成上述任一罪名？",
  "Ground-True Answer": "不构成招摇撞骗罪，也不构成诈骗罪。"
}