{
  "question": "(―)甲送给国有收费站站长吴某3万元，与其约定：甲在高速公路另开出口帮货车司机逃费，吴某想办法让人对此不予查处，所得由二人分成。后甲组织数十人，锯断高速公路一侧隔离栏、填平隔离沟(恢复原状需3万元)，形成一条出口。路过的很多货车司机知道经过收费站要收300元，而给甲100元即可绕过收费站继续前行。甲以此方式共得款30万元，但骗吴某仅得20万元，并按此数额分成。请回答第86〜88题。围绕吴某的行为，下列论述正确的是：",
  "options": {
    "A": "利用职务上的便利侵吞本应由收费站收取的费用，成立贪污罪",
    "B": "贪污数额为30万元",
    "C": "收取甲3万元，利用职务便利为甲谋利益，成立受贿罪",
    "D": "贪污罪与受贿罪成立牵连犯，应从一重罪处断"
  },
  "answer_idx": "ABC",
  "answer": "利用职务上的便利侵吞本应由收费站收取的费用，成立贪污罪。贪污数额为30万元。收取甲3万元，利用职务便利为甲谋利益，成立受贿罪",
  "process_id": 52,
  "options_str": "A. 利用职务上的便利侵吞本应由收费站收取的费用，成立贪污罪\nB. 贪污数额为30万元\nC. 收取甲3万元，利用职务便利为甲谋利益，成立受贿罪\nD. 贪污罪与受贿罪成立牵连犯，应从一重罪处断",
  "gpt_filter_query": "<Multiple-choice Question>\n(―)甲送给国有收费站站长吴某3万元，与其约定：甲在高速公路另开出口帮货车司机逃费，吴某想办法让人对此不予查处，所得由二人分成。后甲组织数十人，锯断高速公路一侧隔离栏、填平隔离沟(恢复原状需3万元)，形成一条出口。路过的很多货车司机知道经过收费站要收300元，而给甲100元即可绕过收费站继续前行。甲以此方式共得款30万元，但骗吴某仅得20万元，并按此数额分成。请回答第86〜88题。围绕吴某的行为，下列论述正确的是：\nA. 利用职务上的便利侵吞本应由收费站收取的费用，成立贪污罪\nB. 贪污数额为30万元\nC. 收取甲3万元，利用职务便利为甲谋利益，成立受贿罪\nD. 贪污罪与受贿罪成立牵连犯，应从一重罪处断\nCorrect Answer: 利用职务上的便利侵吞本应由收费站收取的费用，成立贪污罪。贪污数额为30万元。收取甲3万元，利用职务便利为甲谋利益，成立受贿罪\n</Multiple-choice Question>\n\nYou are an expert in filtering and evaluating multiple-choice questions for advanced reasoning tasks. Your job is to evaluate a given question and determine whether it meets the following criteria: \n1. **Depth of Reasoning:** The question should require deeper reasoning. If the question appears too simple, mark it as \"Too Simple\".\n2. **Unambiguous Correct Answer:** The question must have a unique and unambiguous correct answer. If the question asks for \"incorrect options\" or allows for multiple correct answers, mark it as \"Ambiguous Answer\".\n3. **Open-Ended Reformulation Feasibility:** The question should be suitable for reformatting into an open-ended format. If the question cannot be easily reformulated into an open-ended problem and a clear ground-truth answer, mark it as \"Not Reformulatable\".\n\nFor each question, provide one of the following evaluations:  \n- \"Pass\" (The question meets all the criteria.)  \n- \"Too Simple\"  \n- \"Ambiguous Answer\"  \n- \"Not Reformulatable\" ",
  "gpt_filter_response": "Pass",
  "gpt_reformat_query": "I will provide you with a multiple-choice question, and your task is to rewrite it into an open-ended question, along with a Ground-True Answer. The requirements are:\n\n1. The question must be specific, targeting the point being tested in the original multiple-choice question. Ensure it is open-ended, meaning no options are provided, but there must be a definitive Ground-True Answer.\n2. Based on the correct answer from the original question, provide a concise Ground-True Answer. The answer should allow for precise matching to determine whether the model's response is correct.\n\nHere is the multiple-choice question for you to rewrite:\n<Multiple-choice Question>\n(―)甲送给国有收费站站长吴某3万元，与其约定：甲在高速公路另开出口帮货车司机逃费，吴某想办法让人对此不予查处，所得由二人分成。后甲组织数十人，锯断高速公路一侧隔离栏、填平隔离沟(恢复原状需3万元)，形成一条出口。路过的很多货车司机知道经过收费站要收300元，而给甲100元即可绕过收费站继续前行。甲以此方式共得款30万元，但骗吴某仅得20万元，并按此数额分成。请回答第86〜88题。围绕吴某的行为，下列论述正确的是：\nA. 利用职务上的便利侵吞本应由收费站收取的费用，成立贪污罪\nB. 贪污数额为30万元\nC. 收取甲3万元，利用职务便利为甲谋利益，成立受贿罪\nD. 贪污罪与受贿罪成立牵连犯，应从一重罪处断\nCorrect Answer: 利用职务上的便利侵吞本应由收费站收取的费用，成立贪污罪。贪污数额为30万元。收取甲3万元，利用职务便利为甲谋利益，成立受贿罪\n</Multiple-choice Question>\n\nPlease output the result in the following JSON format:\n```json\n{\n\"Open-ended Verifiable Question\": \"...\",\n\"Ground-True Answer\": \"...\"\n}\n```",
  "gpt_reformat_response": "{\n\"Open-ended Verifiable Question\": \"在以下案件情形中，请判断并说明对吴某定性的正确结论：甲与国有收费站站长吴某约定，甲在高速公路私设出口帮助货车逃费，吴某利用职务便利协调不予查处，并收受甲3万元；甲随后组织多人破坏隔离设施开辟出口，致恢复原状需3万元，最终通过绕行方式共获利30万元，但对吴某谎称仅得20万元并按此数额分成。请明确说明：吴某是否构成贪污罪，其贪污数额应如何确定，是否另构成受贿罪，以及对贪污罪与受贿罪是否应当按牵连犯从一重罪处断。\",\n\"Ground-True Answer\": \"吴某构成贪污罪，且贪污数额为30万元；同时构成受贿罪（收受3万元为甲谋取不予查处的利益）；不属于牵连犯，不从一重罪处断。\"\n}",
  "Open-ended Verifiable Question": "在以下案件情形中，请判断并说明对吴某定性的正确结论：甲与国有收费站站长吴某约定，甲在高速公路私设出口帮助货车逃费，吴某利用职务便利协调不予查处，并收受甲3万元；甲随后组织多人破坏隔离设施开辟出口，致恢复原状需3万元，最终通过绕行方式共获利30万元，但对吴某谎称仅得20万元并按此数额分成。请明确说明：吴某是否构成贪污罪，其贪污数额应如何确定，是否另构成受贿罪，以及对贪污罪与受贿罪是否应当按牵连犯从一重罪处断。",
  "Ground-True Answer": "吴某构成贪污罪，且贪污数额为30万元；同时构成受贿罪（收受3万元为甲谋取不予查处的利益）；不属于牵连犯，不从一重罪处断。"
}