{
  "question": "（-）朱某系某县民政局副局长，率县福利企业年检小组到同学黄某任厂长的电气厂年检时，明知该厂的材料有虚假、残疾员工未达法定人数，但朱某以该材料为准，使其顺利通过年检。为此，电气厂享受了不应享受的退税优惠政策，获取退税300万元。黄某动用关系，帮朱某升任民政局局长。检察院在调查朱某时发现，朱某有100万元财产明显超过合法收入，但其拒绝说明来源。在审查起诉阶段，朱某交代100万元系在澳门赌场所赢，经查证属实。请回答第89〜91题。关于朱某100万元财产的来源，下列分析正确的是：",
  "options": {
    "A": "其财产、支出明显超过合法收入，这是巨额财产来源不明罪的实行行为",
    "B": "在审查起诉阶段已说明100万元的来源，故不能以巨额财产来源不明罪提起公诉",
    "C": "在澳门赌博，数额特别巨大，构成赌博罪",
    "D": "作为国家工作人员，在澳门赌博，应依属人管辖原则追究其赌博的刑事责任"
  },
  "answer_idx": "B",
  "answer": "在审查起诉阶段已说明100万元的来源，故不能以巨额财产来源不明罪提起公诉",
  "process_id": 53,
  "options_str": "A. 其财产、支出明显超过合法收入，这是巨额财产来源不明罪的实行行为\nB. 在审查起诉阶段已说明100万元的来源，故不能以巨额财产来源不明罪提起公诉\nC. 在澳门赌博，数额特别巨大，构成赌博罪\nD. 作为国家工作人员，在澳门赌博，应依属人管辖原则追究其赌博的刑事责任",
  "gpt_filter_query": "<Multiple-choice Question>\n（-）朱某系某县民政局副局长，率县福利企业年检小组到同学黄某任厂长的电气厂年检时，明知该厂的材料有虚假、残疾员工未达法定人数，但朱某以该材料为准，使其顺利通过年检。为此，电气厂享受了不应享受的退税优惠政策，获取退税300万元。黄某动用关系，帮朱某升任民政局局长。检察院在调查朱某时发现，朱某有100万元财产明显超过合法收入，但其拒绝说明来源。在审查起诉阶段，朱某交代100万元系在澳门赌场所赢，经查证属实。请回答第89〜91题。关于朱某100万元财产的来源，下列分析正确的是：\nA. 其财产、支出明显超过合法收入，这是巨额财产来源不明罪的实行行为\nB. 在审查起诉阶段已说明100万元的来源，故不能以巨额财产来源不明罪提起公诉\nC. 在澳门赌博，数额特别巨大，构成赌博罪\nD. 作为国家工作人员，在澳门赌博，应依属人管辖原则追究其赌博的刑事责任\nCorrect Answer: 在审查起诉阶段已说明100万元的来源，故不能以巨额财产来源不明罪提起公诉\n</Multiple-choice Question>\n\nYou are an expert in filtering and evaluating multiple-choice questions for advanced reasoning tasks. Your job is to evaluate a given question and determine whether it meets the following criteria: \n1. **Depth of Reasoning:** The question should require deeper reasoning. If the question appears too simple, mark it as \"Too Simple\".\n2. **Unambiguous Correct Answer:** The question must have a unique and unambiguous correct answer. If the question asks for \"incorrect options\" or allows for multiple correct answers, mark it as \"Ambiguous Answer\".\n3. **Open-Ended Reformulation Feasibility:** The question should be suitable for reformatting into an open-ended format. If the question cannot be easily reformulated into an open-ended problem and a clear ground-truth answer, mark it as \"Not Reformulatable\".\n\nFor each question, provide one of the following evaluations:  \n- \"Pass\" (The question meets all the criteria.)  \n- \"Too Simple\"  \n- \"Ambiguous Answer\"  \n- \"Not Reformulatable\" ",
  "gpt_filter_response": "Pass",
  "gpt_reformat_query": "I will provide you with a multiple-choice question, and your task is to rewrite it into an open-ended question, along with a Ground-True Answer. The requirements are:\n\n1. The question must be specific, targeting the point being tested in the original multiple-choice question. Ensure it is open-ended, meaning no options are provided, but there must be a definitive Ground-True Answer.\n2. Based on the correct answer from the original question, provide a concise Ground-True Answer. The answer should allow for precise matching to determine whether the model's response is correct.\n\nHere is the multiple-choice question for you to rewrite:\n<Multiple-choice Question>\n（-）朱某系某县民政局副局长，率县福利企业年检小组到同学黄某任厂长的电气厂年检时，明知该厂的材料有虚假、残疾员工未达法定人数，但朱某以该材料为准，使其顺利通过年检。为此，电气厂享受了不应享受的退税优惠政策，获取退税300万元。黄某动用关系，帮朱某升任民政局局长。检察院在调查朱某时发现，朱某有100万元财产明显超过合法收入，但其拒绝说明来源。在审查起诉阶段，朱某交代100万元系在澳门赌场所赢，经查证属实。请回答第89〜91题。关于朱某100万元财产的来源，下列分析正确的是：\nA. 其财产、支出明显超过合法收入，这是巨额财产来源不明罪的实行行为\nB. 在审查起诉阶段已说明100万元的来源，故不能以巨额财产来源不明罪提起公诉\nC. 在澳门赌博，数额特别巨大，构成赌博罪\nD. 作为国家工作人员，在澳门赌博，应依属人管辖原则追究其赌博的刑事责任\nCorrect Answer: 在审查起诉阶段已说明100万元的来源，故不能以巨额财产来源不明罪提起公诉\n</Multiple-choice Question>\n\nPlease output the result in the following JSON format:\n```json\n{\n\"Open-ended Verifiable Question\": \"...\",\n\"Ground-True Answer\": \"...\"\n}\n```",
  "gpt_reformat_response": "{\n\"Open-ended Verifiable Question\": \"在检察机关审查起诉阶段，朱某对其先前被认定为明显超过合法收入的100万元财产说明来源为在澳门赌博所得，且经查证属实。基于此情形，能否以巨额财产来源不明罪对朱某提起公诉？请给出明确结论。\",\n\"Ground-True Answer\": \"不能以巨额财产来源不明罪提起公诉。\"\n}",
  "Open-ended Verifiable Question": "在检察机关审查起诉阶段，朱某对其先前被认定为明显超过合法收入的100万元财产说明来源为在澳门赌博所得，且经查证属实。基于此情形，能否以巨额财产来源不明罪对朱某提起公诉？请给出明确结论。",
  "Ground-True Answer": "不能以巨额财产来源不明罪提起公诉。"
}