{
  "question": "甲持有硕昌有限公司69%的股权，任该公司董事长；乙、丙为公司另外两个股东。因打算移居海外，甲拟出让其全部股权。对此，下列哪些说法是错误的？",
  "options": {
    "A": "因甲的持股比例已超过2/3,故不必征得乙、丙的同意，甲即可对外转让自己的股权",
    "B": "若公司章程限制甲转让其股权，则甲可直接修改章程中的限制性规定，以使其股权转让行为合法",
    "C": "甲可将其股权分割为两部分，分别转让给乙、丙",
    "D": "甲对外转让其全部股权时，乙或丙均可就甲所转让股权的一部分主张优先购买权"
  },
  "answer_idx": "ABD",
  "answer": "因甲的持股比例已超过2/3,故不必征得乙、丙的同意，甲即可对外转让自己的股权。若公司章程限制甲转让其股权，则甲可直接修改章程中的限制性规定，以使其股权转让行为合法。甲对外转让其全部股权时，乙或丙均可就甲所转让股权的一部分主张优先购买权",
  "process_id": 59,
  "options_str": "A. 因甲的持股比例已超过2/3,故不必征得乙、丙的同意，甲即可对外转让自己的股权\nB. 若公司章程限制甲转让其股权，则甲可直接修改章程中的限制性规定，以使其股权转让行为合法\nC. 甲可将其股权分割为两部分，分别转让给乙、丙\nD. 甲对外转让其全部股权时，乙或丙均可就甲所转让股权的一部分主张优先购买权",
  "gpt_filter_query": "<Multiple-choice Question>\n甲持有硕昌有限公司69%的股权，任该公司董事长；乙、丙为公司另外两个股东。因打算移居海外，甲拟出让其全部股权。对此，下列哪些说法是错误的？\nA. 因甲的持股比例已超过2/3,故不必征得乙、丙的同意，甲即可对外转让自己的股权\nB. 若公司章程限制甲转让其股权，则甲可直接修改章程中的限制性规定，以使其股权转让行为合法\nC. 甲可将其股权分割为两部分，分别转让给乙、丙\nD. 甲对外转让其全部股权时，乙或丙均可就甲所转让股权的一部分主张优先购买权\nCorrect Answer: 因甲的持股比例已超过2/3,故不必征得乙、丙的同意，甲即可对外转让自己的股权。若公司章程限制甲转让其股权，则甲可直接修改章程中的限制性规定，以使其股权转让行为合法。甲对外转让其全部股权时，乙或丙均可就甲所转让股权的一部分主张优先购买权\n</Multiple-choice Question>\n\nYou are an expert in filtering and evaluating multiple-choice questions for advanced reasoning tasks. Your job is to evaluate a given question and determine whether it meets the following criteria: \n1. **Depth of Reasoning:** The question should require deeper reasoning. If the question appears too simple, mark it as \"Too Simple\".\n2. **Unambiguous Correct Answer:** The question must have a unique and unambiguous correct answer. If the question asks for \"incorrect options\" or allows for multiple correct answers, mark it as \"Ambiguous Answer\".\n3. **Open-Ended Reformulation Feasibility:** The question should be suitable for reformatting into an open-ended format. If the question cannot be easily reformulated into an open-ended problem and a clear ground-truth answer, mark it as \"Not Reformulatable\".\n\nFor each question, provide one of the following evaluations:  \n- \"Pass\" (The question meets all the criteria.)  \n- \"Too Simple\"  \n- \"Ambiguous Answer\"  \n- \"Not Reformulatable\" ",
  "gpt_filter_response": "Ambiguous Answer"
}