{
  "question": "（二）顺风电器租赁公司将一台电脑出租给张某，租期为2年。在租赁期间内，张某谎称电脑是自己的，分别以市价与甲、乙、丙签订了三份电脑买卖合同并收取了三份价款，但张某把电脑实际交付给了乙。后乙的这台电脑被李某拾得，因暂时找不到失主，李某将电脑出租给王某获得很高收益。王某租用该电脑时出了故障，遂将电脑交给康成电脑维修公司维修。王某和李某就维修费的承担发生争执。康成公司因未收到修理费而将电脑留置，并告知王某如7天内不交费，将变卖电脑抵债。李某听闻后，于当日潜入康成公司偷回电脑。请回答第89〜91题。如乙请求李某返还电脑和所获利益，下列说法正确的是：",
  "options": {
    "A": "李某向乙返还所获利益时，应以乙所受损失为限",
    "B": "李某应将所获利益作为不当得利返还给乙，但可以扣除支出的必要费用",
    "C": "乙应以所有权人身份而非不当得利债权人身份请求李某返还电脑",
    "D": "如李某拒绝返还电脑，需向乙承担侵权责任"
  },
  "answer_idx": "BCD",
  "answer": "李某应将所获利益作为不当得利返还给乙，但可以扣除支出的必要费用。乙应以所有权人身份而非不当得利债权人身份请求李某返还电脑。如李某拒绝返还电脑，需向乙承担侵权责任",
  "process_id": 61,
  "options_str": "A. 李某向乙返还所获利益时，应以乙所受损失为限\nB. 李某应将所获利益作为不当得利返还给乙，但可以扣除支出的必要费用\nC. 乙应以所有权人身份而非不当得利债权人身份请求李某返还电脑\nD. 如李某拒绝返还电脑，需向乙承担侵权责任",
  "gpt_filter_query": "<Multiple-choice Question>\n（二）顺风电器租赁公司将一台电脑出租给张某，租期为2年。在租赁期间内，张某谎称电脑是自己的，分别以市价与甲、乙、丙签订了三份电脑买卖合同并收取了三份价款，但张某把电脑实际交付给了乙。后乙的这台电脑被李某拾得，因暂时找不到失主，李某将电脑出租给王某获得很高收益。王某租用该电脑时出了故障，遂将电脑交给康成电脑维修公司维修。王某和李某就维修费的承担发生争执。康成公司因未收到修理费而将电脑留置，并告知王某如7天内不交费，将变卖电脑抵债。李某听闻后，于当日潜入康成公司偷回电脑。请回答第89〜91题。如乙请求李某返还电脑和所获利益，下列说法正确的是：\nA. 李某向乙返还所获利益时，应以乙所受损失为限\nB. 李某应将所获利益作为不当得利返还给乙，但可以扣除支出的必要费用\nC. 乙应以所有权人身份而非不当得利债权人身份请求李某返还电脑\nD. 如李某拒绝返还电脑，需向乙承担侵权责任\nCorrect Answer: 李某应将所获利益作为不当得利返还给乙，但可以扣除支出的必要费用。乙应以所有权人身份而非不当得利债权人身份请求李某返还电脑。如李某拒绝返还电脑，需向乙承担侵权责任\n</Multiple-choice Question>\n\nYou are an expert in filtering and evaluating multiple-choice questions for advanced reasoning tasks. Your job is to evaluate a given question and determine whether it meets the following criteria: \n1. **Depth of Reasoning:** The question should require deeper reasoning. If the question appears too simple, mark it as \"Too Simple\".\n2. **Unambiguous Correct Answer:** The question must have a unique and unambiguous correct answer. If the question asks for \"incorrect options\" or allows for multiple correct answers, mark it as \"Ambiguous Answer\".\n3. **Open-Ended Reformulation Feasibility:** The question should be suitable for reformatting into an open-ended format. If the question cannot be easily reformulated into an open-ended problem and a clear ground-truth answer, mark it as \"Not Reformulatable\".\n\nFor each question, provide one of the following evaluations:  \n- \"Pass\" (The question meets all the criteria.)  \n- \"Too Simple\"  \n- \"Ambiguous Answer\"  \n- \"Not Reformulatable\" ",
  "gpt_filter_response": "Pass",
  "gpt_reformat_query": "I will provide you with a multiple-choice question, and your task is to rewrite it into an open-ended question, along with a Ground-True Answer. The requirements are:\n\n1. The question must be specific, targeting the point being tested in the original multiple-choice question. Ensure it is open-ended, meaning no options are provided, but there must be a definitive Ground-True Answer.\n2. Based on the correct answer from the original question, provide a concise Ground-True Answer. The answer should allow for precise matching to determine whether the model's response is correct.\n\nHere is the multiple-choice question for you to rewrite:\n<Multiple-choice Question>\n（二）顺风电器租赁公司将一台电脑出租给张某，租期为2年。在租赁期间内，张某谎称电脑是自己的，分别以市价与甲、乙、丙签订了三份电脑买卖合同并收取了三份价款，但张某把电脑实际交付给了乙。后乙的这台电脑被李某拾得，因暂时找不到失主，李某将电脑出租给王某获得很高收益。王某租用该电脑时出了故障，遂将电脑交给康成电脑维修公司维修。王某和李某就维修费的承担发生争执。康成公司因未收到修理费而将电脑留置，并告知王某如7天内不交费，将变卖电脑抵债。李某听闻后，于当日潜入康成公司偷回电脑。请回答第89〜91题。如乙请求李某返还电脑和所获利益，下列说法正确的是：\nA. 李某向乙返还所获利益时，应以乙所受损失为限\nB. 李某应将所获利益作为不当得利返还给乙，但可以扣除支出的必要费用\nC. 乙应以所有权人身份而非不当得利债权人身份请求李某返还电脑\nD. 如李某拒绝返还电脑，需向乙承担侵权责任\nCorrect Answer: 李某应将所获利益作为不当得利返还给乙，但可以扣除支出的必要费用。乙应以所有权人身份而非不当得利债权人身份请求李某返还电脑。如李某拒绝返还电脑，需向乙承担侵权责任\n</Multiple-choice Question>\n\nPlease output the result in the following JSON format:\n```json\n{\n\"Open-ended Verifiable Question\": \"...\",\n\"Ground-True Answer\": \"...\"\n}\n```",
  "gpt_reformat_response": "{\n\"Open-ended Verifiable Question\": \"在顺风电器租赁公司将电脑出租给张某、张某将电脑实际交付给乙、后被李某拾得并转租给王某的情形中，若乙请求李某返还电脑及其所获利益，请明确：李某应以何种法律依据向乙返还其因转租取得的收益、是否可以扣除必要费用；乙应以何种法律身份请求返还电脑；若李某拒绝返还电脑，应对乙承担何种法律责任？\",\n\"Ground-True Answer\": \"李某应将所获利益作为不当得利返还给乙，并可扣除支出的必要费用；乙应以所有权人身份请求李某返还电脑；如李某拒绝返还电脑，应向乙承担侵权责任。\"\n}",
  "Open-ended Verifiable Question": "在顺风电器租赁公司将电脑出租给张某、张某将电脑实际交付给乙、后被李某拾得并转租给王某的情形中，若乙请求李某返还电脑及其所获利益，请明确：李某应以何种法律依据向乙返还其因转租取得的收益、是否可以扣除必要费用；乙应以何种法律身份请求返还电脑；若李某拒绝返还电脑，应对乙承担何种法律责任？",
  "Ground-True Answer": "李某应将所获利益作为不当得利返还给乙，并可扣除支出的必要费用；乙应以所有权人身份请求李某返还电脑；如李某拒绝返还电脑，应向乙承担侵权责任。"
}