{
  "question": "（五）张山承租林海的商铺经营饭店，因拖欠房租被诉至饭店所在地甲法院，法院判决张山偿付林海房租及利息，张山未履行判决。经律师调查发现，张山除所居住房以外，其名下另有一套房屋，林海遂向该房屋所在地乙法院申请执行。乙法院对该套房屋进行查封拍卖。执行过程中，张山前妻宁虹向乙法院提出书面异议，称两人离婚后该房屋已由丙法院判决归其所有，目前尚未办理房屋变更登记手续。请回答第98-100题。如乙法院裁定支持宁虹的请求，林海不服提出执行异议之诉，有关当事人的诉讼地位是：",
  "options": {
    "A": "林海是原告，张山是被告，宁虹是第三人",
    "B": "林海和张山是共同原告，宁虹是被告",
    "C": "林海是原告，张山和宁虹是共同被告",
    "D": "林海是原告，宁虹是被告，张山视其态度而定"
  },
  "answer_idx": "D",
  "answer": "林海是原告，宁虹是被告，张山视其态度而定",
  "process_id": 62,
  "options_str": "A. 林海是原告，张山是被告，宁虹是第三人\nB. 林海和张山是共同原告，宁虹是被告\nC. 林海是原告，张山和宁虹是共同被告\nD. 林海是原告，宁虹是被告，张山视其态度而定",
  "gpt_filter_query": "<Multiple-choice Question>\n（五）张山承租林海的商铺经营饭店，因拖欠房租被诉至饭店所在地甲法院，法院判决张山偿付林海房租及利息，张山未履行判决。经律师调查发现，张山除所居住房以外，其名下另有一套房屋，林海遂向该房屋所在地乙法院申请执行。乙法院对该套房屋进行查封拍卖。执行过程中，张山前妻宁虹向乙法院提出书面异议，称两人离婚后该房屋已由丙法院判决归其所有，目前尚未办理房屋变更登记手续。请回答第98-100题。如乙法院裁定支持宁虹的请求，林海不服提出执行异议之诉，有关当事人的诉讼地位是：\nA. 林海是原告，张山是被告，宁虹是第三人\nB. 林海和张山是共同原告，宁虹是被告\nC. 林海是原告，张山和宁虹是共同被告\nD. 林海是原告，宁虹是被告，张山视其态度而定\nCorrect Answer: 林海是原告，宁虹是被告，张山视其态度而定\n</Multiple-choice Question>\n\nYou are an expert in filtering and evaluating multiple-choice questions for advanced reasoning tasks. Your job is to evaluate a given question and determine whether it meets the following criteria: \n1. **Depth of Reasoning:** The question should require deeper reasoning. If the question appears too simple, mark it as \"Too Simple\".\n2. **Unambiguous Correct Answer:** The question must have a unique and unambiguous correct answer. If the question asks for \"incorrect options\" or allows for multiple correct answers, mark it as \"Ambiguous Answer\".\n3. **Open-Ended Reformulation Feasibility:** The question should be suitable for reformatting into an open-ended format. If the question cannot be easily reformulated into an open-ended problem and a clear ground-truth answer, mark it as \"Not Reformulatable\".\n\nFor each question, provide one of the following evaluations:  \n- \"Pass\" (The question meets all the criteria.)  \n- \"Too Simple\"  \n- \"Ambiguous Answer\"  \n- \"Not Reformulatable\" ",
  "gpt_filter_response": "Pass",
  "gpt_reformat_query": "I will provide you with a multiple-choice question, and your task is to rewrite it into an open-ended question, along with a Ground-True Answer. The requirements are:\n\n1. The question must be specific, targeting the point being tested in the original multiple-choice question. Ensure it is open-ended, meaning no options are provided, but there must be a definitive Ground-True Answer.\n2. Based on the correct answer from the original question, provide a concise Ground-True Answer. The answer should allow for precise matching to determine whether the model's response is correct.\n\nHere is the multiple-choice question for you to rewrite:\n<Multiple-choice Question>\n（五）张山承租林海的商铺经营饭店，因拖欠房租被诉至饭店所在地甲法院，法院判决张山偿付林海房租及利息，张山未履行判决。经律师调查发现，张山除所居住房以外，其名下另有一套房屋，林海遂向该房屋所在地乙法院申请执行。乙法院对该套房屋进行查封拍卖。执行过程中，张山前妻宁虹向乙法院提出书面异议，称两人离婚后该房屋已由丙法院判决归其所有，目前尚未办理房屋变更登记手续。请回答第98-100题。如乙法院裁定支持宁虹的请求，林海不服提出执行异议之诉，有关当事人的诉讼地位是：\nA. 林海是原告，张山是被告，宁虹是第三人\nB. 林海和张山是共同原告，宁虹是被告\nC. 林海是原告，张山和宁虹是共同被告\nD. 林海是原告，宁虹是被告，张山视其态度而定\nCorrect Answer: 林海是原告，宁虹是被告，张山视其态度而定\n</Multiple-choice Question>\n\nPlease output the result in the following JSON format:\n```json\n{\n\"Open-ended Verifiable Question\": \"...\",\n\"Ground-True Answer\": \"...\"\n}\n```",
  "gpt_reformat_response": "{\n\"Open-ended Verifiable Question\": \"在执行程序中，乙法院裁定支持宁虹的执行异议后，申请执行人林海不服提起执行异议之诉。请明确该执行异议之诉中的当事人诉讼地位分别为何？\",\n\"Ground-True Answer\": \"林海是原告，宁虹是被告，张山视其态度而定\"\n}",
  "Open-ended Verifiable Question": "在执行程序中，乙法院裁定支持宁虹的执行异议后，申请执行人林海不服提起执行异议之诉。请明确该执行异议之诉中的当事人诉讼地位分别为何？",
  "Ground-True Answer": "林海是原告，宁虹是被告，张山视其态度而定"
}