{
  "question": "85.根据《法律援助条例》和《关于刑事诉讼法律援助工作的规定》，下列哪些表述是正确的？",
  "options": {
    "A": "区检察院提起抗诉的案件，区法院应当通知区法律援助中心为被告人甲提供法律援助",
    "B": "家住A县的乙在邻县涉嫌犯罪被邻县检察院批准逮捕，其因经济困难可向A县法律援助中心申请法律援助",
    "C": "县公安局没有通知县法律援助中心为可能被判处无期徒刑的丙提供法律援助，丙可向市检察院提出申诉",
    "D": "县人民法院应当准许强制医疗案件中的被告丁以正当理由拒绝法律援助，并告知其可另行委托律师"
  },
  "answer_idx": "CD",
  "answer": "县公安局没有通知县法律援助中心为可能被判处无期徒刑的丙提供法律援助，丙可向市检察院提出申诉。县人民法院应当准许强制医疗案件中的被告丁以正当理由拒绝法律援助，并告知其可另行委托律师",
  "process_id": 66,
  "options_str": "A. 区检察院提起抗诉的案件，区法院应当通知区法律援助中心为被告人甲提供法律援助\nB. 家住A县的乙在邻县涉嫌犯罪被邻县检察院批准逮捕，其因经济困难可向A县法律援助中心申请法律援助\nC. 县公安局没有通知县法律援助中心为可能被判处无期徒刑的丙提供法律援助，丙可向市检察院提出申诉\nD. 县人民法院应当准许强制医疗案件中的被告丁以正当理由拒绝法律援助，并告知其可另行委托律师",
  "gpt_filter_query": "<Multiple-choice Question>\n85.根据《法律援助条例》和《关于刑事诉讼法律援助工作的规定》，下列哪些表述是正确的？\nA. 区检察院提起抗诉的案件，区法院应当通知区法律援助中心为被告人甲提供法律援助\nB. 家住A县的乙在邻县涉嫌犯罪被邻县检察院批准逮捕，其因经济困难可向A县法律援助中心申请法律援助\nC. 县公安局没有通知县法律援助中心为可能被判处无期徒刑的丙提供法律援助，丙可向市检察院提出申诉\nD. 县人民法院应当准许强制医疗案件中的被告丁以正当理由拒绝法律援助，并告知其可另行委托律师\nCorrect Answer: 县公安局没有通知县法律援助中心为可能被判处无期徒刑的丙提供法律援助，丙可向市检察院提出申诉。县人民法院应当准许强制医疗案件中的被告丁以正当理由拒绝法律援助，并告知其可另行委托律师\n</Multiple-choice Question>\n\nYou are an expert in filtering and evaluating multiple-choice questions for advanced reasoning tasks. Your job is to evaluate a given question and determine whether it meets the following criteria: \n1. **Depth of Reasoning:** The question should require deeper reasoning. If the question appears too simple, mark it as \"Too Simple\".\n2. **Unambiguous Correct Answer:** The question must have a unique and unambiguous correct answer. If the question asks for \"incorrect options\" or allows for multiple correct answers, mark it as \"Ambiguous Answer\".\n3. **Open-Ended Reformulation Feasibility:** The question should be suitable for reformatting into an open-ended format. If the question cannot be easily reformulated into an open-ended problem and a clear ground-truth answer, mark it as \"Not Reformulatable\".\n\nFor each question, provide one of the following evaluations:  \n- \"Pass\" (The question meets all the criteria.)  \n- \"Too Simple\"  \n- \"Ambiguous Answer\"  \n- \"Not Reformulatable\" ",
  "gpt_filter_response": "Ambiguous Answer"
}