{
  "question": "王某在未依法取得许可的情况下购买氣化钠并存储于车间内，被以非法买卖、存储危险物质罪提起公诉。法院认为，氤化钠对人体和环境具有极大毒害性，属于《刑法》第125条第2款规定的毒害性物质，王某未经许可购买氯化钠，虽只有购买行为，但刑法条文中的“非法买卖”并不要求兼有买进和卖出的行为，王某罪名成立。关于该案，下列说法正确的是：",
  "options": {
    "A": "法官对“非法买卖”进行了目的解释",
    "B": "查明和确认“王某非法买卖毒害性物质”的过程是一个与法律适用无关的过程",
    "C": "对“非法买卖\"的解释属于外部证成",
    "D": "内部证成关涉的是从前提到结论之间的推论是否有效"
  },
  "answer_idx": "ACD",
  "answer": "法官对“非法买卖”进行了目的解释。对“非法买卖\"的解释属于外部证成。内部证成关涉的是从前提到结论之间的推论是否有效",
  "process_id": 67,
  "options_str": "A. 法官对“非法买卖”进行了目的解释\nB. 查明和确认“王某非法买卖毒害性物质”的过程是一个与法律适用无关的过程\nC. 对“非法买卖\"的解释属于外部证成\nD. 内部证成关涉的是从前提到结论之间的推论是否有效",
  "gpt_filter_query": "<Multiple-choice Question>\n王某在未依法取得许可的情况下购买氣化钠并存储于车间内，被以非法买卖、存储危险物质罪提起公诉。法院认为，氤化钠对人体和环境具有极大毒害性，属于《刑法》第125条第2款规定的毒害性物质，王某未经许可购买氯化钠，虽只有购买行为，但刑法条文中的“非法买卖”并不要求兼有买进和卖出的行为，王某罪名成立。关于该案，下列说法正确的是：\nA. 法官对“非法买卖”进行了目的解释\nB. 查明和确认“王某非法买卖毒害性物质”的过程是一个与法律适用无关的过程\nC. 对“非法买卖\"的解释属于外部证成\nD. 内部证成关涉的是从前提到结论之间的推论是否有效\nCorrect Answer: 法官对“非法买卖”进行了目的解释。对“非法买卖\"的解释属于外部证成。内部证成关涉的是从前提到结论之间的推论是否有效\n</Multiple-choice Question>\n\nYou are an expert in filtering and evaluating multiple-choice questions for advanced reasoning tasks. Your job is to evaluate a given question and determine whether it meets the following criteria: \n1. **Depth of Reasoning:** The question should require deeper reasoning. If the question appears too simple, mark it as \"Too Simple\".\n2. **Unambiguous Correct Answer:** The question must have a unique and unambiguous correct answer. If the question asks for \"incorrect options\" or allows for multiple correct answers, mark it as \"Ambiguous Answer\".\n3. **Open-Ended Reformulation Feasibility:** The question should be suitable for reformatting into an open-ended format. If the question cannot be easily reformulated into an open-ended problem and a clear ground-truth answer, mark it as \"Not Reformulatable\".\n\nFor each question, provide one of the following evaluations:  \n- \"Pass\" (The question meets all the criteria.)  \n- \"Too Simple\"  \n- \"Ambiguous Answer\"  \n- \"Not Reformulatable\" ",
  "gpt_filter_response": "Pass",
  "gpt_reformat_query": "I will provide you with a multiple-choice question, and your task is to rewrite it into an open-ended question, along with a Ground-True Answer. The requirements are:\n\n1. The question must be specific, targeting the point being tested in the original multiple-choice question. Ensure it is open-ended, meaning no options are provided, but there must be a definitive Ground-True Answer.\n2. Based on the correct answer from the original question, provide a concise Ground-True Answer. The answer should allow for precise matching to determine whether the model's response is correct.\n\nHere is the multiple-choice question for you to rewrite:\n<Multiple-choice Question>\n王某在未依法取得许可的情况下购买氣化钠并存储于车间内，被以非法买卖、存储危险物质罪提起公诉。法院认为，氤化钠对人体和环境具有极大毒害性，属于《刑法》第125条第2款规定的毒害性物质，王某未经许可购买氯化钠，虽只有购买行为，但刑法条文中的“非法买卖”并不要求兼有买进和卖出的行为，王某罪名成立。关于该案，下列说法正确的是：\nA. 法官对“非法买卖”进行了目的解释\nB. 查明和确认“王某非法买卖毒害性物质”的过程是一个与法律适用无关的过程\nC. 对“非法买卖\"的解释属于外部证成\nD. 内部证成关涉的是从前提到结论之间的推论是否有效\nCorrect Answer: 法官对“非法买卖”进行了目的解释。对“非法买卖\"的解释属于外部证成。内部证成关涉的是从前提到结论之间的推论是否有效\n</Multiple-choice Question>\n\nPlease output the result in the following JSON format:\n```json\n{\n\"Open-ended Verifiable Question\": \"...\",\n\"Ground-True Answer\": \"...\"\n}\n```",
  "gpt_reformat_response": "{\n\"Open-ended Verifiable Question\": \"在王某未经许可购买并存储剧毒物质的案件中，法院认定‘非法买卖’并不要求兼有买入与卖出。请指出：法官对‘非法买卖’一词采用了何种解释方法；该对‘非法买卖’的解释在证成结构中属于内部证成还是外部证成；以及内部证成关注的核心问题是什么。\",\n\"Ground-True Answer\": \"目的解释；外部证成；内部证成关注的是从前提到结论之间推论是否有效\"\n}",
  "Open-ended Verifiable Question": "在王某未经许可购买并存储剧毒物质的案件中，法院认定‘非法买卖’并不要求兼有买入与卖出。请指出：法官对‘非法买卖’一词采用了何种解释方法；该对‘非法买卖’的解释在证成结构中属于内部证成还是外部证成；以及内部证成关注的核心问题是什么。",
  "Ground-True Answer": "目的解释；外部证成；内部证成关注的是从前提到结论之间推论是否有效"
}