{
  "question": "关于追诉时效，下列哪一选项是正确的？",
  "options": {
    "A": "《刑法》规定，法定最高刑为不满5年有期徒刑的，经过5年不再追诉。危险驾驶罪的法定刑为拘役，不能适用该规定计算危险驾驶罪的追诉时效",
    "B": "在共同犯罪中，对主犯与从犯适用不同的法定刑时，应分别计算各自的追诉时效，不得按照主犯适用的法定刑计算从犯的追诉期限",
    "C": "追诉时效实际上属于刑事诉讼的内容，刑事诉讼采取从新原则，故对刑法所规定的追诉时效，不适用从旧兼从轻原则",
    "D": "刘某故意杀人后逃往国外18年，在国外因伪造私人印章（在我国不构成犯罪）被通缉时潜回国内。4年后，其杀人案件被公安机关发现。因追诉时效中断，应追诉刘某故意杀人的罪行"
  },
  "answer_idx": "B",
  "answer": "在共同犯罪中，对主犯与从犯适用不同的法定刑时，应分别计算各自的追诉时效，不得按照主犯适用的法定刑计算从犯的追诉期限",
  "process_id": 70,
  "options_str": "A. 《刑法》规定，法定最高刑为不满5年有期徒刑的，经过5年不再追诉。危险驾驶罪的法定刑为拘役，不能适用该规定计算危险驾驶罪的追诉时效\nB. 在共同犯罪中，对主犯与从犯适用不同的法定刑时，应分别计算各自的追诉时效，不得按照主犯适用的法定刑计算从犯的追诉期限\nC. 追诉时效实际上属于刑事诉讼的内容，刑事诉讼采取从新原则，故对刑法所规定的追诉时效，不适用从旧兼从轻原则\nD. 刘某故意杀人后逃往国外18年，在国外因伪造私人印章（在我国不构成犯罪）被通缉时潜回国内。4年后，其杀人案件被公安机关发现。因追诉时效中断，应追诉刘某故意杀人的罪行",
  "gpt_filter_query": "<Multiple-choice Question>\n关于追诉时效，下列哪一选项是正确的？\nA. 《刑法》规定，法定最高刑为不满5年有期徒刑的，经过5年不再追诉。危险驾驶罪的法定刑为拘役，不能适用该规定计算危险驾驶罪的追诉时效\nB. 在共同犯罪中，对主犯与从犯适用不同的法定刑时，应分别计算各自的追诉时效，不得按照主犯适用的法定刑计算从犯的追诉期限\nC. 追诉时效实际上属于刑事诉讼的内容，刑事诉讼采取从新原则，故对刑法所规定的追诉时效，不适用从旧兼从轻原则\nD. 刘某故意杀人后逃往国外18年，在国外因伪造私人印章（在我国不构成犯罪）被通缉时潜回国内。4年后，其杀人案件被公安机关发现。因追诉时效中断，应追诉刘某故意杀人的罪行\nCorrect Answer: 在共同犯罪中，对主犯与从犯适用不同的法定刑时，应分别计算各自的追诉时效，不得按照主犯适用的法定刑计算从犯的追诉期限\n</Multiple-choice Question>\n\nYou are an expert in filtering and evaluating multiple-choice questions for advanced reasoning tasks. Your job is to evaluate a given question and determine whether it meets the following criteria: \n1. **Depth of Reasoning:** The question should require deeper reasoning. If the question appears too simple, mark it as \"Too Simple\".\n2. **Unambiguous Correct Answer:** The question must have a unique and unambiguous correct answer. If the question asks for \"incorrect options\" or allows for multiple correct answers, mark it as \"Ambiguous Answer\".\n3. **Open-Ended Reformulation Feasibility:** The question should be suitable for reformatting into an open-ended format. If the question cannot be easily reformulated into an open-ended problem and a clear ground-truth answer, mark it as \"Not Reformulatable\".\n\nFor each question, provide one of the following evaluations:  \n- \"Pass\" (The question meets all the criteria.)  \n- \"Too Simple\"  \n- \"Ambiguous Answer\"  \n- \"Not Reformulatable\" ",
  "gpt_filter_response": "Pass",
  "gpt_reformat_query": "I will provide you with a multiple-choice question, and your task is to rewrite it into an open-ended question, along with a Ground-True Answer. The requirements are:\n\n1. The question must be specific, targeting the point being tested in the original multiple-choice question. Ensure it is open-ended, meaning no options are provided, but there must be a definitive Ground-True Answer.\n2. Based on the correct answer from the original question, provide a concise Ground-True Answer. The answer should allow for precise matching to determine whether the model's response is correct.\n\nHere is the multiple-choice question for you to rewrite:\n<Multiple-choice Question>\n关于追诉时效，下列哪一选项是正确的？\nA. 《刑法》规定，法定最高刑为不满5年有期徒刑的，经过5年不再追诉。危险驾驶罪的法定刑为拘役，不能适用该规定计算危险驾驶罪的追诉时效\nB. 在共同犯罪中，对主犯与从犯适用不同的法定刑时，应分别计算各自的追诉时效，不得按照主犯适用的法定刑计算从犯的追诉期限\nC. 追诉时效实际上属于刑事诉讼的内容，刑事诉讼采取从新原则，故对刑法所规定的追诉时效，不适用从旧兼从轻原则\nD. 刘某故意杀人后逃往国外18年，在国外因伪造私人印章（在我国不构成犯罪）被通缉时潜回国内。4年后，其杀人案件被公安机关发现。因追诉时效中断，应追诉刘某故意杀人的罪行\nCorrect Answer: 在共同犯罪中，对主犯与从犯适用不同的法定刑时，应分别计算各自的追诉时效，不得按照主犯适用的法定刑计算从犯的追诉期限\n</Multiple-choice Question>\n\nPlease output the result in the following JSON format:\n```json\n{\n\"Open-ended Verifiable Question\": \"...\",\n\"Ground-True Answer\": \"...\"\n}\n```",
  "gpt_reformat_response": "{\n\"Open-ended Verifiable Question\": \"在共同犯罪中，如果主犯与从犯适用的法定最高刑不同，追诉时效应如何计算？是否可以按照主犯适用的法定刑来计算从犯的追诉时效？请作出明确判断并说明原则。\",\n\"Ground-True Answer\": \"应分别按照各自适用的法定刑计算主犯与从犯的追诉时效，不得以主犯的法定刑计算从犯的追诉期限。\"\n}",
  "Open-ended Verifiable Question": "在共同犯罪中，如果主犯与从犯适用的法定最高刑不同，追诉时效应如何计算？是否可以按照主犯适用的法定刑来计算从犯的追诉时效？请作出明确判断并说明原则。",
  "Ground-True Answer": "应分别按照各自适用的法定刑计算主犯与从犯的追诉时效，不得以主犯的法定刑计算从犯的追诉期限。"
}