{
  "question": "关于贿赂犯罪的认定，下列哪些选项是正确的？",
  "options": {
    "A": "甲是公立高校普通任课教师，在学校委派其招生时，利用职务便利收受考生家长10万元。甲成立受贿罪",
    "B": "乙是国有医院副院长，收受医药代表10万元，承诺为病人开处方时多开相关药品。乙成立非国家工作人员受贿罪",
    "C": "丙是村委会主任，在村集体企业招投标过程中，利用职务收受他人财物10万元，为其谋利。丙成立非国家工作人员受贿罪",
    "D": "丁为国有公司临时工，与本公司办理采购业务的副总经理相勾结，收受10万元回扣归二人所有。丁构成受贿罪"
  },
  "answer_idx": "ABCD",
  "answer": "甲是公立高校普通任课教师，在学校委派其招生时，利用职务便利收受考生家长10万元。甲成立受贿罪。乙是国有医院副院长，收受医药代表10万元，承诺为病人开处方时多开相关药品。乙成立非国家工作人员受贿罪。丙是村委会主任，在村集体企业招投标过程中，利用职务收受他人财物10万元，为其谋利。丙成立非国家工作人员受贿罪。丁为国有公司临时工，与本公司办理采购业务的副总经理相勾结，收受10万元回扣归二人所有。丁构成受贿罪",
  "process_id": 77,
  "options_str": "A. 甲是公立高校普通任课教师，在学校委派其招生时，利用职务便利收受考生家长10万元。甲成立受贿罪\nB. 乙是国有医院副院长，收受医药代表10万元，承诺为病人开处方时多开相关药品。乙成立非国家工作人员受贿罪\nC. 丙是村委会主任，在村集体企业招投标过程中，利用职务收受他人财物10万元，为其谋利。丙成立非国家工作人员受贿罪\nD. 丁为国有公司临时工，与本公司办理采购业务的副总经理相勾结，收受10万元回扣归二人所有。丁构成受贿罪",
  "gpt_filter_query": "<Multiple-choice Question>\n关于贿赂犯罪的认定，下列哪些选项是正确的？\nA. 甲是公立高校普通任课教师，在学校委派其招生时，利用职务便利收受考生家长10万元。甲成立受贿罪\nB. 乙是国有医院副院长，收受医药代表10万元，承诺为病人开处方时多开相关药品。乙成立非国家工作人员受贿罪\nC. 丙是村委会主任，在村集体企业招投标过程中，利用职务收受他人财物10万元，为其谋利。丙成立非国家工作人员受贿罪\nD. 丁为国有公司临时工，与本公司办理采购业务的副总经理相勾结，收受10万元回扣归二人所有。丁构成受贿罪\nCorrect Answer: 甲是公立高校普通任课教师，在学校委派其招生时，利用职务便利收受考生家长10万元。甲成立受贿罪。乙是国有医院副院长，收受医药代表10万元，承诺为病人开处方时多开相关药品。乙成立非国家工作人员受贿罪。丙是村委会主任，在村集体企业招投标过程中，利用职务收受他人财物10万元，为其谋利。丙成立非国家工作人员受贿罪。丁为国有公司临时工，与本公司办理采购业务的副总经理相勾结，收受10万元回扣归二人所有。丁构成受贿罪\n</Multiple-choice Question>\n\nYou are an expert in filtering and evaluating multiple-choice questions for advanced reasoning tasks. Your job is to evaluate a given question and determine whether it meets the following criteria: \n1. **Depth of Reasoning:** The question should require deeper reasoning. If the question appears too simple, mark it as \"Too Simple\".\n2. **Unambiguous Correct Answer:** The question must have a unique and unambiguous correct answer. If the question asks for \"incorrect options\" or allows for multiple correct answers, mark it as \"Ambiguous Answer\".\n3. **Open-Ended Reformulation Feasibility:** The question should be suitable for reformatting into an open-ended format. If the question cannot be easily reformulated into an open-ended problem and a clear ground-truth answer, mark it as \"Not Reformulatable\".\n\nFor each question, provide one of the following evaluations:  \n- \"Pass\" (The question meets all the criteria.)  \n- \"Too Simple\"  \n- \"Ambiguous Answer\"  \n- \"Not Reformulatable\" ",
  "gpt_filter_response": "Ambiguous Answer"
}