{
  "question": "关于渎职犯罪，下列哪些选项是正确的？",
  "options": {
    "A": "县财政局副局长秦某工作时擅离办公室，其他办公室人员操作电炉不当，触电身亡并引发大火将办公楼烧毁。秦某触犯玩忽职守罪",
    "B": "县卫计局执法监督大队队长武某，未能发现何某在足疗店内非法开诊所行医，该诊所开张三天即造成一患者死亡。武某触犯玩忽职守罪",
    "C": "负责建房审批工作的干部柳某，徇情为拆迁范围内违规修建的房屋补办了建设许可证，房主凭此获得补偿款90万元。柳某触犯滥用职权罪",
    "D": "县长郑某擅自允许未经环境评估的水电工程开工，导致该县水域内濒危野生鱼类全部灭绝。郑某触犯滥用职权罪"
  },
  "answer_idx": "CD",
  "answer": "负责建房审批工作的干部柳某，徇情为拆迁范围内违规修建的房屋补办了建设许可证，房主凭此获得补偿款90万元。柳某触犯滥用职权罪。县长郑某擅自允许未经环境评估的水电工程开工，导致该县水域内濒危野生鱼类全部灭绝。郑某触犯滥用职权罪",
  "process_id": 78,
  "options_str": "A. 县财政局副局长秦某工作时擅离办公室，其他办公室人员操作电炉不当，触电身亡并引发大火将办公楼烧毁。秦某触犯玩忽职守罪\nB. 县卫计局执法监督大队队长武某，未能发现何某在足疗店内非法开诊所行医，该诊所开张三天即造成一患者死亡。武某触犯玩忽职守罪\nC. 负责建房审批工作的干部柳某，徇情为拆迁范围内违规修建的房屋补办了建设许可证，房主凭此获得补偿款90万元。柳某触犯滥用职权罪\nD. 县长郑某擅自允许未经环境评估的水电工程开工，导致该县水域内濒危野生鱼类全部灭绝。郑某触犯滥用职权罪",
  "gpt_filter_query": "<Multiple-choice Question>\n关于渎职犯罪，下列哪些选项是正确的？\nA. 县财政局副局长秦某工作时擅离办公室，其他办公室人员操作电炉不当，触电身亡并引发大火将办公楼烧毁。秦某触犯玩忽职守罪\nB. 县卫计局执法监督大队队长武某，未能发现何某在足疗店内非法开诊所行医，该诊所开张三天即造成一患者死亡。武某触犯玩忽职守罪\nC. 负责建房审批工作的干部柳某，徇情为拆迁范围内违规修建的房屋补办了建设许可证，房主凭此获得补偿款90万元。柳某触犯滥用职权罪\nD. 县长郑某擅自允许未经环境评估的水电工程开工，导致该县水域内濒危野生鱼类全部灭绝。郑某触犯滥用职权罪\nCorrect Answer: 负责建房审批工作的干部柳某，徇情为拆迁范围内违规修建的房屋补办了建设许可证，房主凭此获得补偿款90万元。柳某触犯滥用职权罪。县长郑某擅自允许未经环境评估的水电工程开工，导致该县水域内濒危野生鱼类全部灭绝。郑某触犯滥用职权罪\n</Multiple-choice Question>\n\nYou are an expert in filtering and evaluating multiple-choice questions for advanced reasoning tasks. Your job is to evaluate a given question and determine whether it meets the following criteria: \n1. **Depth of Reasoning:** The question should require deeper reasoning. If the question appears too simple, mark it as \"Too Simple\".\n2. **Unambiguous Correct Answer:** The question must have a unique and unambiguous correct answer. If the question asks for \"incorrect options\" or allows for multiple correct answers, mark it as \"Ambiguous Answer\".\n3. **Open-Ended Reformulation Feasibility:** The question should be suitable for reformatting into an open-ended format. If the question cannot be easily reformulated into an open-ended problem and a clear ground-truth answer, mark it as \"Not Reformulatable\".\n\nFor each question, provide one of the following evaluations:  \n- \"Pass\" (The question meets all the criteria.)  \n- \"Too Simple\"  \n- \"Ambiguous Answer\"  \n- \"Not Reformulatable\" ",
  "gpt_filter_response": "Ambiguous Answer"
}