{
  "question": "（―）甲将私家车借给无驾照的乙使用。乙夜间驾车与其叔丙出行，途中遇刘某过马路，不慎将其撞成重伤，车辆亦受损。丙下车查看情况，对乙谎称自己留下打电话叫救护车，让乙赶紧将车开走。乙离去后，丙将刘某藏匿在草丛中离开。刘某因错过抢救时机身亡。（事实一）为逃避刑事责任，乙找到有驾照的丁，让丁去公安机关“自首”，谎称案发当晚是丁驾车。丁照办。公安机关找甲取证时，甲想到若说是乙造成事故，自己作为被保险人就无法从保险公司获得车损赔偿，便谎称当晚将车借给了丁。（事实二）后甲找到在私营保险公司当定损员的朋友陈某，告知其真相，请求其帮忙向保险公司申请赔偿。陈某遂向保险公司报告说是丁驾车造成事故，并隐瞒其他不利于甲的事实。甲顺利获得7万元保险赔偿。（事实三）请回答第86-88题。关于事实一的分析，下列选项正确的是：",
  "options": {
    "A": "乙交通肇事后逃逸致刘某死亡，构成交通肇事逃逸致人死亡",
    "B": "乙交通肇事且致使刘某死亡，构成交通肇事罪与过失致人死亡罪，数罪并罚",
    "C": "丙与乙都应对刘某的死亡负责，构成交通肇事罪的共同正犯",
    "D": "丙将刘某藏匿致使其错过抢救时机身亡，构成故意杀人罪"
  },
  "answer_idx": "D",
  "answer": "丙将刘某藏匿致使其错过抢救时机身亡，构成故意杀人罪",
  "process_id": 81,
  "options_str": "A. 乙交通肇事后逃逸致刘某死亡，构成交通肇事逃逸致人死亡\nB. 乙交通肇事且致使刘某死亡，构成交通肇事罪与过失致人死亡罪，数罪并罚\nC. 丙与乙都应对刘某的死亡负责，构成交通肇事罪的共同正犯\nD. 丙将刘某藏匿致使其错过抢救时机身亡，构成故意杀人罪",
  "gpt_filter_query": "<Multiple-choice Question>\n（―）甲将私家车借给无驾照的乙使用。乙夜间驾车与其叔丙出行，途中遇刘某过马路，不慎将其撞成重伤，车辆亦受损。丙下车查看情况，对乙谎称自己留下打电话叫救护车，让乙赶紧将车开走。乙离去后，丙将刘某藏匿在草丛中离开。刘某因错过抢救时机身亡。（事实一）为逃避刑事责任，乙找到有驾照的丁，让丁去公安机关“自首”，谎称案发当晚是丁驾车。丁照办。公安机关找甲取证时，甲想到若说是乙造成事故，自己作为被保险人就无法从保险公司获得车损赔偿，便谎称当晚将车借给了丁。（事实二）后甲找到在私营保险公司当定损员的朋友陈某，告知其真相，请求其帮忙向保险公司申请赔偿。陈某遂向保险公司报告说是丁驾车造成事故，并隐瞒其他不利于甲的事实。甲顺利获得7万元保险赔偿。（事实三）请回答第86-88题。关于事实一的分析，下列选项正确的是：\nA. 乙交通肇事后逃逸致刘某死亡，构成交通肇事逃逸致人死亡\nB. 乙交通肇事且致使刘某死亡，构成交通肇事罪与过失致人死亡罪，数罪并罚\nC. 丙与乙都应对刘某的死亡负责，构成交通肇事罪的共同正犯\nD. 丙将刘某藏匿致使其错过抢救时机身亡，构成故意杀人罪\nCorrect Answer: 丙将刘某藏匿致使其错过抢救时机身亡，构成故意杀人罪\n</Multiple-choice Question>\n\nYou are an expert in filtering and evaluating multiple-choice questions for advanced reasoning tasks. Your job is to evaluate a given question and determine whether it meets the following criteria: \n1. **Depth of Reasoning:** The question should require deeper reasoning. If the question appears too simple, mark it as \"Too Simple\".\n2. **Unambiguous Correct Answer:** The question must have a unique and unambiguous correct answer. If the question asks for \"incorrect options\" or allows for multiple correct answers, mark it as \"Ambiguous Answer\".\n3. **Open-Ended Reformulation Feasibility:** The question should be suitable for reformatting into an open-ended format. If the question cannot be easily reformulated into an open-ended problem and a clear ground-truth answer, mark it as \"Not Reformulatable\".\n\nFor each question, provide one of the following evaluations:  \n- \"Pass\" (The question meets all the criteria.)  \n- \"Too Simple\"  \n- \"Ambiguous Answer\"  \n- \"Not Reformulatable\" ",
  "gpt_filter_response": "Pass",
  "gpt_reformat_query": "I will provide you with a multiple-choice question, and your task is to rewrite it into an open-ended question, along with a Ground-True Answer. The requirements are:\n\n1. The question must be specific, targeting the point being tested in the original multiple-choice question. Ensure it is open-ended, meaning no options are provided, but there must be a definitive Ground-True Answer.\n2. Based on the correct answer from the original question, provide a concise Ground-True Answer. The answer should allow for precise matching to determine whether the model's response is correct.\n\nHere is the multiple-choice question for you to rewrite:\n<Multiple-choice Question>\n（―）甲将私家车借给无驾照的乙使用。乙夜间驾车与其叔丙出行，途中遇刘某过马路，不慎将其撞成重伤，车辆亦受损。丙下车查看情况，对乙谎称自己留下打电话叫救护车，让乙赶紧将车开走。乙离去后，丙将刘某藏匿在草丛中离开。刘某因错过抢救时机身亡。（事实一）为逃避刑事责任，乙找到有驾照的丁，让丁去公安机关“自首”，谎称案发当晚是丁驾车。丁照办。公安机关找甲取证时，甲想到若说是乙造成事故，自己作为被保险人就无法从保险公司获得车损赔偿，便谎称当晚将车借给了丁。（事实二）后甲找到在私营保险公司当定损员的朋友陈某，告知其真相，请求其帮忙向保险公司申请赔偿。陈某遂向保险公司报告说是丁驾车造成事故，并隐瞒其他不利于甲的事实。甲顺利获得7万元保险赔偿。（事实三）请回答第86-88题。关于事实一的分析，下列选项正确的是：\nA. 乙交通肇事后逃逸致刘某死亡，构成交通肇事逃逸致人死亡\nB. 乙交通肇事且致使刘某死亡，构成交通肇事罪与过失致人死亡罪，数罪并罚\nC. 丙与乙都应对刘某的死亡负责，构成交通肇事罪的共同正犯\nD. 丙将刘某藏匿致使其错过抢救时机身亡，构成故意杀人罪\nCorrect Answer: 丙将刘某藏匿致使其错过抢救时机身亡，构成故意杀人罪\n</Multiple-choice Question>\n\nPlease output the result in the following JSON format:\n```json\n{\n\"Open-ended Verifiable Question\": \"...\",\n\"Ground-True Answer\": \"...\"\n}\n```",
  "gpt_reformat_response": "{\n\"Open-ended Verifiable Question\": \"在事实一中，乙肇事后被丙劝离现场，丙将重伤的刘某藏匿于草丛致其错过抢救时机而死亡。请问丙就刘某的死亡构成何种具体犯罪？请给出明确罪名。\",\n\"Ground-True Answer\": \"故意杀人罪\"\n}",
  "Open-ended Verifiable Question": "在事实一中，乙肇事后被丙劝离现场，丙将重伤的刘某藏匿于草丛致其错过抢救时机而死亡。请问丙就刘某的死亡构成何种具体犯罪？请给出明确罪名。",
  "Ground-True Answer": "故意杀人罪"
}