{
  "question": "（―）甲将私家车借给无驾照的乙使用。乙夜间驾车与其叔丙出行，途中遇刘某过马路，不慎将其撞成重伤，车辆亦受损。丙下车查看情况，对乙谎称自己留下打电话叫救护车，让乙赶紧将车开走。乙离去后，丙将刘某藏匿在草丛中离开。刘某因错过抢救时机身亡。（事实一）为逃避刑事责任，乙找到有驾照的丁，让丁去公安机关“自首”，谎称案发当晚是丁驾车。丁照办。公安机关找甲取证时，甲想到若说是乙造成事故，自己作为被保险人就无法从保险公司获得车损赔偿，便谎称当晚将车借给了丁。（事实二）后甲找到在私营保险公司当定损员的朋友陈某，告知其真相，请求其帮忙向保险公司申请赔偿。陈某遂向保险公司报告说是丁驾车造成事故，并隐瞒其他不利于甲的事实。甲顺利获得7万元保险赔偿。（事实三）请回答第86-88题。关于事实二的分析，下列选项错误的是：",
  "options": {
    "A": "伪证罪与包庇罪是相互排斥的关系，甲不可能既构成伪证罪又构成包庇罪",
    "B": "甲的主观目的在于骗取保险金，没有妨害司法的故意，不构成妨害司法罪",
    "C": "乙唆使丁代替自己承担交通肇事的责任，就此构成教唆犯",
    "D": "丁的“自首''行为干扰了司法机关的正常活动，触犯包庇罪"
  },
  "answer_idx": "ABC",
  "answer": "伪证罪与包庇罪是相互排斥的关系，甲不可能既构成伪证罪又构成包庇罪。甲的主观目的在于骗取保险金，没有妨害司法的故意，不构成妨害司法罪。乙唆使丁代替自己承担交通肇事的责任，就此构成教唆犯",
  "process_id": 82,
  "options_str": "A. 伪证罪与包庇罪是相互排斥的关系，甲不可能既构成伪证罪又构成包庇罪\nB. 甲的主观目的在于骗取保险金，没有妨害司法的故意，不构成妨害司法罪\nC. 乙唆使丁代替自己承担交通肇事的责任，就此构成教唆犯\nD. 丁的“自首''行为干扰了司法机关的正常活动，触犯包庇罪",
  "gpt_filter_query": "<Multiple-choice Question>\n（―）甲将私家车借给无驾照的乙使用。乙夜间驾车与其叔丙出行，途中遇刘某过马路，不慎将其撞成重伤，车辆亦受损。丙下车查看情况，对乙谎称自己留下打电话叫救护车，让乙赶紧将车开走。乙离去后，丙将刘某藏匿在草丛中离开。刘某因错过抢救时机身亡。（事实一）为逃避刑事责任，乙找到有驾照的丁，让丁去公安机关“自首”，谎称案发当晚是丁驾车。丁照办。公安机关找甲取证时，甲想到若说是乙造成事故，自己作为被保险人就无法从保险公司获得车损赔偿，便谎称当晚将车借给了丁。（事实二）后甲找到在私营保险公司当定损员的朋友陈某，告知其真相，请求其帮忙向保险公司申请赔偿。陈某遂向保险公司报告说是丁驾车造成事故，并隐瞒其他不利于甲的事实。甲顺利获得7万元保险赔偿。（事实三）请回答第86-88题。关于事实二的分析，下列选项错误的是：\nA. 伪证罪与包庇罪是相互排斥的关系，甲不可能既构成伪证罪又构成包庇罪\nB. 甲的主观目的在于骗取保险金，没有妨害司法的故意，不构成妨害司法罪\nC. 乙唆使丁代替自己承担交通肇事的责任，就此构成教唆犯\nD. 丁的“自首''行为干扰了司法机关的正常活动，触犯包庇罪\nCorrect Answer: 伪证罪与包庇罪是相互排斥的关系，甲不可能既构成伪证罪又构成包庇罪。甲的主观目的在于骗取保险金，没有妨害司法的故意，不构成妨害司法罪。乙唆使丁代替自己承担交通肇事的责任，就此构成教唆犯\n</Multiple-choice Question>\n\nYou are an expert in filtering and evaluating multiple-choice questions for advanced reasoning tasks. Your job is to evaluate a given question and determine whether it meets the following criteria: \n1. **Depth of Reasoning:** The question should require deeper reasoning. If the question appears too simple, mark it as \"Too Simple\".\n2. **Unambiguous Correct Answer:** The question must have a unique and unambiguous correct answer. If the question asks for \"incorrect options\" or allows for multiple correct answers, mark it as \"Ambiguous Answer\".\n3. **Open-Ended Reformulation Feasibility:** The question should be suitable for reformatting into an open-ended format. If the question cannot be easily reformulated into an open-ended problem and a clear ground-truth answer, mark it as \"Not Reformulatable\".\n\nFor each question, provide one of the following evaluations:  \n- \"Pass\" (The question meets all the criteria.)  \n- \"Too Simple\"  \n- \"Ambiguous Answer\"  \n- \"Not Reformulatable\" ",
  "gpt_filter_response": "Ambiguous Answer"
}