{
  "question": "（―）甲将私家车借给无驾照的乙使用。乙夜间驾车与其叔丙出行，途中遇刘某过马路，不慎将其撞成重伤，车辆亦受损。丙下车查看情况，对乙谎称自己留下打电话叫救护车，让乙赶紧将车开走。乙离去后，丙将刘某藏匿在草丛中离开。刘某因错过抢救时机身亡。（事实一）为逃避刑事责任，乙找到有驾照的丁，让丁去公安机关“自首”，谎称案发当晚是丁驾车。丁照办。公安机关找甲取证时，甲想到若说是乙造成事故，自己作为被保险人就无法从保险公司获得车损赔偿，便谎称当晚将车借给了丁。（事实二）后甲找到在私营保险公司当定损员的朋友陈某，告知其真相，请求其帮忙向保险公司申请赔偿。陈某遂向保险公司报告说是丁驾车造成事故，并隐瞒其他不利于甲的事实。甲顺利获得7万元保险赔偿。（事实三）请回答第86-88题。关于事实三的分析，下列选项正确的是：",
  "options": {
    "A": "甲对发生的保险事故编造虚假原因，骗取保险金，触犯保险诈骗罪",
    "B": "甲既触犯保险诈骗罪，又触犯诈骗罪，由于两罪性质不同，应数罪并罚",
    "C": "陈某未将保险金据为己有，因欠缺非法占有目的不构成职务侵占罪",
    "D": "陈某与甲密切配合，骗取保险金，两人构成保险诈骗罪的共犯"
  },
  "answer_idx": "AD",
  "answer": "甲对发生的保险事故编造虚假原因，骗取保险金，触犯保险诈骗罪。陈某与甲密切配合，骗取保险金，两人构成保险诈骗罪的共犯",
  "process_id": 83,
  "options_str": "A. 甲对发生的保险事故编造虚假原因，骗取保险金，触犯保险诈骗罪\nB. 甲既触犯保险诈骗罪，又触犯诈骗罪，由于两罪性质不同，应数罪并罚\nC. 陈某未将保险金据为己有，因欠缺非法占有目的不构成职务侵占罪\nD. 陈某与甲密切配合，骗取保险金，两人构成保险诈骗罪的共犯",
  "gpt_filter_query": "<Multiple-choice Question>\n（―）甲将私家车借给无驾照的乙使用。乙夜间驾车与其叔丙出行，途中遇刘某过马路，不慎将其撞成重伤，车辆亦受损。丙下车查看情况，对乙谎称自己留下打电话叫救护车，让乙赶紧将车开走。乙离去后，丙将刘某藏匿在草丛中离开。刘某因错过抢救时机身亡。（事实一）为逃避刑事责任，乙找到有驾照的丁，让丁去公安机关“自首”，谎称案发当晚是丁驾车。丁照办。公安机关找甲取证时，甲想到若说是乙造成事故，自己作为被保险人就无法从保险公司获得车损赔偿，便谎称当晚将车借给了丁。（事实二）后甲找到在私营保险公司当定损员的朋友陈某，告知其真相，请求其帮忙向保险公司申请赔偿。陈某遂向保险公司报告说是丁驾车造成事故，并隐瞒其他不利于甲的事实。甲顺利获得7万元保险赔偿。（事实三）请回答第86-88题。关于事实三的分析，下列选项正确的是：\nA. 甲对发生的保险事故编造虚假原因，骗取保险金，触犯保险诈骗罪\nB. 甲既触犯保险诈骗罪，又触犯诈骗罪，由于两罪性质不同，应数罪并罚\nC. 陈某未将保险金据为己有，因欠缺非法占有目的不构成职务侵占罪\nD. 陈某与甲密切配合，骗取保险金，两人构成保险诈骗罪的共犯\nCorrect Answer: 甲对发生的保险事故编造虚假原因，骗取保险金，触犯保险诈骗罪。陈某与甲密切配合，骗取保险金，两人构成保险诈骗罪的共犯\n</Multiple-choice Question>\n\nYou are an expert in filtering and evaluating multiple-choice questions for advanced reasoning tasks. Your job is to evaluate a given question and determine whether it meets the following criteria: \n1. **Depth of Reasoning:** The question should require deeper reasoning. If the question appears too simple, mark it as \"Too Simple\".\n2. **Unambiguous Correct Answer:** The question must have a unique and unambiguous correct answer. If the question asks for \"incorrect options\" or allows for multiple correct answers, mark it as \"Ambiguous Answer\".\n3. **Open-Ended Reformulation Feasibility:** The question should be suitable for reformatting into an open-ended format. If the question cannot be easily reformulated into an open-ended problem and a clear ground-truth answer, mark it as \"Not Reformulatable\".\n\nFor each question, provide one of the following evaluations:  \n- \"Pass\" (The question meets all the criteria.)  \n- \"Too Simple\"  \n- \"Ambiguous Answer\"  \n- \"Not Reformulatable\" ",
  "gpt_filter_response": "Pass",
  "gpt_reformat_query": "I will provide you with a multiple-choice question, and your task is to rewrite it into an open-ended question, along with a Ground-True Answer. The requirements are:\n\n1. The question must be specific, targeting the point being tested in the original multiple-choice question. Ensure it is open-ended, meaning no options are provided, but there must be a definitive Ground-True Answer.\n2. Based on the correct answer from the original question, provide a concise Ground-True Answer. The answer should allow for precise matching to determine whether the model's response is correct.\n\nHere is the multiple-choice question for you to rewrite:\n<Multiple-choice Question>\n（―）甲将私家车借给无驾照的乙使用。乙夜间驾车与其叔丙出行，途中遇刘某过马路，不慎将其撞成重伤，车辆亦受损。丙下车查看情况，对乙谎称自己留下打电话叫救护车，让乙赶紧将车开走。乙离去后，丙将刘某藏匿在草丛中离开。刘某因错过抢救时机身亡。（事实一）为逃避刑事责任，乙找到有驾照的丁，让丁去公安机关“自首”，谎称案发当晚是丁驾车。丁照办。公安机关找甲取证时，甲想到若说是乙造成事故，自己作为被保险人就无法从保险公司获得车损赔偿，便谎称当晚将车借给了丁。（事实二）后甲找到在私营保险公司当定损员的朋友陈某，告知其真相，请求其帮忙向保险公司申请赔偿。陈某遂向保险公司报告说是丁驾车造成事故，并隐瞒其他不利于甲的事实。甲顺利获得7万元保险赔偿。（事实三）请回答第86-88题。关于事实三的分析，下列选项正确的是：\nA. 甲对发生的保险事故编造虚假原因，骗取保险金，触犯保险诈骗罪\nB. 甲既触犯保险诈骗罪，又触犯诈骗罪，由于两罪性质不同，应数罪并罚\nC. 陈某未将保险金据为己有，因欠缺非法占有目的不构成职务侵占罪\nD. 陈某与甲密切配合，骗取保险金，两人构成保险诈骗罪的共犯\nCorrect Answer: 甲对发生的保险事故编造虚假原因，骗取保险金，触犯保险诈骗罪。陈某与甲密切配合，骗取保险金，两人构成保险诈骗罪的共犯\n</Multiple-choice Question>\n\nPlease output the result in the following JSON format:\n```json\n{\n\"Open-ended Verifiable Question\": \"...\",\n\"Ground-True Answer\": \"...\"\n}\n```",
  "gpt_reformat_response": "{\n\"Open-ended Verifiable Question\": \"在事实三中，甲为获取车损赔偿，明知真实情况却与定损员陈某串通，虚构由丁驾车导致事故并隐瞒不利事实，从保险公司骗得7万元。请指出：甲构成何种犯罪？陈某在其中的刑事责任如何认定？\",\n\"Ground-True Answer\": \"甲构成保险诈骗罪；陈某与甲密切配合骗取保险金，构成保险诈骗罪的共犯。\"\n}",
  "Open-ended Verifiable Question": "在事实三中，甲为获取车损赔偿，明知真实情况却与定损员陈某串通，虚构由丁驾车导致事故并隐瞒不利事实，从保险公司骗得7万元。请指出：甲构成何种犯罪？陈某在其中的刑事责任如何认定？",
  "Ground-True Answer": "甲构成保险诈骗罪；陈某与甲密切配合骗取保险金，构成保险诈骗罪的共犯。"
}