{
  "question": "（五）市工商局认定豪美公司的行为符合《广告法》第28条第2款第2项规定的“商品或者服务有关的允诺等信息与实际情况不符，对购买行为有实质性影响”情形，属发布虚假广告，予以行政处罚。豪美公司向省工商局申请行政复议，省工商局受理。请回答第97〜99题。如省工商局在复议时认定，豪美公司的行为符合《广告法》第28条第2款第4项规定的“虚构使用商品或者接受服务的效果''情形，亦属发布虚假广告，在改变处罚依据后维持了原处罚决定。公司不服起诉。下列说法正确的是：",
  "options": {
    "A": "被告为市工商局和省工商局",
    "B": "被告为省工商局",
    "C": "市工商局所在地的法院对本案有管辖权",
    "D": "省工商局所在地的法院对本案无管辖权"
  },
  "answer_idx": "AC",
  "answer": "被告为市工商局和省工商局。市工商局所在地的法院对本案有管辖权",
  "process_id": 84,
  "options_str": "A. 被告为市工商局和省工商局\nB. 被告为省工商局\nC. 市工商局所在地的法院对本案有管辖权\nD. 省工商局所在地的法院对本案无管辖权",
  "gpt_filter_query": "<Multiple-choice Question>\n（五）市工商局认定豪美公司的行为符合《广告法》第28条第2款第2项规定的“商品或者服务有关的允诺等信息与实际情况不符，对购买行为有实质性影响”情形，属发布虚假广告，予以行政处罚。豪美公司向省工商局申请行政复议，省工商局受理。请回答第97〜99题。如省工商局在复议时认定，豪美公司的行为符合《广告法》第28条第2款第4项规定的“虚构使用商品或者接受服务的效果''情形，亦属发布虚假广告，在改变处罚依据后维持了原处罚决定。公司不服起诉。下列说法正确的是：\nA. 被告为市工商局和省工商局\nB. 被告为省工商局\nC. 市工商局所在地的法院对本案有管辖权\nD. 省工商局所在地的法院对本案无管辖权\nCorrect Answer: 被告为市工商局和省工商局。市工商局所在地的法院对本案有管辖权\n</Multiple-choice Question>\n\nYou are an expert in filtering and evaluating multiple-choice questions for advanced reasoning tasks. Your job is to evaluate a given question and determine whether it meets the following criteria: \n1. **Depth of Reasoning:** The question should require deeper reasoning. If the question appears too simple, mark it as \"Too Simple\".\n2. **Unambiguous Correct Answer:** The question must have a unique and unambiguous correct answer. If the question asks for \"incorrect options\" or allows for multiple correct answers, mark it as \"Ambiguous Answer\".\n3. **Open-Ended Reformulation Feasibility:** The question should be suitable for reformatting into an open-ended format. If the question cannot be easily reformulated into an open-ended problem and a clear ground-truth answer, mark it as \"Not Reformulatable\".\n\nFor each question, provide one of the following evaluations:  \n- \"Pass\" (The question meets all the criteria.)  \n- \"Too Simple\"  \n- \"Ambiguous Answer\"  \n- \"Not Reformulatable\" ",
  "gpt_filter_response": "Pass",
  "gpt_reformat_query": "I will provide you with a multiple-choice question, and your task is to rewrite it into an open-ended question, along with a Ground-True Answer. The requirements are:\n\n1. The question must be specific, targeting the point being tested in the original multiple-choice question. Ensure it is open-ended, meaning no options are provided, but there must be a definitive Ground-True Answer.\n2. Based on the correct answer from the original question, provide a concise Ground-True Answer. The answer should allow for precise matching to determine whether the model's response is correct.\n\nHere is the multiple-choice question for you to rewrite:\n<Multiple-choice Question>\n（五）市工商局认定豪美公司的行为符合《广告法》第28条第2款第2项规定的“商品或者服务有关的允诺等信息与实际情况不符，对购买行为有实质性影响”情形，属发布虚假广告，予以行政处罚。豪美公司向省工商局申请行政复议，省工商局受理。请回答第97〜99题。如省工商局在复议时认定，豪美公司的行为符合《广告法》第28条第2款第4项规定的“虚构使用商品或者接受服务的效果''情形，亦属发布虚假广告，在改变处罚依据后维持了原处罚决定。公司不服起诉。下列说法正确的是：\nA. 被告为市工商局和省工商局\nB. 被告为省工商局\nC. 市工商局所在地的法院对本案有管辖权\nD. 省工商局所在地的法院对本案无管辖权\nCorrect Answer: 被告为市工商局和省工商局。市工商局所在地的法院对本案有管辖权\n</Multiple-choice Question>\n\nPlease output the result in the following JSON format:\n```json\n{\n\"Open-ended Verifiable Question\": \"...\",\n\"Ground-True Answer\": \"...\"\n}\n```",
  "gpt_reformat_response": "{\n\"Open-ended Verifiable Question\": \"在市工商局以《广告法》第28条第2款第2项为依据对豪美公司作出虚假广告行政处罚后，豪美公司申请复议，省工商局在复议中改以第28条第2款第4项为依据并维持原处罚决定。豪美公司提起行政诉讼时：应当以哪些机关为被告？由哪一地的法院对该案有管辖权？\",\n\"Ground-True Answer\": \"被告为市工商局和省工商局；市工商局所在地的法院有管辖权\"\n}",
  "Open-ended Verifiable Question": "在市工商局以《广告法》第28条第2款第2项为依据对豪美公司作出虚假广告行政处罚后，豪美公司申请复议，省工商局在复议中改以第28条第2款第4项为依据并维持原处罚决定。豪美公司提起行政诉讼时：应当以哪些机关为被告？由哪一地的法院对该案有管辖权？",
  "Ground-True Answer": "被告为市工商局和省工商局；市工商局所在地的法院有管辖权"
}