{
  "question": "（三）源圣公司有甲、乙、丙三位股东。2015年10月，源圣公司考察发现某环保项目发展前景可观，为解决资金不足问题，经人推荐，霓美公司出资1亿元现金入股源圣公司，并办理了股权登记。增资后，霓美公司持股60%,甲持股25%,乙持股8%,丙持股7%,霓美公司总经理陈某兼任源圣公司董事长。2015年12月，霓美公司在陈某授意下将当时出资的1亿元现金全部转入霓美旗下的天富公司账户用于投资房地产。后因源圣公司现金不足，最终未能获得该环保项目，前期投入的500万元也无法收回。陈某忙于天富公司的房地产投资事宜，对此事并不关心。请回答第92〜94题。若源圣公司的股东会得以召开，该次股东会就霓美公司将资金转入天富公司之事进行决议。关于该次股东会决议的内容，根据有关规定，下列选项正确的是：",
  "options": {
    "A": "陈某连带承担返还1亿元的出资义务",
    "B": "霓美公司承担1亿元的利息损失",
    "C": "限制霓美公司的利润分配请求权",
    "D": "解除霓美公司的股东资格"
  },
  "answer_idx": "ABC",
  "answer": "陈某连带承担返还1亿元的出资义务。霓美公司承担1亿元的利息损失。限制霓美公司的利润分配请求权",
  "process_id": 94,
  "options_str": "A. 陈某连带承担返还1亿元的出资义务\nB. 霓美公司承担1亿元的利息损失\nC. 限制霓美公司的利润分配请求权\nD. 解除霓美公司的股东资格",
  "gpt_filter_query": "<Multiple-choice Question>\n（三）源圣公司有甲、乙、丙三位股东。2015年10月，源圣公司考察发现某环保项目发展前景可观，为解决资金不足问题，经人推荐，霓美公司出资1亿元现金入股源圣公司，并办理了股权登记。增资后，霓美公司持股60%,甲持股25%,乙持股8%,丙持股7%,霓美公司总经理陈某兼任源圣公司董事长。2015年12月，霓美公司在陈某授意下将当时出资的1亿元现金全部转入霓美旗下的天富公司账户用于投资房地产。后因源圣公司现金不足，最终未能获得该环保项目，前期投入的500万元也无法收回。陈某忙于天富公司的房地产投资事宜，对此事并不关心。请回答第92〜94题。若源圣公司的股东会得以召开，该次股东会就霓美公司将资金转入天富公司之事进行决议。关于该次股东会决议的内容，根据有关规定，下列选项正确的是：\nA. 陈某连带承担返还1亿元的出资义务\nB. 霓美公司承担1亿元的利息损失\nC. 限制霓美公司的利润分配请求权\nD. 解除霓美公司的股东资格\nCorrect Answer: 陈某连带承担返还1亿元的出资义务。霓美公司承担1亿元的利息损失。限制霓美公司的利润分配请求权\n</Multiple-choice Question>\n\nYou are an expert in filtering and evaluating multiple-choice questions for advanced reasoning tasks. Your job is to evaluate a given question and determine whether it meets the following criteria: \n1. **Depth of Reasoning:** The question should require deeper reasoning. If the question appears too simple, mark it as \"Too Simple\".\n2. **Unambiguous Correct Answer:** The question must have a unique and unambiguous correct answer. If the question asks for \"incorrect options\" or allows for multiple correct answers, mark it as \"Ambiguous Answer\".\n3. **Open-Ended Reformulation Feasibility:** The question should be suitable for reformatting into an open-ended format. If the question cannot be easily reformulated into an open-ended problem and a clear ground-truth answer, mark it as \"Not Reformulatable\".\n\nFor each question, provide one of the following evaluations:  \n- \"Pass\" (The question meets all the criteria.)  \n- \"Too Simple\"  \n- \"Ambiguous Answer\"  \n- \"Not Reformulatable\" ",
  "gpt_filter_response": "Ambiguous Answer"
}