{
  "question": "（四）住所地在H省K市L区的甲公司与住所地在F省E市D区的乙公司签订了一份钢材买卖合同，价款数额为90万元。合同在B市C区签订，双方约定合同履行地为W省Z市Y区，同时约定如因合同履行发生争议，由B市仲裁委员会仲裁。合同履行过程中，因钢材质量问题，甲公司与乙公司发生争议，甲公司欲申请仲裁解决。因B市有两个仲裁机构，分别为丙仲裁委员会和丁仲裁委员会（两个仲裁委员会所在地都在B市C区），乙公司认为合同中的仲裁条款无效，欲向有关机构申请确认仲裁条款无效。请回答第95〜97题。如相关机构确认仲裁条款无效，甲公司欲与乙公司达成协议，确定案件的管辖法院。关于双方可以协议选择的管辖法院，下列选项正确的是：",
  "options": {
    "A": "H省K市L区法院",
    "B": "F省E市D区法院",
    "C": "B市C区法院",
    "D": "。.可省2市丫区法院"
  },
  "answer_idx": "ABCD",
  "answer": "H省K市L区法院。F省E市D区法院。B市C区法院。。.可省2市丫区法院",
  "process_id": 95,
  "options_str": "A. H省K市L区法院\nB. F省E市D区法院\nC. B市C区法院\nD. 。.可省2市丫区法院",
  "gpt_filter_query": "<Multiple-choice Question>\n（四）住所地在H省K市L区的甲公司与住所地在F省E市D区的乙公司签订了一份钢材买卖合同，价款数额为90万元。合同在B市C区签订，双方约定合同履行地为W省Z市Y区，同时约定如因合同履行发生争议，由B市仲裁委员会仲裁。合同履行过程中，因钢材质量问题，甲公司与乙公司发生争议，甲公司欲申请仲裁解决。因B市有两个仲裁机构，分别为丙仲裁委员会和丁仲裁委员会（两个仲裁委员会所在地都在B市C区），乙公司认为合同中的仲裁条款无效，欲向有关机构申请确认仲裁条款无效。请回答第95〜97题。如相关机构确认仲裁条款无效，甲公司欲与乙公司达成协议，确定案件的管辖法院。关于双方可以协议选择的管辖法院，下列选项正确的是：\nA. H省K市L区法院\nB. F省E市D区法院\nC. B市C区法院\nD. 。.可省2市丫区法院\nCorrect Answer: H省K市L区法院。F省E市D区法院。B市C区法院。。.可省2市丫区法院\n</Multiple-choice Question>\n\nYou are an expert in filtering and evaluating multiple-choice questions for advanced reasoning tasks. Your job is to evaluate a given question and determine whether it meets the following criteria: \n1. **Depth of Reasoning:** The question should require deeper reasoning. If the question appears too simple, mark it as \"Too Simple\".\n2. **Unambiguous Correct Answer:** The question must have a unique and unambiguous correct answer. If the question asks for \"incorrect options\" or allows for multiple correct answers, mark it as \"Ambiguous Answer\".\n3. **Open-Ended Reformulation Feasibility:** The question should be suitable for reformatting into an open-ended format. If the question cannot be easily reformulated into an open-ended problem and a clear ground-truth answer, mark it as \"Not Reformulatable\".\n\nFor each question, provide one of the following evaluations:  \n- \"Pass\" (The question meets all the criteria.)  \n- \"Too Simple\"  \n- \"Ambiguous Answer\"  \n- \"Not Reformulatable\" ",
  "gpt_filter_response": "Pass",
  "gpt_reformat_query": "I will provide you with a multiple-choice question, and your task is to rewrite it into an open-ended question, along with a Ground-True Answer. The requirements are:\n\n1. The question must be specific, targeting the point being tested in the original multiple-choice question. Ensure it is open-ended, meaning no options are provided, but there must be a definitive Ground-True Answer.\n2. Based on the correct answer from the original question, provide a concise Ground-True Answer. The answer should allow for precise matching to determine whether the model's response is correct.\n\nHere is the multiple-choice question for you to rewrite:\n<Multiple-choice Question>\n（四）住所地在H省K市L区的甲公司与住所地在F省E市D区的乙公司签订了一份钢材买卖合同，价款数额为90万元。合同在B市C区签订，双方约定合同履行地为W省Z市Y区，同时约定如因合同履行发生争议，由B市仲裁委员会仲裁。合同履行过程中，因钢材质量问题，甲公司与乙公司发生争议，甲公司欲申请仲裁解决。因B市有两个仲裁机构，分别为丙仲裁委员会和丁仲裁委员会（两个仲裁委员会所在地都在B市C区），乙公司认为合同中的仲裁条款无效，欲向有关机构申请确认仲裁条款无效。请回答第95〜97题。如相关机构确认仲裁条款无效，甲公司欲与乙公司达成协议，确定案件的管辖法院。关于双方可以协议选择的管辖法院，下列选项正确的是：\nA. H省K市L区法院\nB. F省E市D区法院\nC. B市C区法院\nD. 。.可省2市丫区法院\nCorrect Answer: H省K市L区法院。F省E市D区法院。B市C区法院。。.可省2市丫区法院\n</Multiple-choice Question>\n\nPlease output the result in the following JSON format:\n```json\n{\n\"Open-ended Verifiable Question\": \"...\",\n\"Ground-True Answer\": \"...\"\n}\n```",
  "gpt_reformat_response": "{\n\"Open-ended Verifiable Question\": \"在甲公司（住所地：H省K市L区）与乙公司（住所地：F省E市D区）签订的钢材买卖合同中，双方约定由B市仲裁委员会仲裁，但B市存在两个仲裁机构且仲裁条款被确认无效。合同在B市C区签订，履行地约定为W省Z市Y区。在仲裁条款无效的情况下，若甲乙双方欲通过协议确定案件的管辖法院，根据民事诉讼法关于协议管辖的规定，双方可以协议选择哪些具体法院作为管辖法院？请列出所有可选法院的名称。\",\n\"Ground-True Answer\": \"H省K市L区法院；F省E市D区法院；B市C区法院；W省Z市Y区法院\"\n}",
  "Open-ended Verifiable Question": "在甲公司（住所地：H省K市L区）与乙公司（住所地：F省E市D区）签订的钢材买卖合同中，双方约定由B市仲裁委员会仲裁，但B市存在两个仲裁机构且仲裁条款被确认无效。合同在B市C区签订，履行地约定为W省Z市Y区。在仲裁条款无效的情况下，若甲乙双方欲通过协议确定案件的管辖法院，根据民事诉讼法关于协议管辖的规定，双方可以协议选择哪些具体法院作为管辖法院？请列出所有可选法院的名称。",
  "Ground-True Answer": "H省K市L区法院；F省E市D区法院；B市C区法院；W省Z市Y区法院"
}